Id_Presupuesto,Id_Obra,Nombre,Tipo_Presupuesto,Id_Modalidad,Fecha_Adjudicacion,Id_Presupuesto_Pertenece,Clave,Numero_Ampliacion
0000000114,0000000082,C-2510-607-6141-D/0091/2015  PAVIMENTACION DE LA CALLE PRIVADA BARCELONA TRAMO: MURCIA A BARCELONA COL. SAN JUAN BOSCO,ORIGINAL,0000000001,2015-05-22 00:00:00,,0,0
0000000115,0000000078,C-2510-607-6141-D/0092/2015  PAVIMENTACION DE LA CALLE CERRO DEL HORMIGERO TRAMO: DE RIO MAYO A MADRE MAURA COL. MARIA DE LA LUZ,ORIGINAL,0000000001,2015-05-22 00:00:00,,0,0
0000000116,0000000085,A-2010-301-6221-C/0093/2015  PRIMERA ETAPA DE LA RESTAURACIÓN DEL ARCO DE LA CALZADA,ORIGINAL,0000000001,2015-05-26 00:00:00,,0,0
0000000117,0000000085,AMPLIACION 1,AMPLIACION,0000000001,2015-05-26 00:00:00,0000000116,1,1
0000000118,0000000083,A-5018-3040-6221-H/0094/2015  PROYECTO EJECUTIVO DE RESTAURACIÓN DE LA CASA DE LA CULTURA "DIEGO RIVERA" UBICADA EN PORTALES DELICIAS Y PLAZA FUNDADORES ZONA CENTRO,ORIGINAL,0000000001,2015-06-01 00:00:00,,0,0
0000000119,0000000079,"A-5018-3040-6221-H/0095/2015  PROYECTO EJECUTIVO  DE CINETECA PLAZA CATEDRAL, UBICADO ALVARO OBREGON ZONA CENTRO",ORIGINAL,0000000001,2015-06-01 00:00:00,,0,0
0000000120,0000000142,A-1315-3044-6291-H/0096/2015  PROYECTO EJECUTIVO PARA REPARACIÓN Y REFORZAMIENTO ESTRUCTURAL DE BODEGA EN LA DIRECCIÓN DE RECURSOS MATERIALES,ORIGINAL,0000000001,2015-06-01 00:00:00,,0,0
0000000121,0000000095,C-2510-607-6141-D/0097/2015  PAVIMENTACION DE LA CALLE MADRE ELVIRA TRAMO: BLVD. ATOTONILCO A MADRE SIERRA COL. DIEZ DE MAYO,ORIGINAL,0000000001,2015-06-04 00:00:00,,0,0
0000000122,0000000095,AMPLIACION 1,AMPLIACION,0000000001,2015-06-04 00:00:00,0000000121,1,1
0000000123,0000000096,A-2510-310-6141-H/0098/2015  ELABORACIÓN DE PRESUPUESTOS BASE PARA LICITACIONES,ORIGINAL,0000000001,2015-06-04 00:00:00,,0,0
0000000124,0000000097,A-2510-310-6141-H/0099/2015  TRABAJOS COMPLEMENTARIOS AL PROYECTO EJECUTIVO PARQUE LINEAL SARDANETA TRAMO: DE IBARRILLA A PRESA DEL PALOTE,ORIGINAL,0000000001,2015-06-08 00:00:00,,0,0
0000000125,0000000108,C-1810-648-6151-D/0100/2015  REVESTIMIENTO DE CAMINO EN LA COMUNIDAD DE OJO DE AGUA LOS REYES,ORIGINAL,0000000001,2015-06-08 00:00:00,,0,0
0000000126,0000000098,B-5051-236-6141-D/0101/2015  PAVIMENTACION DE LA CALLE ZORRA TRAMO: BLVD. PASEO DE JEREZ A LAS LIEBRES COL. GRANJAS CERES,ORIGINAL,0000000001,2015-06-10 00:00:00,,0,0
0000000127,0000000100,A-5021-337-6121-E/0102/2015  BARDA PERIMETRAL DEL PARQUE ZOOLÓGICO DE LEON AREA NORTE,ORIGINAL,0000000001,2015-06-10 00:00:00,,0,0
0000000128,0000000100,AMPLIACION 1,AMPLIACION,0000000001,2015-06-10 00:00:00,0000000127,1,1
0000000129,0000000109,B-5051-236-6141-D/0103/2015  PAVIMENTACIÓN DE LA CALLE SAN JOSÉ MAIPO TRAMO: SAN JOSÉ DE ITURBIDE A SAN JOSÉ DEL REFUGIO COL. REFUGIO DE SAN JOSÉ.,ORIGINAL,0000000001,2015-06-15 00:00:00,,0,0
0000000130,0000000105,"A-2410-362-6121-E/0104/2015  MOVIMIENTO, MANEJO Y MANTENIMIENTO DE FLORA PARA EL SISTEMA INTEGRADO DE TRANSPORTE 3RA. Y 4TA. ETAPA",ORIGINAL,0000000001,2015-06-15 00:00:00,,0,0
0000000131,0000000120,A-2510-312-6141-D/0105/2015  DRENAJE PLUVIAL PROVISIONAL PARA LA SECUNDARIA ANEXA A LA NORMAL,ORIGINAL,0000000001,2015-06-15 00:00:00,,0,0
0000000132,0000000107,A-2410-362-6141-H/0106/2015  PROYECTO EJECUTIVO DE LA INTERSECCIÓN DEL BLVD. DELTA CON BLVD. AEROPUERTO,ORIGINAL,0000000001,2015-06-15 00:00:00,,0,0
0000000133,0000000107,AMPLIACION 1,AMPLIACION,0000000001,2015-06-15 00:00:00,0000000132,1,1
0000000134,0000000099,H-5018-932-6121-E/0107/2015  HABILITACIÓN Y EQUIPAMIENTO DE ESPACIOS PARA SALAS DE EXPOSICIONES EN CASA DE CULTURA,ORIGINAL,0000000001,2015-06-15 00:00:00,,0,0
0000000135,0000000101,A-1816-341-6121-E/0108/2015  REHABILITACION DEL PARQUE JUAREZ (COMPLEMENTOS DE ZONA NORTE) TRAMO: BLVD. TIMOTEO LOZANO A HONDA DE SAN MIGUEL COL. SAN MIGUEL,ORIGINAL,0000000001,2015-06-16 00:00:00,,0,0
0000000136,0000000106,A-2510-318-6141-D/0109/2015  PAVIMENTACION DE LA CALLE LABORES TRAMO: ESTAMBUL - HUASTECA COL. UYEPAC,ORIGINAL,0000000001,2015-06-16 00:00:00,,0,0
0000000137,0000000103,A-2510-318-6141-D/0110/2015  PAVIMENTACIÓN DE LA CALLE JOSÉ MA. ALCOCER TRAMO: BLVD. TELLEZ CRUCES - ANTONIO HERNÁNDEZ M. COL. LEON I.,ORIGINAL,0000000001,2015-06-16 00:00:00,,0,0
0000000138,0000000104,C-2510-607-6141-D/0111/2015  PAVIMENTACION DE LA CALLE BERNARDO DE MENESES TRAMO: PRIMER CABILDO - JUAN NUÑEZ DE SEDEÑA COL. AMPLIACIÓN LEON I.,ORIGINAL,0000000001,2015-06-16 00:00:00,,0,0
0000000139,0000000124,A-1816-341-6121-E/0112/2015  PLAZA COMUNITARIA VILLA DE LAS FLORES,ORIGINAL,0000000001,2015-06-19 00:00:00,,0,0
0000000140,0000000124,AMPLIACION 1,AMPLIACION,0000000001,2015-06-19 00:00:00,0000000139,1,1
0000000141,0000000102,A-2510-310-6141-H/0113/2015  TOPOGRAFIA (PLANIMETRIA Y ALTIMETRIA) EN BLVD. HERMANOS ALDAMA AMBOS CUERPOS TRAMO: AV. POMPA A CENTRAL DE ABASTOS,ORIGINAL,0000000001,2015-06-24 00:00:00,,0,0
0000000142,0000000137,B-5051-236-6141-H/0114/2015  PROYECTO EJECUTIVO DE LA CALLE: 1. MELANCOLIA TRAMO: DE PROLONGACIÓN GUADALUPE A NOSTALGIA COL. SAN PEDRO DE LOS HERNANDEZ,ORIGINAL,0000000001,2015-06-24 00:00:00,,0,0
0000000143,0000000137,AMPLIACION 1,AMPLIACION,0000000001,2015-06-24 00:00:00,0000000142,1,1
0000000144,0000000125,"B-5051-236-6141-D/0115/2015  PAVIMENTACIÓN DE LA CALLE HÉROES DE LA INDEPENDENCIA, TRAMO: NOSTALGIA A  AÑORANZA COL. SAN PEDRO DE LOS HERNÁNDEZ",ORIGINAL,0000000001,2015-06-25 00:00:00,,0,0
0000000145,0000000152,"B-5051-236-6141-D/0116/2015  PAVIMENTACIÓN DE LA CALLE PONTIFICIA, TRAMO: COLINDANCIA CON CALLE RIOJA HABICHUEAS, COL. SANTA CECILIA",ORIGINAL,0000000001,2015-06-25 00:00:00,,0,0
0000000146,0000000110,A-2410-351-6141-H/0117/2015  PROYECTO EJECUTIVO DEL CORREDOR MIGUEL ALEMAN TRAMO: BLVD. ADOLFO LOPEZ MATEOS A MONUMENTO A LA MADRE,ORIGINAL,0000000001,2015-06-30 00:00:00,,0,0
0000000147,0000000114,B-5051-236-6141-D/0118/2015  PAVIMENTACIÓN DE LA CALLE ÉTER TRAMO: EROS - ARES COL. LA ERMITA,ORIGINAL,0000000001,2015-07-06 00:00:00,,0,0
0000000148,0000000111,C-2510-607-6141-D/0119/2015  PAVIMENTACION DE LA CALLE CAÑADA DE LA CRUZ TRAMO: CAÑADA DE LOS REYES A CAÑADA DE ALFARO COL. CAÑADA DE ALFARO,ORIGINAL,0000000001,2015-07-06 00:00:00,,0,0
0000000149,0000000112,B-5051-236-6141-D/0120/2015  PAVIMENTACION DE LA CALLE ANDÚJAR TRAMO: TACANA - IZTACCIHUATL COL. PILETAS III SECC.,ORIGINAL,0000000001,2015-07-08 00:00:00,,0,0
0000000150,0000000113,B-5051-236-6141-D/0121/2015  PAVIMENTACIÓN DE LA CALLE FAJARDO TRAMO: CALLE GAMBOA A CALLE COFRADIA FRACC. EL PALOTE,ORIGINAL,0000000001,2015-07-08 00:00:00,,0,0
0000000151,0000000119,A-2510-318-6141-D/0122/2015  PAVIMENTACION DE LA CALLE PERCHERON TRAMO: POTRILLO - PONY COL. TIRITAS I Y II SECCION,ORIGINAL,0000000001,2015-07-08 00:00:00,,0,0
0000000152,0000000123,A-2010-356-6221-H/0123/2015  PROYECTO EJECUTIVO PLAZA DE GALLOS (1RA. ETAPA REHABILITACIÓN DEL REDONDEL),ORIGINAL,0000000001,2015-07-09 00:00:00,,0,0
0000000153,0000000122,C-2510-607-6141-D/0124/2015  PAVIMENTACION DE LA CALLE SELVA TROPICAL TRAMO: SELVA LIRIÓN - CANAL DE SARDANETA COL. LA SELVA,ORIGINAL,0000000001,2015-07-13 00:00:00,,0,0
0000000154,0000000116,B-5051-236-6141-D/0125/2015  PAVIMENTACIÓN DE LA CALLE TACANA TRAMO: TOLEDO - BLVD. BILBAO COL. PILETAS III SECCIÓN,ORIGINAL,0000000001,2015-07-15 00:00:00,,0,0
0000000155,0000000117,B-5051-236-6141-D/0126/2015  PAVIMENTACION DE LA CALLE IZTACCIHUATL TRAMO: OVIEDO A ASTURIAS COL. PILETAS I Y II SECCIÓN.,ORIGINAL,0000000001,2015-07-17 00:00:00,,0,0
0000000156,0000000117,AMPLIACION 1,AMPLIACION,0000000001,2015-07-17 00:00:00,0000000155,1,1
0000000157,0000000117,AMPLIACION 2,AMPLIACION,0000000001,2015-07-17 00:00:00,0000000155,2,2
0000000158,0000000115,B-5051-236-6141-D/0127/2015  PAVIMENTACION DE LA CALLE CERRO DEL SOYATE TRAMO: BLVD. RIO MAYO A MADRE MAURA COL. POPULAR POLANCO,ORIGINAL,0000000001,2015-07-17 00:00:00,,0,0
0000000159,0000000130,"B-5051-236-6141-D/0128/2015  PAVIMENTACION DE LA CALLE MADRE CARMEN, TRAMO: BLVD. ATOTONILCO A TOPAR OTE, COL. 10 DE MAYO",ORIGINAL,0000000001,2015-07-17 00:00:00,,0,0
0000000160,0000000121,H-2510-9013-6141-D/0129/2015  PAVIMENTACION DE LA CALLE CERRO DE LA BUFA TRAMO: CERRO DE SAN MIGUEL A CERRO DE SANGANGUEY COL. CERRITO DE JEREZ,ORIGINAL,0000000001,2015-07-22 00:00:00,,0,0
0000000161,0000000126,H-5011-9011-6221-E/0130/2015  INFRAESTRUCTURA MUNICIPAL EN LEÓN (REMODELACIÓN DE 2 CANCHAS DE VOLIBOL DE PRACTICAS EN LA UNIDAD DEPORTIVA LUIS I. RODRIGUEZ),ORIGINAL,0000000001,2015-07-22 00:00:00,,0,0
0000000162,0000000146,"H-2510-9013-6141-D/0131/2015  PAVIMENTACIÓN DE LA CALLE FRESNO, TRAMO DE PALMERÍN A ENCINO COL. ARBOLEDAS INFONAVIT",ORIGINAL,0000000001,2015-07-24 00:00:00,,0,0
0000000163,0000000118,A-2610-330-6121-E/0132/2015  DEMOLICIÓN Y REMODELACIÓN DE LAS INSTALACIONES DE RASTRO MUNICIPAL DE AVES,ORIGINAL,0000000001,2015-07-24 00:00:00,,0,0
0000000164,0000000129,B-5051-236-6141-D/0133/2015  PAVIMENTACIÓN DE LA CALLE TARSO TRAMO: HEBREOS - FILIPENSES COL. SAN PABLO,ORIGINAL,0000000001,2015-07-24 00:00:00,,0,0
0000000165,0000000150,B-5051-236-6141-H/0134/2015  PROYECTO EJECUTIVO DE LAS CALLES: 1. ARTEMISA TRAMO: EROS - PAVIMENTO EXISTENTE SUR COL. LA ERMITA 2. BALCONES DE LOS COLIBRIS TRAMO: BALCONES DE LAS MONARCAS - ARROYO COL. RENACIMIENTO 3. DE LA VIVIENDA OBRERA TRAMO: JAVIER GUTIERREZ OLIVERA - TOPAR CON PAVIMENTOS COL. JOL GUA BER,ORIGINAL,0000000001,2015-07-24 00:00:00,,0,0
0000000166,0000000140,B-5051-236-6141-H/0135/2015  PROYECTO EJECUTIVO DE LA PAVIMENTACIÓN DE LAS CALLES: 1. SANTA FE TRAMO: BOSQUES CARIBEÑO - SANTA CRUZ 2. JESUS LOPEZ LIRA TRAMO: FRAY DANIEL MIRELES - TOPAR LADO SUR COL. CONSTITUYENTES DE GUANAJUATO 3. SAN PABLO TRAMO: BLVD. ATOTONILCO - VALLE DEL DESVAN COL. SAN JOSE DEL ALTO.,ORIGINAL,0000000001,2015-07-24 00:00:00,,0,0
0000000167,0000000141,H-2510-9013-6141-D/0136/2015  PAVIMENTACIÓN DE LA CALLE ENGELS DEL BLVD. ARISTOTELES A FROMM COL. LA JOYA,ORIGINAL,0000000001,2015-07-28 00:00:00,,0,0
0000000168,0000000145,"H-2510-9013-6141-D/0137/2015  PAVIMENTACIÓN PRIVADA CONCEPCIÓN, TRAMO: DE ESPAÑITA A TOPAR, COLONIA BARRIO DE GUADALUPE",ORIGINAL,0000000001,2015-07-28 00:00:00,,0,0
0000000169,0000000145,AMPLIACION 1,AMPLIACION,0000000001,2015-07-28 00:00:00,0000000168,1,1
0000000170,0000000136,"H-2510-9013-6141-D/0138/2015  PAVIMENTACION DE LA CALLE CAMPO ESCONDIDO TRAMO: RIO DE LOS CASTILLOS A DEL SOLAR, COL. VALLE HERMOSO LEON, GTO.",ORIGINAL,0000000001,2015-07-28 00:00:00,,0,0
0000000171,0000000131,"H-2510-9013-6141-D/0139/2015  PAVIMENTACION DE LA CALLE TABACHIN, TRAMO: MAGNOLIA A ARAUCARIA, COLONIA ARBOLEDAS DE INFONAVIT",ORIGINAL,0000000001,2015-07-30 00:00:00,,0,0
0000000172,0000000131,AMPLIACION 1,AMPLIACION,0000000001,2015-07-30 00:00:00,0000000171,1,1
0000000173,0000000149,H-2510-9013-6141-D/0140/2015  PAVIMENTACIÓN DE LA CALLE VOLTAIRE DE BLVD. ARISTOTELES - FROMM COLONIA LA JOYA,ORIGINAL,0000000001,2015-07-30 00:00:00,,0,0
0000000174,0000000144,H-2510-9013-6141-D/0141/2015  PAVIMENTACION DE LA CALLE FREUD DE BLVD. ARISTOTELES A FROMM COLONIA LA JOYA,ORIGINAL,0000000001,2015-07-30 00:00:00,,0,0
0000000175,0000000143,"H-2510-9013-6141-D/0142/2015  PAVIMENTACION DE LA CALLE REAL DE MINAS, TRAMO: DE LA CALLE REAL DE LA PLATA A TOPAR (FTE AL # 408) COLONIA REAL DEL CASTILLO",ORIGINAL,0000000001,2015-07-30 00:00:00,,0,0
0000000176,0000000128,B-5051-236-6141-D/0143/2015  PAVIMENTACIÓN DE LA CALLE CAÑADA DE LOS PROFETAS TRAMO: CAÑADA DE ALFARO - CAÑADA DE LOS APOSTOLES COL. CAÑADA DE ALFARO,ORIGINAL,0000000001,2015-07-30 00:00:00,,0,0
0000000177,0000000170,A-2510-312-6151-C/0144/2015  RETIRO DE ARBOLES PARA LA CONSTRUCCIÓN PROVISIONAL DE CARRIL LATERAL DEL BLVD. MORELOS TRAMO: BLVD. A. LOPEZ MATEOS A BLVD. CLOUTHIER CPO NORTE,ORIGINAL,0000000001,2015-07-31 00:00:00,,0,0
0000000178,0000000134,A-2510-310-6141-H/0145/2015  ADECUACION DE PROYECTO EJECUTIVO DEL PUENTE PEATONAL EN EL BLVD. MORELOS Y CRUCE FRENTE AL INSTITUTO TECNOLOGICO DE LEON,ORIGINAL,0000000001,2015-07-31 00:00:00,,0,0
0000000179,0000000135,H-2510-9013-6141-D/0146/2015  PAVIMENTACION DE LA CALLE DEL CLERIGO TRAMO: DE CUENCA FLORIDA - TOPAR,ORIGINAL,0000000001,2015-08-05 00:00:00,,0,0
0000000180,0000000127,C-2510-607-6141-D/0147/2015  PAVIMENTACION DE LA CALLE: JEREZ DE VALAQUIA TRAMO: JEREZ DE GUADALUPE - JEREZ DE GUADALQUIVIR COL. VALLE DE JEREZ II SECC.,ORIGINAL,0000000001,2015-08-05 00:00:00,,0,0
0000000181,0000000148,G-5011-824-6221-E/0148/2015  REMODELACIÓN DE 3 CANCHAS DE USOS MULTIPLES EN LA UNIDAD DEPORTIVA ANTONIO TOTA CARBAJAL COL. CIUDAD SATELITE,ORIGINAL,0000000001,2015-08-05 00:00:00,,0,0
0000000182,0000000148,AMPLIACION 1,AMPLIACION,0000000001,2015-08-05 00:00:00,0000000181,1,1
0000000183,0000000155,"H-2510-9013-6141-D/0149/2015  PAVIMENTACIÓN DE LA CALLE POCHUTLA TRAMO: DE MARTINICA A MURCIA, COL. SAN JUAN BOSCO",ORIGINAL,0000000001,2015-08-06 00:00:00,,0,0
0000000184,0000000139,"H-2510-9013-6141-D/0150/2015  PAVIMENTACION DE LA CALLE PERAL, TRAMO: DE GUTY CARDENAS A COCOTERO COLONIA ARBOLEDAS DE INFONAVIT",ORIGINAL,0000000001,2015-08-06 00:00:00,,0,0
0000000185,0000000139,AMPLIACION 1,AMPLIACION,0000000001,2015-08-06 00:00:00,0000000184,1,1
0000000186,0000000132,C-2510-607-6141-D/0151/2015  PAVIMENTACIÓN DE LA CALLE: ALAMEDA TRAMO: TORITOS - RIVERA AZUL COL. VALLE HERMOSO,ORIGINAL,0000000001,2015-08-07 00:00:00,,0,0
0000000187,0000000138,B-5051-236-6141-D/0152/2015  |PAVIMENTACION DE LA CALLE AGUA AZUL TRAMO: TORITOS - RIVERA AZUL COL. VALLE HERMOSO,ORIGINAL,0000000001,2015-08-07 00:00:00,,0,0
0000000188,0000000133,A-2510-318-6141-D/0153/2015  ADECUACIÓN DE ACCESO EN LA CALLE LAURELES DE LA FLORIDA FRENTE A NÚMERO 100,ORIGINAL,0000000001,2015-08-07 00:00:00,,0,0
0000000189,0000000147,B-5051-236-6141-D/0154/2015  PAVIMENTACION DE LA CALLE DE LA ALDEA (1/2 CUERPO) TRAMO: DEL PABELLON A AV. CRUCIFIXION COL. VILLAS DE LEON,ORIGINAL,0000000001,2015-08-11 00:00:00,,0,0
0000000190,0000000158,B-5051-236-6141-H/0155/2015  PROYECTO EJECUTIVO DE LAS CALLES: 1. SAMUEL TRAMO: SAN BENIGNO - SAN LAZARO COL. NUEVA SANTA ROSA DE LIMA; 2. EMILIO PORTES GIL TRAMO: NICOLAS CALVO - PLUTARCO ELIAS CALLES COL. PRESIDENTES DE MEXICO; 3. LAGUNA SECA TRAMO: PRIVADA PADUA - PAVIMENTACIÓN EXISTENTE COL. SAN ANTONIO; 4. 2DO ANDADOR FAJARDO TRAMO: FAJARDO - PALO ALTO COL. EL PALOTE,ORIGINAL,0000000001,2015-08-11 00:00:00,,0,0
0000000191,0000000151,"A-2510-310-6141-H/0156/2015  ESTUDIO DE MECANICA DE SUELOS Y GEOTECNICA PARA PROYECTON EJECUTIVO DE DISTRIBUIDOR VIAL EN EL LIBRAMIENTO PONIENTE DE LEON PARA PRIMERA ETAPA, CRUCE CON LA AUTOPISTA LEON - AGUASCALIENTES EN EL MUNICIPIO DE LEON",ORIGINAL,0000000001,2015-08-12 00:00:00,,0,0
0000000192,0000000153,"H-2510-9013-6141-D/0157/2015  PAVIMENTACION DE LA CALLE SANTIDAD, TRAMO: DE RIO DE LOS CASTILLOS - CISMA COLONIA SANTA CECILIA",ORIGINAL,0000000001,2015-08-12 00:00:00,,0,0
0000000193,0000000154,"H-2510-9013-6141-D/0158/2015  PAVIMENTACIÓN DE LA CALLE SOJA, TRAMO: CUENCA FLORIDA - ALISO COLONIA VALLE HERMOSO 1A Y 2A SECCION",ORIGINAL,0000000001,2015-08-12 00:00:00,,0,0
0000000194,0000000156,"H-2510-9013-6141-D/0159/2015  PAVIMENTACION DE LA CALLE EGIPTO TRAMO: AV. SION A TIBERIADES, COL. SAN FELIPE DE JESUS",ORIGINAL,0000000001,2015-08-12 00:00:00,,0,0
0000000195,0000000157,A-21199-0000-0004-C/0160/2015  REHABILITACION DE LOS ADORNOS ALUSIVOS A LAS FIESTAS PATRIAS Y NAVIDEÑAS,ORIGINAL,0000000001,2015-08-19 00:00:00,,0,0
0000000196,0000000161,B-5051-236-6141-H/0161/2015  PROYECTO EJECUTIVO DE LAS CALLES: 1. JOAN MIRO TRAMO: IGNACIO PINAZO - EDUARDO ROSALES COL. MARAVILLAS; 2. 2 DE ENERO TRAMO: BLVD. HILARIO MEDINA - 8 DE MARZO COL. 8 DE MARZO 3. INTER DE MILAN TRAMO: REAL SOCIEDAD - REAL MADRID COL. DEPORTIVA II; 4. DODGERS DE LOS ANGELES TRAMO: BLVD. BRAVOS DE ATLANTA - SERAFINES DE LOS ANGELES COL. DEPORTIVA II.,ORIGINAL,0000000001,2015-08-24 00:00:00,,0,0
0000000197,0000000159,B-5051-236-6141-D/0162/2015  PAVIMENTACIÓN DE LA CALLE JEREZ DE BERNA TRAMO: JEREZ DE MENORCA A JEREZ DE BESAYA COL. VALLE DE JEREZ,ORIGINAL,0000000001,2015-08-24 00:00:00,,0,0
0000000198,0000000159,AMPLIACION 1,AMPLIACION,0000000001,2015-08-24 00:00:00,0000000197,1,1
0000000199,0000000162,C-2210-602-6121-E/0163/2015  REHABILITACIÓN DE MODULO SANITARIO EN ESCUEL PRIMARIA PLUTARCO ELIAS CALLES UBICACIÓN CALLE NICOLAS CALVO ESQ. JUAN N. MENDEZ COL. PRESIDENTES DE MÉXICO; REHABILITACIÓN DE MODULO SANITARIO EN ESCUELA PRIMARIA PAULO FREIRE UBICACIÓN AV. DE LOS APOSTOLES ESQ. DE LA PROVIDENCIA COL. LOMAS DE GUADALUPE; REHABILITACIÓN DE MODULO SANITARIO EN ESCUELA PRIMARIA JOSE GUADALUPE POSADA UBICACIÓN CALLE REAL DE COLINA COL. REAL DE LOS CASTILLOS; REHABILITACIÓN DE MODULO SANITARIO EN ESCUELA PRIMARIA FRANCISCO RAMIREZ MATA UBICACIÓN AV. SATURNO ESQ. TIBERIADES COL.. SAN FELIPE DE JESUS,ORIGINAL,0000000001,2015-08-26 00:00:00,,0,0
0000000200,0000000163,A-2210-3043-6121-E/0164/2015  CONSTRUCCION DE UN AULA TIPO U2C PLANTA ALTA SEC. GRAL # 17 SOR JUANA INES DE LA CRUZ,ORIGINAL,0000000001,2015-08-27 00:00:00,,0,0
0000000201,0000000160,A-2510-312-6151-C/0165/2015  BARRERAS DE CONTENCIÓN TIPO NEW JERSEY EN DISTRIBUIDOR VIAL BENITO JUAREZ Y MALECON DEL RIO,ORIGINAL,0000000001,2015-08-27 00:00:00,,0,0
0000000202,0000000167,H-1816-913-6141-D/0166/2015  PAVIMENTACION DE LA CALLE MADRE KARLA TRAMO: MADRE SIERRA A TOPAR LADO ORIENTE COLONIA DIEZ DE MAYO SECCION NEGRETE,ORIGINAL,0000000001,2015-08-31 00:00:00,,0,0
0000000203,0000000176,H-1816-913-6141-D/0167/2015  PAVIMENTACIÓN DE LA CALLE JEREZ DE MIÑO TRAMO: BLVD. DELTA - VALLE DE SANTIAGO COL. JESUS MARIA Y VALLE DE JEREZ,ORIGINAL,0000000001,2015-08-31 00:00:00,,0,0
0000000204,0000000177,H-1816-913-6141-D/0168/2015  PAVIMENTACION CALLE CAÑADA DE LOS SANTOS TRAMO: DE CAÑADA DE LOS PROFETAS A CAÑADA DE CRISTO COLONIA CAÑADA DE ALFARO,ORIGINAL,0000000001,2015-08-31 00:00:00,,0,0
0000000205,0000000174,H-1816-913-6141-D/0169/2015  PAVIMENTACIÓN CALLE MADRE MAURA TRAMO: MADRE MARINA A CERRO DEL SOYATE COL. LA GLORIA,ORIGINAL,0000000001,2015-08-31 00:00:00,,0,0
0000000206,0000000178,"H-1816-913-6141-D/0170/2015  PAVIMENTACIÓN DE LA CALLE MADRE ANGELA, TRAMO: ORIENTE - PONIENTE COL. 10 DE MAYO",ORIGINAL,0000000001,2015-08-31 00:00:00,,0,0
0000000207,0000000166,H-1816-913-6141-D/0171/2015  PAVIMENTACIÓN DE LA CALLE ANTERA TRAMO: ESTAMBRE - MADRE MARINA COL. ARBOLEDAS DE SAN HILARION,ORIGINAL,0000000001,2015-08-31 00:00:00,,0,0
0000000208,0000000185,"H-1816-913-6141-D/0172/2015  PAVIMENTACIÓN DE LA CALLE ESTIGMA, TRAMO: MADRE MARINA A CALLE ESTAMBRE COLONIA ARBOLEDAS DE SAN HILARION",ORIGINAL,0000000001,2015-08-31 00:00:00,,0,0
0000000209,0000000179,"H-1816-913-6141-D/0173/2015  PAVIMENTACION CALLE SEPALO, TRAMO: ESTAMBRE - MADRE MARINA COLONIA ARBOLEDAS DE SAN HILARION.",ORIGINAL,0000000001,2015-08-31 00:00:00,,0,0
0000000210,0000000175,A-2310-343-6241-E/0174/2015  REHABILITACIÓN DEL PARQUE PÚBLICO EL ROSARIO,ORIGINAL,0000000001,2015-08-31 00:00:00,,0,0
0000000211,0000000175,AMPLIACION 1,AMPLIACION,0000000001,2015-08-31 00:00:00,0000000210,1,1
0000000212,0000000175,AMPLIACION 2,AMPLIACION,0000000001,2015-08-31 00:00:00,0000000210,2,2
0000000213,0000000188,A-2310-343-6241-E/0175/2015  |CONSTRUCCION Y EQUIPAMIENTO EN PARQUE VILLA DE LAS TORRES,ORIGINAL,0000000001,2015-08-31 00:00:00,,0,0
0000000214,0000000188,AMPLIACION 1,AMPLIACION,0000000001,2015-08-31 00:00:00,0000000213,1,1
0000000215,0000000165,B-5051-236-6141-D/0176/2015  PAVIMENTACIÓN DE LA CALLE AGUILA IMPERIAL TRAMO DE CALLE AGUILA BLANCA A CALLE AGUILA REAL COL. LAS AGUILAS,ORIGINAL,0000000001,2015-09-01 00:00:00,,0,0
0000000216,0000000164,B-5051-236-6141-D/0177/2015  PAVIMENTACION DE LA CALLE 1ER JEREZ DE AMBERES TRAMO: DELTA A JEREZ DE ANTAÑO COL. VALLE DE JEREZ III SECC,ORIGINAL,0000000001,2015-09-01 00:00:00,,0,0
0000000217,0000000164,AMPLIACION 1,AMPLIACION,0000000001,2015-09-01 00:00:00,0000000216,1,1
0000000218,0000000181,B-5051-236-6141-D/0178/2015  PAVIMENTACIÓIN DE LA CALLE CAMPO ESTRELLADO TRAMO: CAMPO ESCONDIDO - CAMPO ALEGRE COL. VALLE HERMOSO,ORIGINAL,0000000001,2015-09-01 00:00:00,,0,0
0000000219,0000000186,B-5051-236-6141-D/0179/2015  PAVIMENTACIÓN DE LA CALLE CAMINO VERDE TRAMO: TORITOS A RIVERA AZUL COL. VALLE HERMOSO,ORIGINAL,0000000001,2015-09-01 00:00:00,,0,0
0000000220,0000000186,AMPLIACION 1,AMPLIACION,0000000001,2015-09-01 00:00:00,0000000219,1,1
0000000221,0000000187,A-2110-3042-6221-E/0180/2015  SEGUNDA ETAPA DE TRABAJOS PRELIMINARES PARA PLAZA DEL MUSICO,ORIGINAL,0000000001,2015-09-02 00:00:00,,0,0
0000000222,0000000189,B-5051-236-6141-H/0181/2015  PROYECTO EJECUTIVO DE LA PAVIMENTACIÓN DE LAS CALLES: 1. SANTA ROCIO TRAMO: SANTA ALEJANDRA - SANTA BLANCA COL.. SAN PEDRO PLUS; 2. PRIVADA SION TRAMO: AVENIDA SION - TOPAR CON PAVIMENTO COL. SAN FELIPE DE JESUS; 3. EGIPTO TRAMO: SIRIA - AV. SION COL. SAN FELIPE DE JESUS; 4. VILLAS DE LEON PONIENTE TRAMO: DEL PABELLON A DEL AGORA COL. VILLAS DE LEON; 5. ANDADOR TRIBU TRAMO: DE LA MORADA - AND. DE BLA HACIENDA COL. VILLAS DE LEON.,ORIGINAL,0000000001,2015-09-03 00:00:00,,0,0
0000000223,0000000184,A-2510-310-6121-H/0182/2015  ANTEPROYECTO DE REHABILITACION DE LAS OFICINAS DE TRANSITO Y  EDUCACIÓN VIAL UBICADO EN CARRETERA LEON CUERAMARO KM 4.5 DEL MUNICIPIO DE LEON,ORIGINAL,0000000001,2015-09-03 00:00:00,,0,0
0000000224,0000000172,A-2310-343-6241-E/0183/2015  EQUIPAMIENTO DEL PARQUE CÁRCAMOS UBICADO EN EL BLVD. LÓPEZ MATEOS Y MORELOS COL. HACIENDA DEL CAMPESTRE,ORIGINAL,0000000001,2015-08-31 00:00:00,,0,0
0000000225,0000000172,AMPLIACION 1,AMPLIACION,0000000001,2015-08-31 00:00:00,0000000224,1,1
0000000226,0000000172,AMPLIACION 2,AMPLIACION,0000000001,2015-08-31 00:00:00,0000000224,2,2
0000000227,0000000173,A-2310-358-6121-E/0184/2015  REHABILITACIÓN Y ACONDICIONAMIENTO DEL AREA NATURAL PROTEGIDA CAÑADA ARROYO HONDO,ORIGINAL,0000000001,2015-08-31 00:00:00,,0,0
0000000228,0000000173,AMPLIACION 1,AMPLIACION,0000000001,2015-08-31 00:00:00,0000000227,1,1
0000000229,0000000221,C-2510-607-6141-D/0185/2015  PAVIMENTACIÓN DE LA CALLE: TRONERAS TRAMO: CANAL DE SARDANETA A BARBACANA COL. EL CASTILLO,ORIGINAL,0000000001,2015-09-04 00:00:00,,0,0
0000000230,0000000180,G-5011-824-6221-E/0186/2015  REMODELACION DE 5 CANCHAS DE BASQUETBOL DE PRACTICAS EN LA UNIDAD DEPORTIVA JESÚS RODRIGUEZ GAONA COL. SANTA RITA DE LOS NARANJOS,ORIGINAL,0000000001,2015-09-04 00:00:00,,0,0
0000000231,0000000180,AMPLIACION 1,AMPLIACION,0000000001,2015-09-04 00:00:00,0000000230,1,1
0000000232,0000000183,B-5051-236-6141-H/0187/2015  PROYECTO EJECUTIVO DE LA PAVIMENTACIÓN DE LAS CALLES: 1. TARSO TRAMO: CORINTOS - FILIPENSES COL. SAN PABLO; 2. CORINTO TRAMO: COLOCENCES - FILEMON COL. SAN PABLO.,ORIGINAL,0000000001,2015-09-08 00:00:00,,0,0
0000000233,0000000182,B-5051-236-6141-H/0188/2015  PROYECTO EJECUTIVO DE LA CALLE: 1. JOSE MARIA TORNEL TRAMO: JOSE MARIA BRITO - IGNACIO AGUIRRE COL. PERIODISTAS MEXICANOS,ORIGINAL,0000000001,2015-09-08 00:00:00,,0,0
0000000234,0000000168,B-5051-236-6141-H/0189/2015  PROYECTO EJECUTIVO DE LA CALLE: 1. FILEMON TRAMO: PRESA LA MOJINA - EFESO COL. SAN PABLO,ORIGINAL,0000000001,2015-09-08 00:00:00,,0,0
0000000235,0000000190,A-2510-312-6151-C/0190/2015  REUBICACIÓN Y CANALIZACIÓN DE DUCTOS DE INSTALACIONES DE INFRAESTRUCTURA DE LINEA TELEFONICA,ORIGINAL,0000000001,2015-09-08 00:00:00,,0,0
0000000236,0000000171,"A-2210-3043-6121-H/0191/2015  ESTUDIO DE MECANICA DE SUELOS EN DIFERENTES ESCUELAS DE LA CIUDAD DE LEON, GTO. 1. ESCUELA TELESECUNDARIA No. 1070, CALLE MARCEL No. 509 EN LA COLONIA LA SOLEDAD DE LA JOYA. 2. ESCUELA JARDIN DE NIÑOS JOSE VASCONCELOS, CALLE DE LA POSTURA S/N EN LA COLONIA, NUEVO AMANECER 3. LA PRIMARIA LIC. ADOLFO LOPEZ MATEOS, COMUNIDAD LA CINTA.",ORIGINAL,0000000001,2015-09-09 00:00:00,,0,0
0000000237,0000000169,"A-2410-362-6141-H/0192/2015  EL PROYECTO PROGRAMA DE MANEJO DE ARBOLADO Y REFORESTACIÓN, DERIVADO DE LA AUTORIZACIÓN DE IMPACTO AMBIENTAL EN EXPEDIENTE IMA-MG-291-2014 Y IMA-MG-338-2014 PARA LA TERCERA Y CUARTA ETAPA DE LOS CORREDORES TRONCALES DEL SIT",ORIGINAL,0000000001,2015-09-11 00:00:00,,0,0
0000000238,0000000217,H-1816-913-6171-E/0193/2015  SUMINISTRO Y COLOCACION DE CALENTADORES SOLARES EN LEÓN DE LOS ALDAMA,ORIGINAL,0000000001,2015-09-17 00:00:00,,0,0
0000000239,0000000217,AMPLIACION 1,AMPLIACION,0000000001,2015-09-17 00:00:00,0000000238,1,1
0000000240,0000000212,A-2010-356-6221-H/0194/2015  PROYECTO EJECUTIVO DE LA REHABILITACIÓN DE L HOTEL UBICADO EN LA CALLE JUAREZ # 316 PRIMERA ETAPA,ORIGINAL,0000000001,2015-09-18 00:00:00,,0,0
0000000241,0000000191,"B-5051-236-6141-D/0195/2015  PAVIMENTACION DE LA CALLE PRESA CORRALEJO, TRAMO: BLVD. PASEO DE LA PRESA A PRESA ALAZANAS, COL. RIVERA DE LA PRESA",ORIGINAL,0000000001,2015-09-18 00:00:00,,0,0
0000000242,0000000223,A-2510-310-6141-H/0196/2015  ESTUDIO DE IMPACTOS AMBIENTALES DE ACUERDO AL REGLAMENTO PARA GESTION AMBIENTAL EN EL MUNICIPIO DE LEON DE CALLES Y PLAZAS,ORIGINAL,0000000001,2015-09-18 00:00:00,,0,0
0000000243,0000000215,C-5012-600-6171-E/0197/2015  SUMINISTRO E INSTALACION DE 59 CALENTADORES SOLARES,ORIGINAL,0000000001,2015-09-22 00:00:00,,0,0
0000000244,0000000218,A-2510-3006-6141-C/0198/2015  REHABILITACION E IMAGEN URBANA DE PARADERO SOLEDAD EN AV. MIGUEL ALEMAN TRAMO: C. ALVARO OBREGON A C. BELISARIO DOMINGUEZ,ORIGINAL,0000000001,2015-09-22 00:00:00,,0,0
0000000245,0000000235,B-5051-236-6141-H/0199/2015  PROYECTO EJECUTIVO DE LAS CALLES: 1. JEREZ DE LUCERNA TRAMO: JEREZ DE MENORCA - JEREZ DE BESAYA COL. VALLE DE JEREZ; 2. JEREZ DE BURGOS TRAMO: JEREZ DE SANALONA - JEREZ DE MINO COL. VALLE DE JEREZ,ORIGINAL,0000000001,2015-09-23 00:00:00,,0,0
0000000246,0000000206,A-2310-343-6241-E/0200/2015  REHABILITACION DE PARQUE SAN FRANCISCO DEL MORAL,ORIGINAL,0000000001,2015-09-23 00:00:00,,0,0
