Id_Obra,Clave_Obra,Nombre,Tipo_Precio,Id_Sub_Programa,Id_Localidad,Tipo_Obra_Proyecto,Id_Sub_Tipo_Obra,Id_Oficio_Asignacion_Obra
428,432,PAVIMENTACION DE LA CALLE MAR ROJO TRAMO: DE OCEANO INDICO DE LINDA VISTA A OCEANO PACIFICO DE LINDA,Unitario,1,1,Obra,1,0
429,434,INSTALACION Y ADECUACION DE REDUTORES DE VELOCIDAD (TOPES DE PLASTICO) EN LA CALLE TANTALIO TRAMO:,Unitario,1,1,Obra,1,0
430,433,REHABILITACION DE LOS PAVIMENTOS DE LA CALLE ALAMEDA DE SAN JUAN TRAMO: DE HACIENDAS DE LEON,Unitario,1,1,Obra,1,0
431,437,"COLOCACION DE PRIMERA PIEDRA EN EL PARQUE METROPOLITANO NORTE, LEON",Unitario,1,1,Obra,1,0
432,435,AMPLIACION DE LAUMBRADO PUBLICO DE LA CICLOVIA LEON - SAN FRANCISCO TRAMO: DE LA RESERVA A LA MORA L,Unitario,1,1,Obra,1,0
433,436,ADECUACION DE OFICINAS EN PARQUE MEXICO PARA LA DIRECCION DE PROTECCION AL AMBIENTE LEON,Unitario,1,1,Obra,1,0
434,438,SUMINISTRO Y COLOCACION DE RECUBRIMIENTOS A BASE DE MATERIAL ACOLCHADO EN LAS DELEGACIONES DE,Unitario,1,1,Obra,1,0
435,439,CONSTRUCCION DE BOCA DE TORMENTA UBICADA EN LA CALLE CALAFIA ESQUINA CON CALLE SARMIENTO EN LA COL.,Unitario,1,1,Obra,1,0
436,440,CONSTRUCCION DE LA ESTACION DE BOMBEROS NO. 8 EN LA COL. ERMITA EN LEON. GTO.,Unitario,1,1,Obra,1,0
437,441,MANTENIMIENTO Y REHABILITACION EN LA VIALIDAD MALECON DEL RIO DE LOS GOMEZ,Unitario,1,1,Obra,1,0
438,443,OBRA COMPLEMENTARIA EN LA CALLE BENITO JUAREZ LOCALIDAD LA RESERVA LEON,Unitario,1,1,Obra,1,0
439,442,PAVIMENTACION DE LA CALLE GUTY CARDENAS CUERPO ORIENTE TRAMO: DE NOGAL A SAN ROMAN COL. LAS ARBOLEDA,Unitario,1,1,Obra,1,0
440,445,CONSTRUCCION DEL PUENTE VEHICULAR HACIENDA ARRIBA,Unitario,1,1,Obra,1,0
441,446,CONSTRUCCION DE RETORNO Y GASAS DE INCORPORACION EN EL BLVD. JOSE MARIA MORELOS PTE.,Unitario,1,1,Obra,1,0
442,444,"MEJORAMIENTO LOGISTICO DE LA ZONA DE COMERCILIZACION AL MENUDEO DE LA CENTRAL DE ABASTOS DE LEON,",Unitario,1,1,Obra,1,0
443,470,APLICACION DE PINTURA EN BARANDALES PUENTE LA LUZ,Unitario,1,1,Obra,1,0
444,454,PAVIMENTACION DE LA CALLE ANTONIO DEL CASTILLO TRAMO: DE BLVD. MARIANO ESCOBEDO A CEFERINO ORTIZ COL,Unitario,1,1,Obra,1,0
445,460,PAVIMENTACION DE LA CALLE RICARDO GALVAN TRAMO: DE BLVD. MARIANO ESCOBEDO A CEFERINO ORTIZ COL. LEON,Unitario,1,1,Obra,1,0
446,465,REHABILITACION CON CONCRETO HIDRAULICO DE LOS PAVIMENTOS DEL BLVD. CAMPESTRE LEON.,Unitario,1,1,Obra,1,0
447,467,MEJORAS EN LAS INSTALACIONES DE ALUMBRADO PUBLICO EN COL. PORTONES DE SAN JACINTO (EL INFIERNITO) EL,Unitario,1,1,Obra,1,0
448,471,APLICACION DE PINTURA EN BARANDALES DEL DISTRIBUIDOR VIAL JUAN PABLO II,Unitario,1,1,Obra,1,0
449,447,PAVIMENTACION DE LA CALLE PRIV. ARROYO EL SALTO TRAMO: DE BLVD. AMRIANO ESCOBEDO A TOPAR COL. PASEOS,Unitario,1,1,Obra,1,0
450,448,PAVIMENTACION DE LA CALLE BOMBAY TRAMO: DE NIGER A MALECON DEL RIO COL. LA ESCONDIDA,Unitario,1,1,Obra,1,0
451,449,PAVIMENTACION DE LA CALLE TOMAS ILLAÑEZ TRAMO: DE BLVD. TELLEZ CRUCES - ANTONIO HERNANDEZ COL. LEON,Unitario,1,1,Obra,1,0
452,450,PAVIMENTACION DE LA CALLE JOSE MA. RUIZ TRAMO: DE BLVD. TELLEZ CRUCES -  ANTONIO HERNANDEZ COL. LEON,Unitario,1,1,Obra,1,0
453,451,PAVIMENTACION DE LA CALLE JUAN MUÑOZ LOPEZ TRAMO: DE BLVD. TELLEZ CRUCES - ANTONIO HERNADEZ COL. LEN,Unitario,1,1,Obra,1,0
454,452,PAVIMENTACION DE LA CALLE JOSE MA. RODRIGUEZ TRAMO: DE BLVD. TELLEZ CRUCES A TOPAR CON LIMITE DE LA,Unitario,1,1,Obra,1,0
455,453,PAVIMENTACION DE LA CALLE FRANCISCO MARTINEZ TRAMO: DE BLVD. TELLEZ CRUCES A TOPAR CON LIMITE DE LA,Unitario,1,1,Obra,1,0
456,455,PAVIMENTACION DE LA CALLE EUFRACIA PANTOJA TRAMO: BLVD. LEON II A RICARDO SOLORZANO COL. LEON II,Unitario,1,1,Obra,1,0
457,456,PAVIMENTACION DE LA CALLE JOSE GUADALUPE POSADA TRAMO: DE BLVD. LEON II A MA. SANCHEZ COL. LEON II,Unitario,1,1,Obra,1,0
458,457,PROYECTO ESTRUCTURAL DE LA PARTE POSTERIOR DEL MERCADO LA LUZ ENTRE LAS CALLES LA LUZ Y HEROES DE LA,Unitario,1,1,Obra,1,0
459,458,PAVIMENTACION DE LA CALLE GAVIOTA 1/2 CUERPO NORTE TRAMO: QUETZAL A OREOL COL. SANTA RITA,Unitario,1,1,Obra,1,0
460,459,PAVIMENTACION DE LA CALLE AGUSTIN FRANCO TRAMO: DE BLVD. FRANCISCO VILLA A PAULINO DURAN COL. LEON I,Unitario,1,1,Obra,1,0
461,461,PAVIMENTACION DE LA CALLE IMELDA GOMEZ TRAMO: DE BLVD. LEON II A BLVD. MARIANO ESCOBEDO COL. LEON II,Unitario,1,1,Obra,1,0
462,462,PAVIMENTACION DE LA CALLE MARCOS AGUILAR TRAMO: DE BLVD. LEON II A RICARDO SOLORZANO COL. LEON II,Unitario,1,1,Obra,1,0
463,463,PAVIMENTACION DE LA CALLE 2DO. ANDADOR JOSE DE LA LUZ FLORES TRAMO: DE FRANCISCO MORALES A J. DE LA,Unitario,1,1,Obra,1,0
464,464,PAVIMENTACION DE LA CALLE PASEO DE LAS LIEBRES TRAMO: DE BLVD. RIO MAYO A MIGUEL DE CERVANTES SAAVED,Unitario,1,1,Obra,1,0
465,466,PAVIMENTACION DE LA CALLE SILVINO ROBLES TRAMO: DE BLVD. MARIANO ESCOBEDO A BLVD. LEON II COL. LEON,Unitario,1,1,Obra,1,0
466,468,"MEJORAS EN LAS INSTALACIONES DE ALUMBRADO PÚBLICO EN: COL. CERRITO DE LA JOYA, COL. PIEDAD DE LA JOY",Unitario,1,1,Obra,1,0
467,469,ADECUACION GEOMETRICA DEL BLVD. ADOLFO LOPEZ MATEOS PARA MEJORAR LOS CRUCES PEATONALES TRAMO: BLVD.,Unitario,1,1,Obra,1,0
468,12016,"ESCALATORIA 1 VIALIDADES LATERALES, CRUCE A NIVEL Y ADECUACION DE SERVICIOS DE LA INTERSECCION DE LA",Unitario,1,1,Obra,1,0
469,12236,"ESCALATORIA 1 REHABILITACION DE PAVIMENTOS EN DIFERENTES TRAMOS: BLVD. FRANCISCO VILLA, MALECON DEL",Unitario,1,1,Obra,1,0
470,12445,CONSTRUCCION DEL PUENTE VEHICULAR HACIENDA ARRIBA,Unitario,1,1,Obra,1,0
