Id_Obra,Clave_Obra,Nombre,Tipo_Precio,Id_Sub_Programa,Id_Localidad,Tipo_Obra_Proyecto,Id_Sub_Tipo_Obra,Id_Oficio_Asignacion_Obra
1,12,"MANTENIMIENTO DE  CAMELLONES, BANQUETAS Y AREAS VERDES  EN VIALIDADES DE ACCESO A LA CIUDAD DE LEON, GTO.  ",Alzado,1,1,Obra,1,11
2,24,"MANTENIMEINTO  A ESPACIOS PUBLICOS  Y AREAS VERDES DE LAS VIALIDADES  DE LA CIUDAD DE  LEÓN, GTO.  ",Unitario,1,1,Obra,1,15
3,23,"MANTENIMIENTO DE  CAMELLONES, BANQUETAS Y AREAS VERDES  EN VIALIDADES DE ACCESO A LA CIUDAD DE LEON, GTO.  ",Alzado,1,1,Obra,1,10
4,14,MANTENIMIENTO AL ACCESO A SANTA MARIA DE CEMENTOS MEDIANTE  ESTABILIZACION  DE TALUD DEL RIO  ,Unitario,1,1,Obra,1,13
5,11,MANTENIMIENTO Y APLICACIÓN  DE RIEGO EN AREAS VERDES  ,Unitario,1,1,Obra,1,40
6,1,"MEJORAMIENTO DE LA IMAGEN URBANA EN BLVD. A LOPEZ MATEOS  (3 ra ETAPA ),  LEON GUANAJUATO  ",Unitario,1,1,Obra,1,41
7,19,"REHABILITACION CAMINO ALFARO – NUEVO VALLE 1RA. ETAPA, LEON GTO. ",Unitario,1,1,Obra,1,56
8,45,"PROYECTO EJECUTIVO DE PLAZA DE GALLOS DEL HOTEL, SEGUNDA ETAPA CALLE JUAREZ  ZONA CENTRO, LEÓN GUANAJUATO. ",Unitario,1,1,Obra,1,2
9,21,CONSTRUCCION DE CICLOVIA BLVD. PASEO DE JEREZ TRAMO DE BLVD. TIMOTEO LOZANO A BLVD. LOPEZ MATEOS ,Unitario,1,1,Obra,1,37
10,13,"REHABILITACIÓN DE SEÑALAMIENTO HORIZONTAL EN VIALIDADES PRINCIPALES DE LA CIUDAD DE LEÓN, GTO. ",Unitario,1,1,Obra,1,42
11,0266-1,PROYECTO  EJECUTIVO DE LA CALLE BETANIA TRAMO:  FRAY  DANIEL MIRELES A VALERIANA COLONIA :  LAS ROSAS  ,Unitario,1,1,Obra,1,62
12,17,PROYECTO EJECUTIVO  DE RENOVACIÓN DE PARADEROS DE BLVD. ADOLFO LOPEZ MATEOS ,Unitario,1,1,Proyecto,1,61
13,20,"MEJORAMIENTO DEL SITIO DEL PARQUE LINEAL ARROYO EL MUERTO TRAMO: DE BLVD. LAS TORRES A CONGRESO DE CHILPANCINGO Y BLVD. GUANAJUATO A BLVD. VICENTE VALTIERRA, PRIMERA ETAPA.",Unitario,1,1,Obra,1,67
15,8,"PROYECTO CALLE: TORRE DE MARFIL TRAMO  LAS TORRES A LATINOAMERICANA, COL. LAS TORRES  PROYECTO CALLE: SAN JOSÉ DE LAS LAJAS, TRAMO SAN JOSÉ DE ITURBIDE A SAN JOSÉ DE COSTA RICA, COL. REFUGIO DE SAN JOSE",Unitario,1,1,Proyecto,1,73
16,0029-1,PROYECTO EJECUTIVO DE REHABILITACION DEL AREA DEPORTIVA ENTRE EL AND. GRUPO INSURGENTES Y AV. GUTY CARDENAS EN LA COLONIA MIGUEL HIDALGO. ,Unitario,1,1,Proyecto,1,21
17,0029-2,"PROYECTO EJECUTIVO DE REHABILITACION DE ESPACIO PUBLICO EN LA COLONIA ""FRACCIONES SANTA CECILIA II"", ENTRE CALLE DOGMA CATOLICO Y CALLE MARCO AURELIO; LEON, GUANAJUATO. ",Unitario,1,1,Proyecto,1,22
18,0029-3,"PROYECTO EJECUTIVO DE REHABILITACION DE ESPACIO PÚBLICO EN LA COLONIA ""FRACCIONAMIENTO VALLE DEL REAL"", ENTRE CALLE VALLE DEL DESVAN Y CALLE REAL DE VICTORIA; LEON, GUANAJUATO. ",Unitario,1,1,Proyecto,1,23
19,0266-2,PROYECTO EJECUTIVO DE LA CALLE  FRAY  DANIEL MIRELES  BLVD. FRANCISCO  VILLA A AV. SION  ,Unitario,1,1,Proyecto,1,63
20,0266-3,"PROYECTO EJECUTIVO DE LA CALLE VALERIANA,  TRAMO BETANIA A AV. SION ",Unitario,1,1,Proyecto,1,64
21,22,CONSTRUCCIÓN DE CICLOVIA DEL BLVD. AGUSTÍN TÉLLEZ CRUCES TRAMO DE BLVD. JOSE MARIA MORELOS A BLVD. ANTONIO MADRAZO ,Unitario,1,1,Obra,1,57
22,44,DICTAMENES ESTRUCTURALES  DE INMUEBLES  DEL DIF MUNICIPAL EN VARIOS PUNTOS  DE LA CIUDAD  ,Unitario,1,1,Proyecto,1,12
23,0032-1,"PROYECTO CALLE DE LA CORONACION  (NEPAL) BANGLADESH-GENESIS LOMAS DE GUADALUPE  PROYECTO CALLE TENCA PRESA DEL TIGRE -PRESA DE LA MOJINA EL VALLADITO  PROYECTO  CALLE PAULINO  DURÁN, TRAMO : BLVD.  JUAN ALONSO DE  TORRES- RODRIGUO MORENO ZERMEÑO COL . LEON I  ",Unitario,1,1,Proyecto,1,45
24,55,"REHABILITACIÓN DE LOS CAMINOS RURALES: OJO DE AGUA DE LOS REYES  TRAMO:  COL. LA PERA A COM. MESA DE LOS REYES. IBARRILLA , TAMO: COM. IBARRILLA A COM. AGUA ZARCA . ALFARO,  TRAMO : COL. BOSQUES DEL PEDREGAL A COM. LLANO GRANDE ACCESO  AL AUTODROMO. UBICACIÓN LEÓN, GTO. ",Unitario,1,1,Obra,1,16
25,35,"REHABILITACIÓN DE LOS CAMINOS  RURALES: ZAUCO. TRAMO E.C. LEÓN- SAN FELIPE A COM. EL ZAUCO. SAN JUAN DE OTATES. TRAMO: COM. LA ESTACIA. DUARTE, TRAMO: COM. DUARTE A E.C. COMANJILLA, TRAMO COMANJILLA - LAS COLORADAS. DERRAMADERO. TRAMO: VAQUERIAS - E.C. CARRETERA  SILAO-SAN FELIPE UBICACIÓN : LEON, GTO.  ",Unitario,1,1,Obra,1,17
26,43,PAVIMETACIÓN DE LA CALLE IRLANDA ,Unitario,1,1,Obra,1,213
27,40,PAVIMENTACION DE LA CALLE JACARANDA DEL VALLE TRAMO: OLIVO DEL VALLE A AVELLANO DEL VALLE COL. VALLE DE LEON ,Unitario,1,1,Obra,1,47
28,34,"DISEÑO, GERENCIAMIENTO Y ASESORIA PARA EL PROYECTO DE LA 3A ETAPA DE LA REHABILITACIÓN INTEGRAL SISTEMA DE ALUMBRADO PÚBLICO, LEÓN GTO. ",Unitario,1,1,Proyecto,1,30
29,36,PROYECTO EJECUTIVO DE ÁREA DE QUIRÓFANO PARA CIRUGÍA OFTÁLMICA AMBULATORIA UBICADO EN LA CALLE SOL PONIENTE Y CALLE AMANECER COL. VALLE DEL SOL ,Unitario,1,1,Obra,1,32
30,26,"PROYECTO EJECUTIVO PARA LA CONSTRUCCION Y EQUIPAMIENTO  DE UNA SALA  DE  TITULACION  EN EL INSTITUTO  TECNOLOGICO DE LEÓN, EN LEON GUANAJUATO  ",Unitario,1,1,Obra,1,18
31,48,ADECUACION  DE PROYECTO  EJECUTIVO DE CENTRO  IMPULSO  SOCIAL  QUINTA DE LOS CASTILLOS  EN LEON GTO. COL. VALLE DE LOS CASTILLOS  ,Unitario,1,1,Proyecto,1,19
32,30,DICTAMENES ELECTRICOS DE INMUEBLES DEL DIF MUNICIPAL EN VARIOS PUNTOS DE LA CIUDAD.,Unitario,1,1,Proyecto,1,5
33,0028-1,"PROYECTO EJECUTIVO DE REHABILITACION DE ESPACIO PUBLICO EN LA COLONIA ""FRACCIONES DE SANTA JULIA"", ENTRE CALLE DEL TORBELLINO Y CALLE ANDADOR DEL TAJO; LEON, GUANAJUATO. ",Unitario,1,1,Proyecto,1,50
34,0028-2,"PROYECTO EJECUTIVO DE REHABILITACION DE ESPACIO PÚBLICO EN LA COLONIA ""FRACCIONES DE SANTA JULIA"", ENTRE CALLE DE LA CAMPIÑA Y AV. OLIMPICA; LEON, GUANAJUATO. ",Unitario,1,1,Proyecto,1,51
35,0028-3,"PROYECTO EJECUTIVO DE REHABILITACION DE ESPACIO PUBLICO EN LA COLONIA ""FRACCIONAMIENTO JARDINES DE SANTA JULIA Y FRACCIONAMIENTO VILLAS MARIANA"", ENTRE BLVD. RIO MAYO Y BLVD. PASEO DE JEREZ; LEON, GUANAJUATO. ",Unitario,1,1,Proyecto,1,52
36,0028-4,"PROYECTO EJECUTIVO DE REHABILITACION DE ESPACIO PÚBLICO EN LA COLONIA ""PASEOS DEL MOLINO"", ENTRE LA CALLE MOLINO DE LEON Y CIRCUITO MOLINO DE LA MANCHA; LEON, GUANAJUATO. ",Unitario,1,1,Proyecto,1,53
37,0027-2,"PROYECTO EJECUTIVO DE REHABILITACION DE ESPACIO PÚBLICO EN LA COLONIA ""PASEOS DE LA CIMA"", EN CALLE PASEOS DEL ORIEN; LEON, GUANAJUATO. ",Unitario,1,1,Obra,1,24
38,0027-3,"PROYECTO EJECUTIVO DE REHABILITACION DE ESPACIO PÚBLICO EN LA COLONIA ""SAUCILLOS DE LA JOYA"", ENTRE CALLE PASCAL, KANT Y CALLE PLATON; LEON, GUANAJUATO. ",Unitario,1,1,Proyecto,1,25
39,0027-4,"PROYECTO EJECUTIVO DE REHABILITACION DE ESPACIO PUBLICO EN LA COLONIA ""FRACCION FRACCIONES DE SAN JUAN BAUTISTA"", ENTRE CALLE HACIENDA TABOADA Y EPSILON; LEON, GUANAJUATO. ",Unitario,1,1,Proyecto,1,26
40,54,"PROYECTO  INFRAESTRUCTURA  SOCIAL  EN LA  COMUNIDAD  RURAL DE ""PLAYAS DE SOTELO"" EN LEÓN, GUANAJUATO. ",Unitario,1,1,Proyecto,1,54
41,70,"PROYECTO EJECUTIVO DE LA PAVIMENTACIÓN DE LA CALLE  DEL SACRISTAN, TRAMO  DE ARGELIA  A VICENTE  VALTIERRA ",Unitario,1,1,Proyecto,1,48
42,0025-1,"PROYECTO CALLE SAN JOSE DE LAS LAJAS, TRAMO: SAN JOSE DE ITURBIDE A SAN JOSE DEL CABO ",Unitario,1,1,Proyecto,1,27
43,0025-2,"PROYECTO CALLE: SAN JOSÉ DE BUENAVENTURA, TRAMO: SAN JOSÉ DEL REFUGIO A SAN JOSÉ DEL CABO ",Unitario,1,1,Proyecto,1,28
44,0025-3,"PROYECTO CALLE : DEL RESPLANDOR, TRAMO: BLVD. DELTA A POTRERO DE CORPUS ",Unitario,1,1,Proyecto,1,29
45,39,"PAQUETE NUMERO 6"" REALIZACIÓN DE  ESTUDIOS  DE MANIFESTACIÓN DE IMPACTO AMBIENTAL  EN DIFERENTES PARTES DE LA CIUDAD DE LEON, GTO.  ",Unitario,1,1,Proyecto,1,33
46,38,ADECUACIÓN DE PROYECTO EJECUTIVO DE PLAZA COMUNITARIA EN LA CALLE COSTA AZUL EN LA COLONIA  PASEOS DEL MANUEL  ,Unitario,1,1,Proyecto,1,55
47,37,"ADECUACIÓN DE PROYECTOS  ESTRUCTURALES  DE CIMENTACION PARA VARIAS ESCUELAS DE LA CIUDAD DE LEON,  ",Unitario,1,1,Proyecto,1,31
48,73,PROYECTO CALLE : ADECUACION DE LA CALLE NOSTALGIA TRAMO: MELANCOLIA  A  BLVD. LA LUZ  COL. SAN PEDRO DE LOS HERNANDEZ ,Unitario,1,1,Proyecto,1,69
49,46,"PAVIMENTACION DE LA CALLE PARQUE DE SAN JUAN, TRAMO : MURALLA DE SAN JUAN A  PROVINCIA  DE SAN JUAN EN LA COLONIA  VILLAS DE SAN JUAN ",Unitario,1,1,Obra,1,70
50,50,"CONSTRUCCIÓN DE TECHADO EN AREA DEPORTIVA EN TELESECUDARIA  NO. 1107 CCT:11ETV1107Z, UBICADA EN  CALLE EL RESPLANDRO SN COMUNIDAD EL  RESPLANDOR ",Unitario,1,1,Obra,1,71
51,69,"CONSTRUCCIÓN DE SANITARIO ATIPICO EN LA TELESECUNDARIA  NUM. 759, CCT:11ETV0755X UBICADA EN LA LABORCITA CARRETERA LEON-DUARTE ",Unitario,1,1,Obra,1,72
52,15,DESAZOLVE DE CANALES EN LAS COMUNIDADES DE SAN JOSE DEL RESPLANDOR Y PLAYAS DEL SOTELO,Unitario,1,1,Obra,1,74
53,0009-1,PROYECTO CALLE BALCÓN DE LAS TERMITAS,Unitario,1,1,Proyecto,1,75
54,0009-2,PROYECTO CALLE: TALÍA,Unitario,1,1,Proyecto,1,76
55,0009-3,PROYECTO CALLE: BALCÓN DE LOS JARIBUS,Unitario,1,1,Proyecto,1,77
56,0005-2,PROYECTO CALLE: MADRE LUISA,Unitario,1,1,Proyecto,1,85
57,0005-1,PROYECTO CALLE: MINERAL DEL LLANO,Unitario,1,1,Proyecto,1,86
58,0027-1,"PROYECTO EJECUTIVO DE REHABILITACION DE ESPACIO PÚBLICO EN LA COLONIA ""FRACC. FRACCIONES DE SAN JUAN BAUTISTA"", EN LA CALLE HACIENDA JARAL DE BERRIOS; LEON, GUANAJUATO.",Unitario,1,1,Proyecto,1,124
59,88,"REHABILITACIÓN DE MINIDEPORTIVA GRANADA, UBICADA EN LA CALLE LAGO CAMECUARO ESQUINA CALLE CUITZEO, EN LA COLONIA GRANADA. ",Unitario,1,1,Obra,1,49
60,87,"REHABILITACIÓN DE MINIDEPORTIVA IV CENTENARIO, UBICADA EN LA CALLE FRANCISCO ZUÑIGA, EN EL FRACCIONAMIENTO HIDALGO. ",Unitario,1,1,Obra,1,35
61,85,"REHABILITACIÓN DE MINIDEPORTIVA SAN FRANCISCO DE ASIS, UBICADA EN LA CALLE 16 DE JULIO ESQUINA 4 DE OCTUBRE, EN LA COLONIA SAN FRANCISCO DE ASIS. ",Unitario,1,1,Obra,1,36
62,84,"REHABILITACIÓN DE MINIDEPORTIVA SAN MIGUEL, UBICADA EN LA CALLE  TIERRA BLANCA ESQUINA CERRADA COATZACOALCOS, EN LA COLONIA JARDINES DE SAN MIGUEL. ",Unitario,1,1,Obra,1,34
64,0072-1,"PROYECTO  CALLE : AÑORANZA TAMO: SENDERO MAYA A PAVIMENTO EXISTENTE, COLONIA  ARBOLEDAS DE SAN PEDRO , TRAMO : SENDERO  MAYA A PAVIMENTO EXISTENTE ",Unitario,1,1,Proyecto,1,96
65,61,"CONSTRUCCIÓN DE TECHADO EN AREA DEPORTIVA EN LA PRIM. MARCOS  PLASCENCIA CCT:11DPR3522D, UBICADA EN LEON I RODRIGO  ZERMEÑO NUM. 206",Unitario,1,1,Obra,1,80
66,59,"MANTENIMIENTO A VIALIDADES, ESPACIOS PUBLICOS Y MOBILIARIO URBANO EN LA CIUDAD DE LEON, GTO. ",Unitario,1,1,Obra,1,98
67,56,"REPARACIÓN DE LA BARDA PERIMETRAL EN LA ESCUELA PRIMARIA 466, UBICADA EN LA JOYA. ",Unitario,1,1,Obra,1,99
68,3,"ADECUACION DEL CENTRO  DE CONTROL Y BIENESTAR ANIMAR UBICADO EN  CALLE RIO VERDE #243, FRACC. LA LUZ 1ER ETAPA. ",Unitario,1,1,Obra,1,125
69,0008-2,PROYECTO CALLE: SAN JOSÉ DE LAS LAJAS TRAMO :SAN JOSÉ DE ITURBIDE A SAN JOSÉ DE COSTA RICA,Unitario,1,1,Proyecto,1,117
70,0008-1,"PROYECTO CALLE: TORRE DE MARFIL, TRAMO :LAS TORRES A LATINOAMERICANA",Unitario,1,1,Proyecto,1,118
71,58,MANTENIMIENTO  DE ESPACIOS  NATURALES  Y AREAS   VERDES EN GLORIETAS Y PARQUES  URBANOS DE  LA CIUDAD  DE LEON GUANAJUATO ,Unitario,1,1,Obra,1,115
72,92,PROYECTO :ADECUACIÓN  DE PROYECTO EJECUTIVO  DE CICLOVIA  DEL BLVD. PASEO DE JEREZ  TRAMO : DEL BLVD. TIMOTEO LOZANO A BLVD. ADOLFO LOPEZ MATEOS. UBICACIÓN : LEON GUANAJUATO ,Unitario,1,1,Proyecto,1,94
73,16,"ACTUALIZACIÓN Y MODIFICACIÓN DEL PROYECTO EJECUTIVO DEL PARQUE JUÁREZ UBICADO EN BLVD. TIMOTEO LOZANO, INDEPENDENCIA Y HONDA DE SAN MIGUEL EN LA COLONIA SAN MIGUEL",Unitario,1,1,Proyecto,1,114
74,0004-1,PROYECTO CALLE: JOSÉ MARÍA CASULLO,Unitario,1,1,Proyecto,1,84
75,0004-2,PEROYECTO CALLE: MADRE AMALIA,Unitario,1,1,Proyecto,1,83
76,0006-1,"PROYECTO CALLE: FRANCISCO LOPEZ VELASCO,  TRAMO: JOSE MARIA BRITO - JOSE MA. ROA BARCENAS",Unitario,1,1,Proyecto,1,122
77,0010-1,"PROYECTO CALLE: YACIMIENTO DE COBRE, TRAMO :BLVD. YACIMIENTO - YACIMIENTO VOLCÁNICO",Unitario,1,1,Proyecto,1,89
78,0010-4,"PROYECTO CALLE: YACIMIENTO METALURGICOPROYECTO, TRAMO :BLVD. YACIMIENTO - YACIMIENTO VOLCÁNICO",Unitario,1,1,Proyecto,1,121
79,0010-5,"PROYECTO CALLE: YACIMIENTO MINERAL,TRAMO:BLVD. YACIMIENTO - YACIMIENTO MINERAL",Unitario,1,1,Proyecto,1,93
80,0010-3,"PROYECTO CALLE: YACIMIENTO ACUIFERO, TRAMO:BLVD. YACIMIENTO - YACIMIENTO VOLCÁNICO",Unitario,1,1,Proyecto,1,91
81,0010-2,"PROYECTO CALLE: YACIMIENTO DE CARBÓN, TRAMO:BLVD. YACIMIENTO - YACIMIENTO VOLCÁNICO",Unitario,1,1,Proyecto,1,90
82,0006-2,PROYECTO CALLE: FRANCISCO M. SANCHEZ DE TAGLE: JOSE MARIA BRITO - JOSE MA. ROA BARCENAS,Unitario,1,1,Proyecto,1,123
83,96,PROYECTO EJECUTIVO DEL  COMEDOR  Y CENTRO  GERONTOLOGICO  EN LA COLONIA PILETAS IV.,Unitario,1,1,Proyecto,1,116
84,60,PAVIMENTACION DE LAS BANQUETAS DE LA CALLE AMAZONITAS  TRAMO:  GRANJAS DE SAN JUAN - FARO DE SAN JUAN COL. VILLAS DE SAN JUAN ,Unitario,1,1,Obra,1,81
85,18,"REHABILITACION AV. LA MERCED (SEGUNDA ETAPA), EN EL TRAMO DE BLVD. TORRES LANDA-CALLE FLAMENCO, LEON GTO",Unitario,1,1,Obra,1,132
86,0025-4,"PROYECTO CALLE: TORRES FLANQUEANTE, TRAMO: TRONERAS A ATALAYA",Unitario,1,1,Proyecto,1,134
87,0031-1,PROYECTO EJECUTIVO DE REHABILITACION DEL AREA DEPORTIVA UBICADA EN LA CALLE GARCETA DE LA COLONIA SAN IGNACIO. ,Unitario,1,1,Proyecto,1,138
88,0031-2,"PROYECTO EJECUTIVO DE REHABILITACION DEL AREA DEPORTIVA UBICADA EN LA CALLE ALBERTO F. DANEL DE LA COLONIA ""FRACCIONAMIENTO SANTA MARIA DE CEMENTOS"". ",Unitario,1,1,Proyecto,1,139
89,51,"MEJORAMIENTO DE LA IMAGEN URBANA Y MANTENIMIENTO DE CAMELLONES EN LAS SIGUIENTES VIALIDADES: BLVS. JUAN A DE TORRES, BLVD. MIGUEL C SAAVEDRA, BLVD. CAMPESTRE, BLVD. LOPEZ SANABRIA, PASEO DE LOS INSURGENTES, BLVD.SAN JUAN BOSCO Y BLVD. HILARIO MEDINA, LEON GTO. ",Unitario,1,1,Obra,1,152
90,68,"CONSTRUCCIÓN  TECHADO EN AREA DEPORTIVA EN  TELESECUNDATIA 585, CCT:11ETV0582W, UBICADA EN  COM. ALBARRADONES  CARRETERA LEON-COMANJILLA S/N",Unitario,1,1,Obra,1,131
91,52,"MEJORAMIENTO DE LA IMAGEN URBANA Y MANTENIMIENTO DE CAMELLONES EN LAS SIGUIENTES VIALIDADES: BLVD. JOSE MARIA MORELOS, BLVD. PASEO DE JEREZ, BLVD. VICENTE VALTIERRA, BLVD. LA LUZ, BLVD. MIGUEL HIDALGO, BLVD. A. MADRAZO Y BLVD. H. BUSTOS, LEON GTO",Unitario,1,1,Obra,1,136
92,47,"MEJORAMIENTO DE LA IMAGEN URBANA Y MANTENIMIENTO DE CAMELLONES EN LAS SIGUIENTES VIALIDADES: BLVD. ADOLFO LOPEZ MATEOS, BLVD. MARIANO ESCOBEDO, BLVD. AEROPUERTO, BLVD. DELTA, BLVD. DELTA, BLVD. SAN PEDRO, MALECON DEL RIO Y BLVD. VASCO DE QUIROGA, LEON GUANAJUATO ",Unitario,1,1,Obra,1,137
93,91,"REHABILITACIÓN DE MINIDEPORTIVA SANTA MARIA DEL GRANJENO, UBICADA EN LA CALLE OCEANO ARTICO ESQUINA MAR ROJO, EN LA COLONIA SANTA MARIA DEL GRANJENO.",Unitario,1,1,Obra,1,128
94,41,PAVIMENTACION DE LA CALLE SANTA CROCCE TRAMO: PAVIMENTO EXISTENTE-BLVD. TIMOTEO LOZANO EN LA COLONIA SANTA CROCCE ,Unitario,1,1,Obra,1,155
95,42,"REHABILITACION DE AV. NICARAGUA, LEON GTO ",Unitario,1,1,Obra,1,142
96,89,"REHABILITACIÓN DE MINIDEPORTIVA MORELOS, UBICADO EN LAS CALLES 14 DE MAYO ESQUINA CALLE INDUSTRIA MORELOS, EN LA COLONIA MORELOS.",Unitario,1,1,Obra,1,133
97,86,"REHABILITACIÓN DE MINIDEPORTIVA NUEVA CANDELARIA, UBICADA EN LA CALLE SANCHEZ ESQUINA MAZATLAN, EN LA COLONIA NUEVA CANDELARIA.",Unitario,1,1,Obra,1,127
98,76,"PLAN DE MODERNIZACIÓN  DE INFRAESTRUCTURA 2018, MERCADO ECHEVESTE DEL MUNICIPIO DE LEON GUANAJUATO ",Unitario,1,1,Obra,1,147
99,53,"PLAN DE MODERNIZACIÓN  DE INFRAESTRUCTURA 2018, MERCADO LA ESPERANZA DEL MUNICIPIO DE LEON GUANAJUATO ",Unitario,1,1,Obra,1,148
100,57,MANTENIMIENTO  AL  EQUIPO UBARNO (FUENTES) DE LA CIUDAD  DE LEON GUANAJUATO  ,Unitario,1,1,Obra,1,149
101,81,"PAVIMENTACIÓN DEL BARRIO DE SAN JUAN DE DIOS, 2DA. ETAPA, (CALLE IGNACIO ALTAMIRANO TRAMO ROSAS MORENO A 5 DE FEBRERO, CALLE  DIAZ MIRÓN DE IGNACIO  ALTAMIRANO A VICENTE GUERRERO Y VICENTE GUERRERO A ROSAS MORENO A DIAZ MIRÓN  ",Unitario,1,1,Obra,1,150
102,74,"REHABILITACIÓN  Y REUBICACIÓN  DE RETORNOS EN BLVD. AEROPUERTO (2DA ETAPA), LEON  GUANAJUATO ",Unitario,1,1,Obra,1,135
103,118,"SUMINISTRO  Y COLOCACION DE CALENTADORES SOLARES EN LAS COMUNIDADES:  LA SANDIA, NUEVO LINDERO, SAN JUDAS, PUERTA  DEL CERRO, LA RESERVA,  LA MORA, EL NACIMIENTO, LOS RAMIREZ, PROVIDENCIA, LOS TEPETATES, EL RESPLANDOR, LA ARCINA, EL TERRERO, PLAYAS DE SOTELO, GRANJAS ECONOMICAS, LOS LOPEZ, SANTA ROSA PLAN DE AYALA,   ENTRE OTRAS.  ",Unitario,1,1,Obra,1,200
104,117,"CALENTADORES SOLARES EN LAS COLONIAS : AGUA  AZUL, ARBOLEDAS DE SAN  JOSE, ARBOLEDAS DE SEÑORA, AZTECA, DEPORTIVA  I Y II, INDUSTRIAL, MOREÑA, LA RAZA, LOMAS DE JEREZ, LOS FRESNOS, LOS MURALES, MEZQUITAL DE VILLAS DE SAN CARMEN, PRADO  HERMOSO, RIVERA DEL CARMEN, SANTA ROSA DE LIMA, UNIDAD DEPORTIVA II, VALLE DE SEÑORA, VILLAS DE NUESTRA SEÑORA DE LA LUZ, VILLAS DE SAN JUAN, ENTRE OTRAS ",Unitario,1,1,Obra,1,199
105,126," CALENTADORES SOLARES EN LOS POLOS DE DESARROLLO DUARTE, SAN JUAN DE OTATES EN LAS  COMUNIDADES: LOZA DE LOS PADRES, DUARTE, SAN JUAN DE OTATES, SAN CARLOS LA  RONCHA, LA LABORCITA.  ",Unitario,1,1,Obra,1,207
106,95,"PROYECTO DE ADECUACIÓN EN EL MERCADO ESPIRITU SANTO ESQUINA BVLD. SAN JUAN BOSCO, ENTRE LAS CALLES  SALAMANCA Y SAN JUAN DE  LOS LAGOS, COL.  ESPAÑA EN LEÓN GUANAJUATO.  ",Unitario,1,1,Proyecto,1,173
107,0094-1,REHABILITACION DE CAMINO SACA COSECHA  BARRETOS-CAMINO LA ARCINA  UBICACIÓN: COMUNIDAD  DE BARRETOS ,Unitario,1,1,Obra,1,129
108,0094-2,REHABILITACIÓN DE CAMINO SACA COSECHA  BARRETOS-EL RAYO   UBICACIÓN: COMUNIDAD  DE BARRETOS ,Unitario,1,1,Obra,1,130
109,0078-1,REHABILITACIÓN DE CAMINO SACA COSECHA NUEVO LINDERO -LA ARCINA UBICACIÓN : COMUNIDAD NUEVO  LINDERO-LA ARCINA ,Unitario,1,1,Obra,1,102
110,0078-2,REHABILITACIÓN DE CAMINO SACA COSECHA NUEVO LINDERO- RANCHO NUEVO DE LA LUZ UBICACIÓN : COMUNIDAD NUEVO LINDERO ,Unitario,1,1,Obra,1,106
111,0093-1,REHABILITACIÓN DE CAMINOS SACA COSECHA BARRETOS UBICACIÓN: COMUNIDAD BARRETOS ,Unitario,1,1,Obra,1,103
112,0093-2,REHABILITACIÓN DE CAMINOS SACA COSECHA EL RAYO-CAMINO ESTANCIA DE LA SANDIA UBICACIÓN : COMUNIDA EL RAYO,Unitario,1,1,Obra,1,104
113,0093-3,REHABILITACIÓN DE CAMINO SACA COSECHA RAMILLETE - SAN JOSE DE LOS SAPOS UBICACIÓN: COMUNIDAD RAMILLETE- SAN JOSE DE LOS SAPOS ,Unitario,1,1,Obra,1,105
114,0080-1,REHABILITACIÓN  DE CAMINO SACA COSECHA  LA SANDIA  -EL MAGUEY   UBICACIÓN: COMUNIDAD LA SANDIA -EL MAGUEY  ,Unitario,1,1,Obra,1,144
115,0080-2,REHABILITACIÓN DE CAMINO SACA COSECHA NUEVO LINDERO -CARR. BARRETOS -SAN JUDAS UBICACIÓN: COMUNIDAD NUEVO LINDERO  ,Unitario,1,1,Obra,1,146
116,0080-3,REHABILITACIÓN  DE CAMINO SACA COSECHA  LA CINTA -CAMINO ESTANCIA DE LA SANDIA  UBICACIÓN  LA CINTA  ,Unitario,1,1,Obra,1,145
117,0079-1,REHABILITACIÓN DE CAMINO SACA COSECHA  LOS RAMIREZ-  CARRETERAS SAN JUDAS  RANCHO NUEVO LA LUZ UBICACIÓN COMUNIDAD LOS RAMIREZ ,Unitario,1,1,Obra,1,110
118,0079-2,REHABILITACIÓN DE CAMINO SACA COSECHA MALAGANA-SAN ISIDRO DE LAS COLONIAS  UBICACIÓN COMUNIDAD MALAGANA -SAN ISIDRO DE LAS COLONIAS. ,Unitario,1,1,Obra,1,111
119,0077-1,REHABILITACION DE CAMINO SACA COSECHA RANCHO  NUEVO DE LA LUZ- LOS  VALLEJO ,Unitario,1,1,Obra,1,112
120,0077-2,"REHABILITACION DE CAMINO SACA COSECHA RANCHO  NUEVO DE LA LUZ- PLAN LIBERTADOR, COMUNIDAD RANCHO NUEVO DE LA LUZ ",Unitario,1,1,Obra,1,113
121,0112-1,"REHABILITACIÓN DE CAMINO ARBOLEDAS DE LOS  LOPEZ TRAMO:  CAMINO A CAPELLANIA DE LOERA-ESCUELAS ARBOLEDAS DE LOS LOPEZ, UBICACIÓN: COMUNIDAD ARBOLEDAS DE LOS LOPEZ  ",Unitario,1,1,Obra,1,189
122,0112-2,REHABILITACIÓN DE CAMINO DE ACCESO A SAN JOSE DEL CLAVEL- CAPELLANIA DE LOERA TRAMO : COMUNIDAD DE SAN JOSE DEL CLAVEL - CAPELLANIA DE LOERA . UBICACIÓN : COMUNIDAD  SAN JOSE DEL CLAVEL- CAPELLANIA DE LOERA.  ,Unitario,1,1,Obra,1,190
123,62,"CONSTRUCCIÓN DE BARDA PERIMETRAL EN EL  DIF, UBICADO EN LA CALLE  GRANJA NORMA,  DE LA COLONIA GRANJA IVEG.   ",Unitario,1,1,Obra,1,165
124,0032- 1,"PROYECTO CALLE DE LA CORONACION  (NEPAL), TRAMO :BANGLADESH-GENESIS  ",Unitario,1,1,Proyecto,1,210
125,0032-2,"PROYECTO CALLE TENCA, TRAMO :PRESA DEL TIGRE -PRESA DE LA MOJINA   ",Unitario,1,1,Proyecto,1,211
126,0032-3,"PROYECTO  CALLE PAULINO  DURÁN, TRAMO : BLVD.  JUAN ALONSO DE  TORRES- RODRIGUO MORENO ZERMEÑO  ",Unitario,1,1,Proyecto,1,212
127,65,"CONSTRUCCION DE ESPACIOS URBANOS EN EL MALECON DEL RIO DE LOS GOMEZ, TRAMO: CALLE OLIMPO A BLVD. TORRES LANDA ",Unitario,1,1,Obra,1,168
128,66,"PAVIMENTACION DE BLVD. JOSE MARIA MORELOS TRAMO: DISTRIBUIDOR BENITO JUAREZ-PASEO DE LOS INSURGENTES, (PRIMERA ETAPA)  ",Unitario,1,1,Obra,1,169
129,135,"REHABILITACION DEL MERCADO CENTRO COMERCIAL ALLENDE, UBICACIÓN: ENTRE CALLES AV. 27 DE SEPTIEMBRE, AQUILES SERDAN E IGNACIO LOPEZ RAYON ",Unitario,1,1,Obra,1,221
130,105,"CONSTRUCCION Y REHABILITACIÓN DE BANQUETAS EN BLVD.  LA LUZ (1RA ETAPA ), LEON  GTO.  ",Unitario,1,1,Obra,1,183
131,0072-2,"PROYECTO: PROYECTO EJECUTIVO DE RODOLFO PADILLA , TRAMO : BLVD. VASCO DE QUIROGA A BLVD. FRANCISCO VILLA  UBICACIÓN : LEON GUANAJUATO  ",Unitario,1,1,Obra,1,214
132,98,"CONSTRUCCION DE UN ESTACIONAMIENTO EN LAS INSTALACIONES DE LA FERIA ESTATAL DE LEON, EL CENTRO DE CIENCIAS EXPLORA Y POLIFORUM ",Unitario,1,1,Obra,1,175
133,49,"MEJORAMIENTO DE IMAGEN URBANA Y MANTENIMIENTO DE CAMELLONES EN LAS SIGUIENTES VIALIDADES: BLVD. J.J. TORRES LANDA, BLVD. FRANCISCO VILLA, BLVD. G. BOCANEGRA, BLVD. TIMOTEO LOZANO, BLVD.HERMANOS ALDAMA Y BLVD. JUAREZ, LEON, GUANAJUATO ",Unitario,1,1,Obra,1,164
134,83,"REHABILITACIÓN DE MINIDEPORTIVA LOS OLIVOS, UBICADA EN LA CALLE ELISA ESQUINA PUERTO DE CORUÑA, EN LA COLONIA LOS OLIVOS. ",Unitario,1,1,Obra,1,143
135,90,"REHABILITACION DE MINIDEPORTIVA SATELITE, UBICADA EN BLVD. MARIANO ESCOBEDO Y HAWAII, EN LA COLONIA SATELITE ",Unitario,1,1,Obra,1,172
136,0110-1,PROYECTO  CALLE :RÍO  SOTO LA MARINA  TRAMO: RIO TECOLUTLA   A  TOPAR  COL. SAN MIGUEL  INFONAVIT ,Unitario,1,1,Proyecto,1,68
137,0110-2,"PROYECTO  CALLE : CORTIJO DE ANZAR (COMUNIDAD DE LA MALAGANA, SAN ANTONIO DEL MONTE ) TRAMO : CARRETERA MANUEL DOBLADO A LEÓN A CALLE  CORTIJO DEL HUACO, UBICACIÓN : COL MALAGANA ( SAN ANTONIO DEL MONTE ) ",Unitario,1,1,Proyecto,1,215
138,121," CALENTADORES SOLARES EN LOS POLOS DE DESARROLLO LA SANDIA, LOS RAMIREZ, SANTA ANA DEL CONDE, EN LAS COMUNIDADES : SAN JUDAS, EL CONSUELO, SAN JOSE DEL RESPLANDOR, NUEVO LINDERO, BARRETOS, MIGUEL HIDALGO, SANDIA, LA CINTA, SAN AGUSTIN DEL MIRASOL, SAN FRANCISCO DE DURAN,  PROVIDENCIA, SAN JOSE DE BARRON, GUADALUPE VICTORIA, SAN RAFAEL DE LOS RAMIREZ,  PLAYAS DE SOTELO, BENITO JUAREZ, MIGUEL   HIDALGO, ARCINA, TERRERO, SANTA ANA DEL CONDE.  ",Unitario,1,1,Obra,1,203
139,104,"MANTENIMIENTO Y APLICACIÓN DE RIEGO A CAMELLONES Y AREAS VERDES PUBLICAS, LEON, GTO.  ",Unitario,1,1,Obra,1,181
140,101,MANTENIMIENTO A VIALIDADES NO PAVIMENTADAS EN LA ZONA SUR DE LA CIUDAD DE LEON GTO ,Unitario,1,1,Obra,1,178
141,102,"MANTENIMIENTO A VIALIDADES NO PAVIMENTADAS EN LA  ZONA NOR-ORIENTE DE LA CIUDAD DE LEON, GTO.  ",Unitario,1,1,Obra,1,179
142,103,"MANTENIMIENTO A VIALIDADES NO PAVIMENTADAS EN LA ZONA NOR- PONIENTE DE LA CIUDAD DE LEON, GTO. ",Unitario,1,1,Obra,1,180
143,113,"REHABILITACIÓN DE CAMINO DE ACCESO A MESA DE IBARRILLA, TRAMO IBARRILLA - MESA DE IBARRILLA, UBICACIÓN : COMUNIDAD DE IBARRILLA  ",Unitario,1,1,Obra,1,191
144,116,REHABILITACIÓN DE CAMINO DE ACCESO A OJO DE AGUA DE REYES UBICACIÓN: COMUNIDAD OJO DE AGUA DE REYES  ,Unitario,1,1,Obra,1,198
145,0115-1,"REHABILITACIÓN DE CAMINO  RANCHO NUEVO LA VENTA TRAMO : CALLE PRINCIPAL   RANCHO NUEVO LA VENTA, UBICACIÓN: COMUNIDAD  RANCHO NUEVO LA VENTA.  ",Unitario,1,1,Obra,1,195
146,0115-2,"REHABILITACIÓN DE CAMINO DE ACCESO A REFUGIO ROSAS  TRAMO: BALCONES DE LA JOYA- REFUGIO DE ROSAS, UBICACIÓN : COMUNIDAD  REFUGIO DE  ROSAS.  ",Unitario,1,1,Obra,1,196
147,0115-3,"REHABILITACIÓN DE CAMINO DE ACCESO A ESTACIA DE VAQUEROS, TRAMO : CARR. MANUEL DOBLADO- COMUNIDAD ESTANCIA DE  VAQUEROS. UBICACIÓN  ESTANCIA DE  VAQUEROS ",Unitario,1,1,Obra,1,197
148,99,"CONSTRUCCION DE 6 AULAS TIPO U""C CON MODULO DE ESCALERA, EN LA TELESECUNDARIA NUM.1129 CCT11ETV1129L, UBICADA EN RANCHO SAN JOSE DE LOS SAPOS AVENIDA BARAJAS S/N ",Unitario,1,1,Obra,1,176
149,97,"PLAN DE MODERNIZACION DE INFRAESTRUCTURA 2018, MERCADO LA PULGA (3RA ETAPA) DEL MUNICIPIO DE LEON GUANAJUATO ",Unitario,1,1,Obra,1,174
150,100,ADECUACION Y ESTRUCTURACION DEL CUARTEL DE POLICIA MONTADA ,Unitario,1,1,Obra,1,177
151,64,"CONSTRUCCION DE ESPACIOS URBANOS EN EL MALECON DEL RIO DE LOS GOMEZ, TRAMO: CALLE 5 DE MAYO A OLIMPO ",Unitario,1,1,Obra,1,167
152,63,"CONSTRUCCIÓN DE ESPACIOS PUBLICOS URBANOS EN EL MALECÓN DEL RÍO DE LOS GÓMEZ , TRAMO :  CALLE BLVD. JUAN ALONSO DE TORRES A CALLE 5 DE MAYO  ",Unitario,1,1,Obra,1,166
153,137,"CONSTRUCCION Y REHABILITACIÓN DE BANQUETAS EN BLVD. DELTA (1RA ETAPA ), LEON  GTO.  ",Unitario,1,1,Obra,1,224
154,82,"REHABILITACIÓN DE MINIDEPORTIVA UNIDAD OBRERA, UBICADA EN LA CALLE FIDEL VELAZQUEZ ESQUINA CALLE BLAS CHUMACERO, EN LA COLONIA OBRERA (INFONAVIT). ",Unitario,1,1,Obra,1,171
155,129,REHABILITACIÓN DE LA CALLE ESPAÑITA ( 1RA ETAPA) ,Unitario,1,1,Obra,1,216
156,107,"DEMOLICIÓN DE EDIFICACIONES EN LA ZONA DEL DISTRIBUIDOR VIAL BENITO JUAREZ, LEON, GTO.  ",Unitario,1,1,Obra,1,185
157,106,"REHABILITACIÓN DE SEÑALAMIENTO VIAL EN BULEVARES Y VIALIDADES  DE LA CIUDAD, LEON GTO.  ",Unitario,1,1,Obra,1,184
158,111,"CONSTRUCCIÓN DE BARDA PERIMETRAL EN LA PRIMARIA MARIA GREEVER , CCT 11T11DPR39410 DE LA COL. SINARQUISTAS  ",Unitario,1,1,Obra,1,188
159,120," CUARTOS ADICIONALES EN LOS POLOS DE DESARROLLO LOS SAUCES, EN LAS COMUNIDADES: LOS LOPEZ, CAPELLANIA DE LOERA, LOS SAUCES, SAN JOSE DE LOS ROMEROS, EL COPETE.  ",Unitario,1,1,Obra,1,202
160,122,"CUARTOS ADICIONALES EN LOS POLOS DE DESARROLLO RANCHO NUEVO LA VENTA, EN LAS COMUNIDADES  REFUGIO DE ROSAS, CORRAL DE PIEDRA, LAGUNILLAS.  ",Unitario,1,1,Obra,1,182
161,119,"CUARTOS ADICIONALES EN LOS POLOS DE DESARROLLO HUIZACHES, EN LAS COMUNIDADES: HUIZACHE (FUNDCIONES) HUIZACHE (RANCHO VIEJO ) HUIZACHE (ARENOSA), HUIZACHE.  ",Unitario,1,1,Obra,1,201
162,67,ESPACIO SAN FRANCISCO CONSTRUCCION DE PLAZA AMPLIACION SAN FRANCISCO (1RA. ETAPA) ,Unitario,1,1,Obra,1,170
163,131,"PLAN DE INFRAESTRUCTURA 2018, MERCADO CARRO VERDE DE LEON, GUANAJUATO ",Unitario,1,1,Obra,1,218
