Id_Obra,Clave_Obra,Nombre,Tipo_Precio,Id_Sub_Programa,Id_Localidad,Tipo_Obra_Proyecto,Id_Sub_Tipo_Obra,Id_Oficio_Asignacion_Obra
218,206,PAVIMENTACION DE LA CALLE CERRO DE LA BUFA TRAMO: DE CERRO DE SAN MIGUEL A CERRO DEL GIGANTE COL. CE,Unitario,1,1,Obra,1,0
219,209,MANTENIMIENTO DE AREAS DE REFORESTACION (PROGRAMA ARBOLIMETRO) PAQ. 2 LEON GTO.,Unitario,1,1,Obra,1,0
220,212,MANTENIMIENTO INTEGRAL DE PARQUES Y JARDINES PARA LA ZONA DE AREAS VERDES DE MINIDEPORTIVAS COMUDE P,Unitario,1,1,Obra,1,0
221,237,REHABILITACION DE INSTALACIONES ELECTRICAS EN EL MERCADO SAN FELIPE DE JESUS LEON,Unitario,1,1,Obra,1,0
222,233,PAVIMENTACION DE CONCRETO HIDRAULICO DE LA CALLE VALLE DE MESOREA TRAMO: DE VALLE JORDAN A VALLE DE,Unitario,1,1,Obra,1,0
223,242,TRABAJOS COMPLEMENTARIOS DE LA MODERNIZACION DEL MERCADO LAS AMERICAS 2DA. ETAPA LEON,Unitario,1,1,Obra,1,0
224,223,REMODELACION EN AREA ADMINISTRATIVA EDIFICO DE OBRAS PUBLICAS LEON,Unitario,1,1,Obra,1,0
225,224,PAVIMENTACION DE LA CALLE TERCERA ORDEN TRAMO: DE AV. OLIMPICA A PEDRO BERNARDONE COL. AMPLIACION SA,Unitario,1,1,Obra,1,0
226,234,PAVIMENTACION DE CONCRETO HIDRAULICO DE LA CALLE SAN JOSE DEL REFUGIO TRAMO: DEL BLVD. TIMOTEO LOZAN,Unitario,1,1,Obra,1,0
227,225,PLAN MAESTRO URBANO PAISAJISTA DEL PARQUE HIDALGO LEON,Unitario,1,1,Obra,1,0
228,227,PROYECTO EJECUTIVO DE LA DEPORTIVO DE LA DEPORTIVA METROPOLITANA. LEON,Unitario,1,1,Obra,1,0
229,226,PAVIMENTACION DE LA CALLE ANTONIO BARROSO TRAMO: DE MARIANO ESCOBEDO - CEFERINO ORTIZ COL. LEON II,Unitario,1,1,Obra,1,0
230,229,TRABAJOS COMPLEMENTARIOS PARA LA SUBCOMANDANCIA DE SEGURIDAD PUBLICA (MEJORAMIENTO) UBICADA AL PONIE,Unitario,1,1,Obra,1,0
231,232,PAVIMENTACION CON CONCRETO HIDRAULICO DE LA CALLE KABAH TRAMO: DERBY A AREA DE DONACION COL. EL POCH,Unitario,1,1,Obra,1,0
232,235,PAVIMENTACION DE OCNCRETO HIDRAULICO DE LA CALLE NOPAL DE MEDINA TRAMO: DE SALTILLO A ZARZAL DE MEDI,Unitario,1,1,Obra,1,0
233,236,"REHABILITACION DE PAVIMENTOS EN DIFERENTES TRAMOS: BLVD. FRANCISCO VILLA, MALECON DEL RIO, BLVD ALON",Unitario,1,1,Obra,1,0
234,238,PAVIMENTACION CON CONCRETO HIDRAULICO DE LA AV. DE LA MORADA (LADO PONIENTE) TRAMO: DE CRUCIFIXION A,Unitario,1,1,Obra,1,0
235,239,PAVIMENTACION CON CONCRETO HIDRAULICO DE LA CALLE CARLOS MARIA BUSTAMANTE TRAMO: CALLE ROA BARCENAS,Unitario,1,1,Obra,1,0
236,240,PAVIMENTACION CON CONCRETO HIDRAULICO DE LA CALLE RAMON RAMIREZ TRAMO,Unitario,1,1,Obra,1,0
237,243,DICTAMENES Y LEVANTAMIENTOS ARQUITECTONICOS DE VARIOS EDIFICIOS DE LA CD.,Unitario,1,1,Obra,1,0
238,244,PAVIMENTACION DE LA CALLE GRANATE TRAMO: CALLE CORAL A CALLE PERLA FRACCIONAMIENTO GUADALUPE,Unitario,1,1,Obra,1,0
239,245,PAVIMENTACION DE LA CALLE MARTIRES DE TLATELOLCO TRAMO: DE 14 DE MAYO A CALLE 26 DE AGOSTO COL. MORE,Unitario,1,1,Obra,1,0
240,246,PAVIMENTACION DE LA CALLE RAMON RAMIREZ TRAMO: DE BLVD. TELLEZ CRUCES A ANTONIO HERNANDEZ COL. LEON,Unitario,1,1,Obra,1,0
241,247,PAVIMENTACION DE OCNCRETO HIDRAULICO DE LA CALLE JOSE MANUEL SOMERA TRAMO: BLVD. MARIANO ESCOBEDO A,Unitario,1,1,Obra,1,0
242,248,PAVIMENTACION DE CONCRETO HIDRAULICO DE LA CALLE PIRUL DE MEDINA TRAMO: DE SOLIDARIDAD A ARROYO DEL.,Unitario,1,1,Obra,1,0
243,249,PAVIMENTACION CON CONCRETO HIDRAULICO DE LA CALLE CECILIO ESTRADA TRAMO: ENRIQUE GOMEZ GUERRA A FRAN,Unitario,1,1,Obra,1,0
244,250,PAVIMENTACION DE CONCRETO HIDRAULICO DE LA CALLE SAUZ DE MEDINA TRAMO: DE SOLIDARIDAD A CALLE HUESO,Unitario,1,1,Obra,1,0
245,252,PAVIMENTACION DE CONCRETO HIDRAULICO DE LA CALLE CAÑADA DE LOS SANTOS TRAMO: SALTILLO (FRANCISCO VIL,Unitario,1,1,Obra,1,0
246,253,AMPLIACION DEL CDC EN LA COLONIA VALLE DE SAN JOSE (5TA. ETAPA) VALLE DE IRTICH S/N ESQ. VALLE DE FI,Unitario,1,1,Obra,1,0
247,254,AMPLIACION DEL CDC EN LA COLONIA ERMITA ( 5A. ETAPA ) CALLE DELOS ESQ. QUIO COL. ERMITA,Unitario,1,1,Obra,1,0
248,257,PLAZA COMUNITARIA EN LA COLONIA REVOLUCION UBICADA EN LBVD. VASCO DE QUIROGA S/N COL. REVOLUCION,Unitario,1,1,Obra,1,0
249,213,"MANTENIMIENTO INTEGRAL DE PARQUES Y JARDINES INSTALACION Y MEJORAMIENTO DE SISTEMAS DE RIEGO LEON, G",Unitario,1,1,Obra,1,0
250,228,RESTAURACION DE LA FACHADA DEL MERCADO LA LUZ. LEON,Unitario,1,1,Obra,1,0
251,251,PAVIMENTACION DE LA CALLE TANTALIO TRAMO: DE NITROGENO A CALLE OXIGENO COL. VALLE DE SEÑORA,Unitario,1,1,Obra,1,0
252,270,ADECUACION DE CENTRO GERONTOLOGICO DEL DIF 2DA. ETAPA LEON,Unitario,1,1,Obra,1,0
253,258,REVESTIMIENTO DE LA CALLE RODOLFO PADILLA TRAMO: DE BLVD. JUAN ALONSO DE TORRES A CALLE ARTURO VIL,Unitario,1,1,Obra,1,0
254,259,REHABILITACION DE LOS PAVIMENTOS DE LA CALLE JEREZ DE CARTAGENA TRAMO: DE SIERRA GORDA A BALCON DE,Unitario,1,1,Obra,1,0
255,262,REHABILITACION DE LOS PAVIMENTOS DE LA AV. AMAZONAS TRAMO: DE CALLE DERBY A CUENCA FLORIDA LEON,Unitario,1,1,Obra,1,0
256,267,REVESTIMIENTO DEL CAMINO AL OJO DE AGUA TRAMO: DE MANANTIAL DEL MISSISIPI A CALLE DEL SILENCIO LEON,Unitario,1,1,Obra,1,0
257,268,REVESTIMIENTO DEL BLVD. GUANAJUATO TRAMO: CALLE MARQUEZ A RODOLFO PADILLA LEON,Unitario,1,1,Obra,1,0
258,269,REVESTIMIENTO DE LA AV. CIUDAD ASIS TRAMO: DE BLVD. SAN NICOLAS A CALLE DE SANTA MONICA LEON,Unitario,1,1,Obra,1,0
259,260,REHABILITACION DE LOS PAVIMENTOS DE LA CALLE BALCON DE LAS MARIPOSAS TRAMO: DE BALCON DE LAS GAVIOTA,Unitario,1,1,Obra,1,0
260,261,REHABILITACION DE LOS PAVIMENTOS DE LA CALLE MARCEL TRAMO: DE BLVD. ARISTOTELES A CALLE FROMM LEON,Unitario,1,1,Obra,1,0
261,265,REVESTIMIENTO DEL BLVD. HACIENDAS DE LEON TRAMO: DE AV. OLIMPICA A CALLE BAHIA DE SAN JUAN LEON,Unitario,1,1,Obra,1,0
262,266,REHABILITAICON DE LOS PAVIMENTOS DE LA CALLE SAN FRANCISCO DE ASIS TRAMO: DE CALLE MISION EVANGELICA,Unitario,1,1,Obra,1,0
263,230,PAVIMENTACION DE LA CALLE CERRO DE TANCITARO TRAMO: DE JEREZ DE CARTAGENA A CERRO DE LA BUFA COL. CE,Unitario,1,1,Obra,1,0
264,255,TRABAJOS DE LIMPIEZA DEL RIO TURBIO Y ESTABILIZACION DE TALUDES PARA PREVENCION DE INUNDACIONES VARI,Unitario,1,1,Obra,1,0
265,256,INSTALACION DE PROTECCIONES EN VIA PUBLICA EN PASILLOS DE LA COL. REAL DE LEON VIBAR,Unitario,1,1,Obra,1,0
266,271,RED DE ALUMBRADO PUBLICO SUBTERRANEA NUEVA PARA UN JARDIN EXISTENTE ENTRE LA AV. PANORAMA Y CALLE,Unitario,1,1,Obra,1,0
267,273,CONSTRUCCION DE PASEO DE SERVIDUMBRE SOBRE LO QUE SERA LA CALLE GRAN BAHIA TRAMO: DE BLVD. HACIENDAS,Unitario,1,1,Obra,1,0
268,263,REVESTIMIENTO DE LA CALLE UNIVERSALIDAD CRISTIANA TRAMO: DE CALLE HEBEREOS A CALLE CORINTO LEON,Unitario,1,1,Obra,1,0
269,264,REHABILITACION DE LOS PAVIMENTOS DE LA CALLE CRUCIFIXION TRAMO: DE BLVD. PASEO DE JEREZ A CASCADA DE,Unitario,1,1,Obra,1,0
270,272,PAVIMENTACION DE LA CALLE MADRE GLORIA TRAMO: DE MADRE SIERRA A BLVD. ATOTONILCO COL. DIEZ DE MAYO,Unitario,1,1,Obra,1,0
271,275,ADECUACION Y REHABILITACION DE ACCESO ENTRE LOS MERCADOS COMONFORT ZAPATERO Y EX ESTACIONAMIENTO COM,Unitario,1,1,Obra,1,0
272,276,PAVIMENTACION CON CONCRETO HIDRAULICO DE LA CALLE OCALO DE MEDINA TRAMO: DE SOLIDARIDAD A ARROYO,Unitario,1,1,Obra,1,0
273,277,PAVIMENTACION DE LA CALLE ANDA TRAMO: DE PIPILA A VENUS COL. OBRERA,Unitario,1,1,Obra,1,0
274,278,LETRERO PARA LA PLAZA S.S. BENEDICTO XVI LEON,Unitario,1,1,Obra,1,0
275,279,PINTURA Y RESANES EN FACHADA DE LA CALLE 27 DE SEPTIEMBRE TRAMO: LOPEZ MATEOS Y CONSTANCIA COL. OBRE,Unitario,1,1,Obra,1,0
276,280,CONSTRUCCION DE MEJORAS A CICLOFERICO BLVD. LOPEZ MATEOS TRAMO: DE BLVD. JOSE MARIA MORELOS A BLVD J,Unitario,1,1,Obra,1,0
277,281,CONSTRUCCION DE MEJORAS A CICLOFERICO BLVD. JOSE MARIA MORELOS TRAMO: DE BLVD. HIDALGO A MONUMENTO A,Unitario,1,1,Obra,1,0
278,282,PAVIMENTACION DE LA CALLE EJERCITO CONSTITUCIONALISTA TRAMO: LEVANTAMIENTO REVOLUCIONARIO A ATOTONIL,Unitario,1,1,Obra,1,0
279,283,PAVIMENTACION DE LA CALLE VIA MANZANARES TRAMO: DE CIMA  A DEL  VALLE COL. PARQUE MANZANARES,Unitario,1,1,Obra,1,0
280,284,PAVIMENTACION DE LA CALLE FRESNO TRAMO: GUTY CARDENAS A ROSSINI COL. ARBOLEDAS DE INFONAVIT,Unitario,1,1,Obra,1,0
281,285,PAVIMENTACION DE LA CALLE MINA DEL CAPOTE TRAMO: TIMOTEO LOZANO A TOPAR CON LINDERO SUR COL. LA LIBE,Unitario,1,1,Obra,1,0
282,287,AMPLIACION DE LA DIVISION DE CIENCIAS EN INGENIERIA DE LA UNIVERSIDAD DE GUANAJUATO CAMPUS LEON UBIC,Unitario,1,1,Obra,1,0
283,299,PAVIMENTACION DE LA CALLE GONZALO CURIEL TRAMO: DE BLVD. MARIANO ESCOBEDO - CLEMENTE AGUIRRE COL. SA,Unitario,1,1,Obra,1,0
284,298,RESTAURACIN DE FACHADAS CATALOGADAS POR EL INAH EN CALLE 27 DE SEPTIEMBRE LEON,Unitario,1,1,Obra,1,0
285,286,PROYECTO EJECUTIVO PARA LA CONSTRUCCION DE LOCALES COMERCIALES AFECTADOS POR EL BLVD. MORELOS LEON,Unitario,1,1,Obra,1,0
286,288,"CONSTRUCCION DEL ESTACIONAMIENTO EN EL PREDIO ""EL TLACUACHE"" DONDE SE UBICAN LOS EDIFICIOS DE OBRA P",Unitario,1,1,Obra,1,0
287,289,NOTA TECNICA PARA LA JUSTIFICACION ECONOMICA RAMO 23 PARA EL PUENTE VEHICULAR HACIENDA ARRIBA Y LA C,Unitario,1,1,Obra,1,0
288,291,PAVIMENTACION DE LA CALLE ABEDUL TRAMO: DE ENCINO - SAN ROMAN COL. ARBOLEDAS DE INFONAVIT,Unitario,1,1,Obra,1,0
289,293,PAVIMENTACION DE LA CALLE TRES TRAMO: DE PAV. EXISTENTE A CALLE LOMERIA MAS 14 MTS. COL. CHULAVISTA,Unitario,1,1,Obra,1,0
290,295,CABLEADO DE LA RED DE ALUMBRADO PUBLICO BOLARDOS Y COLOCACION DE POSTES DE CALLE 27 DE SEPTIEMBRE,Unitario,1,1,Obra,1,0
291,296,CONSTRUCCION DE MEJORAS A CICLOFERICO BLVD. MIGUEL DE CERVANTES SAAVEDRA Y BLVD. MANUEL DE AUSTRI TR,Unitario,1,1,Obra,1,0
292,300,CONSTRUCCION DE MEJORAS A CICLOFERICO SEMAFORIZACION BLVD. ADOLFO LOPEZ  MATEOS INTERSECCIONES CON,Unitario,1,1,Obra,1,0
293,301,PAVIMENTACION DE LA CALLE REALES DE KANSAS TRAMO: RIELEROS - DIABLOS ROJOS COL. DEPORTIVA II,Unitario,1,1,Obra,1,0
294,302,PAVIMENTACION  DE LA CALLE PENSAMIENTO TRAMO: DE HEROES DE LA INDEPENDENCIA - TOPAR COL.  SAN PEDRO,Unitario,1,1,Obra,1,0
295,303,PAVIMENTACION DE LA CALLE CERRO  DE LAS CAMPANAS TRAMO: DE VOLCAN DE JORULLO A CERRO DE LA BUFA COL.,Unitario,1,1,Obra,1,0
296,304,PLAZA LIBERTAD UBICADO EN TIMOTEO LOZANO S/N COL. LIBERTAD,Unitario,1,1,Obra,1,0
297,297,CONSTRUCCION DE MEJORAS A CICLOFERICO BLVD. JUAN ALONSO DE TORRES TRAMO: DE BLVD. JOSE MARIA MORELOS,Unitario,1,1,Obra,1,0
298,307,LINEA AEREA DE ALUMBRADO PUBLICO EN VIALIDAD NUEVA ENTRE CALZADA LOMAS DEL MOLINO Y CALLE AMAZONAS,Unitario,1,1,Obra,1,0
299,313,PAVIMENTACION DE LA CALLE CASUARINA TRAMO: BLVD. SAN PEDRO A PASEO LOS VERDINES COL. JARDINES DE JER,Unitario,1,1,Obra,1,0
300,315,DEMOLICION Y REPOSICION DE LOSA DE CONCRETO ARMADO DEL PUENTE PASO VEHICULAR EN COMUNIDAD LOSA DE LO,Unitario,1,1,Obra,1,0
301,316,REVESTIMIENTO DE LOS CAMINOS DE ACCESO DE LA COMUNIDAD REFUGIO DE ROSAS Y SAN JOSE DEL MALPASO LEON,Unitario,1,1,Obra,1,0
302,330,PAVIMENTACION CON CONCRETO HIDRAULICO DE LA CALLE VALLE ALMANZO TRAMO: VALLE ARIZPE A CALLE MADRE,Unitario,1,1,Obra,1,0
303,294,PAVIMENTACION DE LA CALLE VALLE DE SANTA MARIA TRAMO: ASIS-VALLE DE LA LUZ COL. VALLE DE LA LUZ,Unitario,1,1,Obra,1,0
304,319,"HABILITADO DE LA RED DE ALUMBRADO PUBLICO DEL FRACC. VILLAS DE SAN JUAN I; AREAS 23,24,25,26,27,28,2",Unitario,1,1,Obra,1,0
305,321,MANTENIMIENTO Y VIGILANCIA DE LA OBRA: OFICINAS ADMINISTRATIVAS DEL DISTRITO DE DESARROLLO RURAL (DD,Unitario,1,1,Obra,1,0
306,329,MEJORAS DE LAS INSTALACIONES DE ALUMBRADO PUBLICO EN LAS COLONIAS DEL POLIGONO DENOMINADO JACINTO,Unitario,1,1,Obra,1,0
307,338,DIFERENTES TRABAJOS DE ALUMBRADO PUBLICO POLIGONOS DE POBREZA (BLVD. SAN JUAN BOSCO Y RIZOS DEL,Unitario,1,1,Obra,1,0
308,341,PROYECTO EJECUTIVO DE PAVIMENTACION DE LAS CALLES:,Unitario,1,1,Obra,1,0
309,308,"REHABILITACION DE ADORNOS ALUSIVOS A LAS FIESTAS PATRIAS Y NAVIDEÑAS, LEON.",Unitario,1,1,Obra,1,0
310,322,"TRABAJOS DE JARDINESRIA EN PARQUE PANORAMA, LEON",Unitario,1,1,Obra,1,0
311,323,"TRABAJOS DE RIEGO POR ASPERSION, CISTERNAS Y MOBILIARIO URBANO EN PARQUE PANORAMA LEON",Unitario,1,1,Obra,1,0
312,328,SUMINISTRO Y COLOCACION DE MALLA CICLONICA EN AREA DEPORTIVA DE LA COMUNIDAD SAN JUAN DE OTATES,Unitario,1,1,Obra,1,0
313,331,PAVIMENTACION DE CONCRETO HIDRAULICO DE LA CALLE,Unitario,1,1,Obra,1,0
314,332,CONSTRUCCION DE MEJORAS A CICLOFERICO BLVD. VERTIZ CAMPERO Y BLVD. DELTA TRAMO: DE BLVD. JOSE MARIA,Unitario,1,1,Obra,1,0
315,334,INSTALACION Y ADECUACION DE LOS DISPOSITIVOS VIALES COL. SAN NICOLAS,Unitario,1,1,Obra,1,0
316,337,PAVIMENTACION DE LA CALLE ALERCE TRAMO: DE ALISOS A CUENCA FLORIDA COL. SAN NICOLAS DEL PALOTE,Unitario,1,1,Obra,1,0
317,305,PARQUE CAMPESTRE DE JEREZ UBICADO EN VALLE ARIZPE S/N COL. CAMPESTRE DE JEREZ,Unitario,1,1,Obra,1,0
318,306,EQUIPO ELECTRICO QUE SE INSTALARA EN EL BLVD. ADOLFO LOPEZ MATEOS ESQ. 20 DE ENERO LEON,Unitario,1,1,Obra,1,0
319,309,PAVIMENTACION DE LA CALLE 2DA. JEREZ DE ARRIBA TRAMO: JEREZ DE CARTAGENA - JEREZ DE FRONTERA COLONIA,Unitario,1,1,Obra,1,0
320,310,PAVIMENTACION DE LA CALLE LOMA LARGA TRAMO: CERRO DEL SOYATE - CERRO LARGO COLONIA POPULAR POLANCO,Unitario,1,1,Obra,1,0
321,373,PAVIMENTACION DE LA CALLE AURORA LUMINOSA DE CALLE DE LA MISERICORDIA A DEL EDEN,Unitario,1,1,Obra,1,0
322,342,PROYECTO EJECUTIVO DE PAVIMENTACION DE LAS CALLES: POTRILLO TRAMO: PASEO DE LA PRESA-FRENTE AL 130 C,Unitario,1,1,Obra,1,0
323,333,CONSTRUCCION DE PISO FIRME DE CONCRETO HIDRAULICO HECHO EN OBRA EN LOCALIDADES RURALES LEON,Unitario,1,1,Obra,1,0
324,355,SUMINISTRO Y COLOCACION DE PISO FIRME EN ZONA URBANA,Unitario,1,1,Obra,1,0
325,369,PROYECTO EJECUTIVO DE PAVIMENTACION DE LAS CALLES: PIRUL DE MEDINA (CAMINO SALTILLO - SOLIDARIDAD),Unitario,1,1,Obra,1,0
326,324,PAVIMENTACION DE LA CALLE PAPAGAYO TRAMO: CALLE RIO CONCHOS A RIO TECOLUTLA COL. SAN MIGUEL,Unitario,1,1,Obra,1,0
327,346,PAVIMENTACION DE LA CALLE MINA LA DEMOCRATA TRAMO: TIMOTEO LOZANO A CONGRESO CONSTITUYENTE COL.,Unitario,1,1,Obra,1,0
328,365,PROYECTO EJECUTIVO DE PAVIMENTACION DE LAS CALLES: ANDADOR TEJOCOTE TRAMO: TEJOCOTE-CAÑA COL. LAS,Unitario,1,1,Obra,1,0
329,371,"CASETA DE VIGILANCIA PARA LA 6TA. COMANDANCIA DE TRANSITO MUNICIPAL, LEON",Unitario,1,1,Obra,1,0
330,381,PROYECTO EJECUTIVO DE PAVIMENTACION  DE LAS CALLES: MEDALLA TRAMO: ADOLFO LOPEZ MATEOS-TOPAR COL. EL,Unitario,1,1,Obra,1,0
331,317,PAVIMENTACION DE LA CALLE VALLE DE SAN JOSE TRAMO: BLVD. RIO MAYO A VALLE DE JORDAN COL. VALLE DE SA,Unitario,1,1,Obra,1,0
332,318,PAVIMENTACION DE LA CALLE LOMAS DE LA PLAZA TRAMO: LOMAS DE LAS PETUNIAS A TOPAR COL. LOMAS DE MEDIN,Unitario,1,1,Obra,1,0
333,370,RECONSTRUCCION DEL TRAMO COLAPSADO EN LA VIALIDAD DENOMINADA MALECON DEL RIO NORTE LEON,Unitario,1,1,Obra,1,0
334,340,PAVIMENTACION DE LA CALLE JEREZ DE NAVARRA TRAMO: JEREZ DE SEVILLA A VALLE DE SANTIAGO COL. JESUS MA,Unitario,1,1,Obra,1,0
335,372,PAVIMENTACION DE LA CALLE VALLE AZUL TRAMO: BLVD. RIO MAYO-CALLE VALLE DE JORDAN COL. VALLE DE SAN J,Unitario,1,1,Obra,1,0
336,311,PAVIMENTACION DE LA CALLE MARMOLEJO TRAMO: DE LA CALLE CAMPANARIO A SERENATA COL. SAN PEDRO DE KOS,Unitario,1,1,Obra,1,0
337,312,CONSTRUCCION DE MEJORAS A CICLOFERICO SEMAFORIZACION DE INTERSECCION BLVD. JOSE MARIA MORELOS CON,Unitario,1,1,Obra,1,0
338,320,"RESTAURACION DE SAN FELIPE NERI, LEON",Unitario,1,1,Obra,1,0
339,325,CONSTRUCCION DE BANQUETAS EN LA CALLE BOSQUES TRAMO: DE CALLE SAN JUAN A BLVD. VICENTE VALTIERRA,Unitario,1,1,Obra,1,0
340,339,MEJORAS DE LAS INSTALACIONES DE ALUMBRADO PUBLICO EN LAS COLONIAS DEL POLIGONO DENOMINADO MEDINA,Unitario,1,1,Obra,1,0
341,348,PAVIMENTACION DE LA CALLE BALCON DE LAS GRAJILLAS TRAMO: DE BLVD. BALCON DE LA JOYA A CALLE BALCON D,Unitario,1,1,Obra,1,0
342,360,PROYECTO EJECUTIVO DE PAVIMENTACION DE LAS CALLES: GREGACION TRAMO: CAMPO VERDE-ECOLOGIA COL. CAMPO,Unitario,1,1,Obra,1,0
343,363,"PROYECTO EJECUTIVO DE PAVIMENTACION DE LAS CALLES: RIO CHAPINGO GUANAJUATO-RIO CONCHOS,",Unitario,1,1,Obra,1,0
344,366,PROYECTO EJECUTIVO DE PAVIMENTACION DE LAS CALLES: BALCON DE LOS ESTORNINOS TRAMO:DE BALCON DE LOS C,Unitario,1,1,Obra,1,0
345,375,PROYECTO EJECUTIVO DE PAVIMENTACION DE LAS CALLES: PRIVADA CATALUÑA TRAMO:PROLONGACION BARCELONA-MUR,Unitario,1,1,Obra,1,0
346,345,"PAVIMENTACION DE LA CALLE COCOTERO TRAMO:DE CEDRO A GUAYABO,COL. LAS ARBOLEDAS DEI NFONAVIT Y",Unitario,1,1,Obra,1,0
347,347,PAVIMENTACION DE LA CALLE ARTICULO 123 TRAMO: H. AYUNTAMIENTO A CORREGIDORA COL. LA LIBERTAD,Unitario,1,1,Obra,1,0
348,349,PAVIMENTACION DE LA CALLE FRAY VICTOR TRAMO: DE AV. OLIMPICA-FRAY NOE COL. AMPLIACION SAN FRANCISCO,Unitario,1,1,Obra,1,0
349,350,PAVIMENTACION DE LA CALLE SAUCE TRAMO: DE CALLE CAOBA A CALLE MANZANO COL. ARBOLEDAS DE INFONAVIT,Unitario,1,1,Obra,1,0
350,351,PAVIMENTACION DE LA CALLE SANTA ROSALIA TRAMO: DE CALLE LA FLORIDA A CALLE SAN MARCOS COL. LA FLORID,Unitario,1,1,Obra,1,0
351,357,PAVIMENTACION DE LA CALLE PROMULGACION CONSTITUCIONAL TRAMO: DE CALLE ASAMBLEA DE QUERETARO A CALLE,Unitario,1,1,Obra,1,0
352,387,PAVIMENTACION DEL BLVD. CORRALES AYALA 2DA. ETAPA LEON,Unitario,1,1,Obra,1,0
353,354,PAVIMENTACION DE LA CALLE MADRE ALEJANDRA TRAMO: DE CALLE MADRE TIERRA A MADRE FABIOLA COL. UNION,Unitario,1,1,Obra,1,0
354,344,PAVIMENTACION DE LA CALLE LEVANTAMIENTO REVOLUCIONARIO TRAMO: TIMOTEO LOZANO A TOPAR CON LINDERO SUR,Unitario,1,1,Obra,1,0
355,368,PROYECTO EJECUTIVO DE PAVIMENTACION DE LAS CALLES: BARACALDO TRAMO:BARCELON-PRIVADA BURGOS; MARTINIC,Unitario,1,1,Obra,1,0
356,382,PROYECTO EJECUTIVO DE PAVIMENTACION DE LAS CALLES: SENDERO OTOMI TRAMO: AÑORANZA-SENDERO MEXICA,Unitario,1,1,Obra,1,0
357,400,PAVIMENTACION DE LA CALLE HUELGA DE NUEVA ROSITA TRAMO: H. AYUNTAMIENTO A CORREGIDORA COL. LA LIBERT,Unitario,1,1,Obra,1,0
358,314,MEJORAS DE LAS INSTALACIONES DE ALUMBRADO PUBLICO EN LAS COLONIAS DEL POLIGONO DENOMINADO DIEZ DE,Unitario,1,1,Obra,1,0
359,326,PLAZA CIVICA DE SAN PEDRO DE LOS HERNANDEZ  Y PLAZA SATELITE DE IRLANDA A MALLORCA COL. SATELITE,Unitario,1,1,Obra,1,0
360,327,REHABILITACION DE SANITARIOS EN DIVERSAS INSTITUCIONES EDUCATIVAS LEON,Unitario,1,1,Obra,1,0
361,336,PROYECTO EJECUTIVO DE PAVIMENTACION DE LAS CALLES: ATENCA TRAMO: EROS-BLVD. CLIO COL. LA ERMITA;,Unitario,1,1,Obra,1,0
362,335,PROYECTO EJECUTIVO DE BLVD. VICENTE VALTIERRA TRAMO: BLVD. LA LUZ A TAJO DE SANTA ANA LEON,Unitario,1,1,Obra,1,0
363,385,PROYECTO EJECUTIVO DE PAVIMENTACION DE LAS CALLES: FREUD TRAMO: BLVD. ARISTOTELES-FROMM;,Unitario,1,1,Obra,1,0
364,393,INSTALACION Y ADECUACION DE LOS  DISPOSITIVOS VIALES EN LA COLONIA PRESIDENTES DE MEXICO LEON,Unitario,1,1,Obra,1,0
365,353,PAVIMENTACION DE LA CALLE NARDOS TRAMO: DE ORQUIDEAS- TOPAR CON AFECTACION COL. JARDINES DE JEREZ,Unitario,1,1,Obra,1,0
366,397,PAVIMENTACION DE LA CALLE PEÑAS ALTAS TRAMO: ARISTOTELES A FRANCISCO VILLA COL. EJIDO DE LA JOYA,Unitario,1,1,Obra,1,0
367,380,PROYECTO EJECUTIVO DE PAVIMENTACION DE LAS CALLES: PRIVADA BELEM TRAMO: PALESTINA - TIBERIADES,Unitario,1,1,Obra,1,0
368,343,PAVIMENTACION DE LA CALLE PLAN DE GUADALUPE TRAMO: BLVD. OBRERO MUNDIAL CON ANDADOR COL.LAS MAND,Unitario,1,1,Obra,1,0
369,379,CAMARA DE ESTIMULACION MULTISENSORIAL PARA EL SISTEMA DIF LEON,Unitario,1,1,Obra,1,0
370,401,PAVIMENTACION DE LA CALLE AV. RIO DE LOS CASTILLOS IRA ETAPA COL. PASEO DE LA PRESA,Unitario,1,1,Obra,1,0
371,402,"TRABAJOS DE ARREGLO Y TERMINACION DE LA IMAGEN URBANA EN PUENTE DE ENTRONQUE ""Y"" EN ACCESO DE CARRET",Unitario,1,1,Obra,1,0
372,389,CONSTRUCCION DE BARDA PERIMETRAL EN LA ESCUELA PRIMARIA UBICADA EN LA CALLE CIRCUITO #201 COL. POPUL,Unitario,1,1,Obra,1,0
373,396,"LIMPIEZA DE ARROYOS EN LAS COMUNIDADES LOS ARCOS, LOS TEPETATES Y REALIZACION DE TRABAJOS EN EL VADO",Unitario,1,1,Obra,1,0
374,407,CICLOVIA CONSTRUCCION Y CERCADO (MORELOS PUENTE OLIMPICA) LEON,Unitario,1,1,Obra,1,0
375,394,DESMONTAJE DE LAMINA Y LAMINACION DE CUBIERTA Y FALDONES PARA EL MERCADO EL CORTIJO LEON,Unitario,1,1,Obra,1,0
376,364,PROYECTO EJECUTIVO DE PAVIMENTACION DE LAS CALLES: PLATON TRAMO: KANT-CITADINA COL. SAUCILLO Y LOMAS,Unitario,1,1,Obra,1,0
377,356,REMODELACION DE LA FACHADA CATALOGADA UBICACION CALLE AQUILES SERDAN NO. 240 ZONA CENTRO,Unitario,1,1,Obra,1,0
378,391,LABORATORIO VERIFICADOR DE OBRA 2012,Unitario,1,1,Obra,1,0
379,374,TRAMITE DE PERMISO DE CONSTRUCCION ANTE EL ANHA PARA LA INTERVENCION DE LAS FACHADAS CATALOGADAS Y C,Unitario,1,1,Obra,1,0
380,388,CONSTRUCCION DE AULA TELESECUNDARIA 397 UBICADA EN CALLE MA. JOAQUINA DE LA PORTILLA 402 COL. BUENA,Unitario,1,1,Obra,1,0
381,352,PAVIMENTACION DE LA CALLE RIO CHAPINGO TRAMO: DE BLVD. TORRES LANDA A CALLE RIO GUANAJUATO COL. SAN,Unitario,1,1,Obra,1,0
382,392,ANDADOR PARQUES DEL SUR CRICIFIXION A PARQUE PURISIMA DEL RINCON; REHABILITACION DE ADOQUIN EN EL AN,Unitario,1,1,Obra,1,0
383,398,PAVIMENTACION DE LA CALLE FRANCISCO VILLA TRAMO: PEÑAS ALTAS A IGNACIO ALLENDE COL. EJIDO LA JOYA,Unitario,1,1,Obra,1,0
384,384,PROYECTO EJECUTIVO DE PAVIMENTACION DE LAS CALLES:POCHUTLA TRAMO: MARTINICA-MURCIA COL. PILETAS IV,Unitario,1,1,Obra,1,0
385,406,"TRABAJOS COMPLEMTARIOS PARA LA TERMINACION DE FACHADA EN PORTAL GUERRERO, CALLE BENITO JUAREZ A PINO",Unitario,1,1,Obra,1,0
386,409,"CONSTRUCCION DE BARDA EN JARDIN DE NIÑOS ""ALONSO GACIA ROBLES"", COL. POPULAR INCA",Unitario,1,1,Obra,1,0
387,358,PROYECTO EJECUTIVO DE PAVIMENTACION DE LAS CALLES: CERRO DEL CHAPULIN TRAMO:CERRO DEL CUBO-AV. AGRIC,Unitario,1,1,Obra,1,0
388,359,PROYECTO EJECUTIVO DE PAVIMENTACION DE LAS CALLES: ENCINO TRAMO: HERMENEGILDO-PIRUL COL. VALLE DE LE,Unitario,1,1,Obra,1,0
389,362,"PROYECTO EJECUTIVO DE PAVIMENTACION DE LAS CALLES:SOJA TRAMO: CUENCA FLORIDA-ALISO, CALLE COLZA TRAM",Unitario,1,1,Obra,1,0
390,390,PROYECTO EJECUTIVO DE PAVIMENTACION DE LAS CALLES: VALLE DUPART TRAMO: MADRE TIERRA - VALLE ARIZPE C,Unitario,1,1,Obra,1,0
391,367,PROYECTO EJECUTIVO DE PAVIMENTACION DE LAS CALLES:VALLE CABUERIGA TRAMO: VALLE ARIZPE-MADRE TIERRA,Unitario,1,1,Obra,1,0
392,376,PROYECTO EJECUTIVO DE PAVIMENTACION DE LAS CALLES: VOLTAIRE TRAMO: BLVD. ARISTOTELES-FROM COL. SOLED,Unitario,1,1,Obra,1,0
393,377,PAVIMENTACION DE LA CALLE AGAVE DE JEREZ TRAMO: DE SALSIFI-AV. LAS LIEBRES COL. SAN ISIDRO,Unitario,1,1,Obra,1,0
394,378,PAVIMENTACION DE LA CALLE GAMBOA TRAMO:CALLE HUIMILPAN A CALLE PALO ALTO COL. EL PALOTE,Unitario,1,1,Obra,1,0
395,386,PROYECTO EJECUTIVO DE PAVIMENTACION DE LAS CALLES: CIRCUITO DOVELAS TRAMO: RELIEVE - DORADILLA COL.,Unitario,1,1,Obra,1,0
396,408,PAVIMENTACION DE LA CALLE MAR MEDITERRANEO TRAMO: DE LA CALLE OCEANO INDICO A OCEANO ARTICO COL. LIN,Unitario,1,1,Obra,1,0
397,361,PROYECTO EJECUTIVO DE PAVIMENTACION DE LAS CALLES: FILIPOS TRAMO: FILEMON - COLOCENSES Y CALLE EPIST,Unitario,1,1,Obra,1,0
398,292,PAVIMENTACION DE LA CALLE NEVADO DE COLIMA TRAMO: CHINCHONAL A HILARIO MEDINA COL. LA CARMONA,Unitario,1,1,Obra,1,0
399,383,PROYECTO EJECUTIVO DE PAVIMENTACION DE LAS CALLES: JOSE M. PRADO TRAMO: BLVD. MARIANO ESCOBEDO - AL,Unitario,1,1,Obra,1,0
400,404,PROYECTO EJECUTIVO DE PAVIMENTACION DE LAS CALLES: GANGUES TRAMO: VALLE ARIZPE - MADRE TIERRA Y CALL,Unitario,1,1,Obra,1,0
401,415,PAVIMENTACION DE LA CALLE PRIVADA APOSTOL TRAMO: DE MARMOLEJO A TOPAR COL. RINCONADA DE SAN PEDRO,Unitario,1,1,Obra,1,0
402,423,PROYECTO EJECUTIVO DE PAVIMENTACION DE LA CALLE: TOLEDO TRAMO:BLVD. SAN JUAN BOSCO (PAVIMENTO EXIST),Unitario,1,1,Obra,1,0
403,422,PAVIMENTACION DE LA CALLE LUIS LONG TRAMO: ALFONSO ESPARZA - FEDERICO BAENA COL. SAN MARCOS,Unitario,1,1,Obra,1,0
404,425,SEMAFORIZACION CICLOVIA BLVD. JOSE MA. MORELOS Y BLVD. LAS TORRES LEON,Unitario,1,1,Obra,1,0
405,424,IMAGEN URBANA EN CAMELLON CENTRAL DE BLVD. VICENTE VALTIERRA Y BLVD. JOSE MA. MORELOS LEON,Unitario,1,1,Obra,1,0
406,421,PAVIMENTACION DE LA CALLE HOMBRES ILUSTRES TRAMO: PUERTOS LIBRES A REFORMA AGRARIA COL. SAN MARCOS,Unitario,1,1,Obra,1,0
407,420,PAVIMENTACION DE LA CALLE ENCINO TRAMO: DE BLVD. HERMENEGILDO BUSTOS A CALLE PIRUL DEL VALLE COL. VA,Unitario,1,1,Obra,1,0
408,417,PAVIMENTACION DE LA CALLE PLAZA SAUCE TRAMO: DE SAN ROMAN A SAUCE COL. ARBOLEDAS DE INFONAVIT,Unitario,1,1,Obra,1,0
409,416,SUMINISTRO Y COLOCACION DE 225 ML DE MALLA CICLONICA EN AREA DE DONACION EN LA CALLE ORIEN COL. PASE,Unitario,1,1,Obra,1,0
410,413,PAVIMENTACION DE LA CALLE RIO TONALA TRAMO: DE RIO TECOLUTLA A RIO GUANAJUATO COL. SAN MIGUEL,Unitario,1,1,Obra,1,0
411,4514,PAVIMENTACION DE LA CALLE SAN LUCAS TRAMO: DE SAN JUSTO - TOPAR COL. LA PISCINA,Unitario,1,1,Obra,1,0
412,414,PAVIMENTACION DE LA CALLE SAN LUCAS TRAMO: DE SAN JUSTO - TOPAR COL. LA PISCINA,Unitario,1,1,Obra,1,0
413,412,DRENAJE SANITARIO EN LA COMUNIDAD DE SAN JUAN DE OTATES CALLE SAN ANDRES LEON,Unitario,1,1,Obra,1,0
414,411,REHABILITACION DE LAS AREAS DE CIRCULACION PEATONAL Y VEHICULAR EN LA ZONA CENTRO LEON,Unitario,1,1,Obra,1,0
415,418,PAVIMENTACION DE LA CALLE JEREZ DE CASTELO TRAMO: CALLE JEREZ DE SEVILLA A CALLE VALLE DE SANTIAGO,Unitario,1,1,Obra,1,0
416,419,PAVIMENTACION DE LA CALLE JEREZ DE ALDANA TRAMO: DE CALLE JEREZ DE SEVILLA A CALLE VALLE DE SANTIAGO,Unitario,1,1,Obra,1,0
417,410,PROYECTO EJECUTIVO DE PAVIMENTACION DE LA CALLE: TOLEDO TRAMO: ALCALA DE HENAREZ - CADIZ COL. SAN JU,Unitario,1,1,Obra,1,0
418,399,PROYECTO EJECUTIVO DE PAVIMENTACION DE LAS CALLES: MADRE ESTELA TRAMO: AV. ATOTONILCO - MADRE SIERRA,Unitario,1,1,Obra,1,0
419,403,PROYECTO EJECUTIVO DE PAVIMENTACION DE LAS CALLES: MADRE ALICIA TRAMO: MADRE MARINA - MADRE SIERRA;,Unitario,1,1,Obra,1,0
420,405,PROYECTO EJECUTIVO DE PAVIMENTACION DE LAS CALLES: MADRE CARMEN TRAMO: MADRE SIERRA-ATOTONILCO Y,Unitario,1,1,Obra,1,0
421,426,REHABILITACION DE LA PISTA EN EL PARQUE METROPOLITANO DE LEON,Unitario,1,1,Obra,1,0
422,427,REMODELACION EN EL AREA DE JUEGOS DEL JARDIN UBICADO ENTRE LAS CALLES BURGOS Y SINIESTA EN LA COL.,Unitario,1,1,Obra,1,0
423,428,TRABAJOS COMPLEMENTARIOS PARA LA PAVIMENTACIÓN DE LA CALLE MADRE GLORIA TRAMO: MADRE MARINA,Unitario,1,1,Obra,1,0
424,429,"CONSTRUCCION DE LA UNIDAD DEPORTIVA NORTE EN EL MUNICIPIO DE LEON, GUANAJUATO",Unitario,1,1,Obra,1,0
425,395,"MANTENIMIENTO INTEGRAL DE PARQUES Y JARDINES EN PARQUE CARCAMOS PAQ. 1 LEON, GTO.",Unitario,1,1,Obra,1,0
426,430,PAVIMENTACION DE LA CALLE TOLEDO TRAMO: DE CADIZ A ALCALA DE HENARES COL. SAN JUAN BOSCO,Unitario,1,1,Obra,1,0
427,431,"BACHEO EN CARCAMOS, MAR ADRIATICO, CALLE ALFALFA, EN CALLES YUCATAN Y STO. DOMINGO COL. OBRERA; Y RE",Unitario,1,1,Obra,1,0
