Id_Obra,Año,Clave_Obra,Nombre,Tipo_Precio,Id_Sub_Programa,Id_Localidad,Beneficiarios,Id_Convenio,Tipo_Obra_Proyecto,Id_Sub_Tipo_Obra,Observaciones,Enviar_Para,Id_Oficio_Asignacion_Obra
0000000130,2010,0131,"REMODELACION DE LA DIRECCION GENERAL DE DESARROLLO URBANO, PREDIO EL TLACUACHE",Unitario,0000000001,0000000001,0,NULL,Obra,0000000001,08/07/2010 SHANTAL,CONTRATADO,0
0000000131,2010,0133,PROYECTO EJECUTIVO DEL PARQUE LINEAL ARROYO EL EJIDO TRAMO: DEL BLVD. VASCO DE QUIROGA A BLVD. VICEN,Unitario,0000000001,0000000001,0,NULL,Obra,0000000001,08/07/2010 SHANTAL,CONTRATADO,0
0000000132,2010,0134,CRUCE PEATONAL EN EL BLVD. SAN JUAN BOSCO FRENTE AL MERCADO ESPIRITU SANTO INCLUYE COLOCACION DE POR,Unitario,0000000001,0000000001,0,NULL,Obra,0000000001,08/07/2010 SHANTAL,CONTRATADO,0
0000000133,2010,0136,DEMOLICION DE FINCAS EN CALLE EMILIANO ZAPATA ESQ. RIO BALSAS COL. SAN MIGUEL,Unitario,0000000001,0000000001,0,NULL,Obra,0000000001,09/07/2010 SHANTAL,CONTRATADO,0
0000000134,2010,0137,"LIMPIEZA Y DESAZOLVE DE LOS ARROYOS: EL EJIDO,ALFARO, MUERTO, SARDANETA, PITAYO Y LAS LIEBRES LEON",Unitario,0000000001,0000000001,0,NULL,Obra,0000000001,09/07/2010,CONTRATADO,0
0000000135,2010,0138,"LIMPIEZA Y DESAZOLVE DE LOSARROYOS: EL EJIDO, SARDANETA, GRANIZO, BLANCO Y LANGOSTA LEON",Unitario,0000000001,0000000001,0,NULL,Obra,0000000001,09/07/2010 SHANTAL,CONTRATADO,0
0000000136,2010,0139,PAVIMENTACION DE LA CALLE BARACALDO TRAMO: DE BADAJOZ-BARCELONA COL. SAN JUAN BOSCO,Unitario,0000000001,0000000001,0,NULL,Obra,0000000001,09/07/2010 SHANTAL,CONTRATADO,0
0000000137,2010,0145,PAVIMENTACION DE LA CALLE CRUZ DE TREBOLADA TRAMO:DE PAV. EXISTENTE A TOPAR CON ANDADOR SUSPIRO COL.,Unitario,0000000001,0000000001,0,NULL,Obra,0000000001,09/07/2010 SHANTAL,CONTRATADO,0
0000000138,2010,0140,PAVIMENTACION DE LA CALLE BAJIO TRAMO: DE CONSTELACION BOREAL A VIA LACTEA COL. MIRADOR CAMPESTRE,Unitario,0000000001,0000000001,0,NULL,Obra,0000000001,09/07/2010 SHANTAL,CONTRATADO,0
0000000139,2010,0141,PROYECTO EJECUTIVO DE CICLOVIA DEL BLVD. FRANCISCO VILLA TRAMO: DEL BLVD. TIMOTEO LOZANO A BLVD. MOR,Unitario,0000000001,0000000001,0,NULL,Obra,0000000001,12/07/2010 SHANTAL,CONTRATADO,0
0000000140,2010,0142,PROYECTO EJECUTIVO DE CICLOVIA DE LAS CALLES TANCITARO- 5 DE MAYO- ARENA NORTE- RIO USUMACINTA-HONDA,Unitario,0000000001,0000000001,0,NULL,Obra,0000000001,12/07/2010 SHANTAL,CONTRATADO,0
0000000141,2010,0143,PROYECTO EJECUTIVO DE CICLOVIA DEL BLVD. HERMANOS ALDAMA TRAMO: DE BLVD. MARIANO ESCOBEDO A BLVD. TO,Unitario,0000000001,0000000001,0,NULL,Obra,0000000001,12/07/2010 SHANTAL,CONTRATADO,0
0000000142,2010,0144,PROYECTO EJECUTIVO DE CICLOVIA DE LA CALLE 27 DE SEPTIEMBRE TRAMO: DE LA CALLE 16 DE SEPTIEMBRE A CA,Unitario,0000000001,0000000001,0,NULL,Obra,0000000001,12/07/2010 SHANTAL,CONTRATADO,0
0000000143,2010,0146,LIMPIAR Y PROTEGER DE GRAFITI EN LA CIUDAD DE LEON,Unitario,0000000001,0000000001,0,NULL,Obra,0000000001,12/07/2010  SHANTAL,CONTRATADO,0
0000000144,2010,0417,DESMANTELAMIENTO Y LIMPIEZA PARA OBRAS DE PROTECCION PARA PERITAJES EN EL MERCADO COMONFORT CALLE IG,Unitario,0000000001,0000000001,0,NULL,Obra,0000000001,22/11/2010 ALMA,CONTRATADO,0
0000000145,2010,0148,PROYECTO EJECUTIVO DE CICLOVIA DEL BLVD ANTONIO MADRAZO TRAMO: DE BLVD. JOSE MARIA MORELOS A BLVD. V,Unitario,0000000001,0000000001,0,NULL,Obra,0000000001,12/07/2010 SHANTAL,CONTRATADO,0
0000000146,2010,0150,PROYECTO EJECUTIVO DE LAS CALLES: SAUCE TRAMO: CAOBA A MANZANO; CALLE CAOBA TRAMO: CASTAÑO A SAN ROM,Unitario,0000000001,0000000001,0,NULL,Obra,0000000001,12/07/2010 SHANTAL,CONTRATADO,0
0000000147,2010,0151,PROYECTO EJECUTIVO DE REMODELACION DE LAS INSTALACIONES DE LAS OFICINAS DEL CECYTEG CALLE MAR TIMOR,Unitario,0000000001,0000000001,0,NULL,Obra,0000000001,12/07/2010 SHANTAL,CONTRATADO,0
0000000148,2010,0152,PROYECTO DE CICLOVIA DEL BLVD. CLOUTHIER TRAMO: BLVD. MORELOS A BLVD. ALONSO DE TORRES LEON,Unitario,0000000001,0000000001,0,NULL,Obra,0000000001,12/07/2010 SHANTAL,CONTRATADO,0
0000000149,2010,0153,PAVIMENTACION DE LA CALLE PRESA SOLIS TRAMO: DE PRESA NACOZARI- TOPAR ( NORTE Y SUR) COL. SAN NICOLA,Unitario,0000000001,0000000001,0,NULL,Obra,0000000001,12/07/2010 SHANTAL,CONTRATADO,0
0000000150,2010,0154,PAVIMENTACION DE LA CALLE CRONOS TRAMO: DE BLVD. ANTONIO MADRAZO A SAN FRANCISCO DE ASIS COL. ARBOLE,Unitario,0000000001,0000000001,0,NULL,Obra,0000000001,12/07/2010 SHANTAL  ,CONTRATADO,0
0000000151,2010,0132,BLVD. DELTA EN ELTRAMO DE LA VIALIDAD DEL EJE METROPOLITANO DEL BLVD. JUAN ALONSO DE TORRES A BLVD.,Unitario,0000000001,0000000001,0,NULL,Obra,0000000001,12/07/2010 SHANTAL,CONTRATADO,0
0000000152,2010,0155,PROYECTO EJECUTIVO DE REHABILITACION Y REFUERZO DE MUROS DE CONTENCION DEL BORDO DEL MALECON DEL RIO,Unitario,0000000001,0000000001,0,NULL,Obra,0000000001,13/07/2010 SHANTAL,CONTRATADO,0
0000000153,2010,0156,PAVIMENTACION DE LA CALLE ALMEJA TRAMO: DE BLVD. DELTA A AV. JEREZ DE ANTAÑO COL. ESPERANZA DE JEREZ,Unitario,0000000001,0000000001,0,NULL,Obra,0000000001,13/04/2010 SHANTAL,CONTRATADO,0
0000000154,2010,0157,PROYECTO EJECUTIVO DE CENTRO MULTIDISCIPLINARIO PARA LA ATENCION INTEGRAL DE LA VIOLENCIA UBICADO EN,Unitario,0000000001,0000000001,0,NULL,Obra,0000000001,13/07/2010 SHANTAL,CONTRATADO,0
0000000155,2010,0158,CONSTRUCCION DE ESTACIONAMIENTO DE BICICLETAS PARA INTEGRACION CON EL SIT EN ESTACIONES Y PARADEROS,Unitario,0000000001,0000000001,0,NULL,Obra,0000000001,13/07/2010 SHANTAL,CONTRATADO,0
0000000156,2010,0147,SEMAFORIZACION DE LA INTERSECCION DEL BLVD. MADRAZO CON LA CALLE SAN JOSE LEON DEL PROGRAMA TU ASAMB,Unitario,0000000001,0000000001,0,NULL,Obra,0000000001,16/07/2010 SHANTAL,CONTRATADO,0
0000000157,2010,0159,PAVIMENTACION DE LA CALLE HISTORIADORES TRAMO: DE BLVD. FRANCISCO VILLA- AL FRENTE 1180 B LEON,Unitario,0000000001,0000000001,0,NULL,Obra,0000000001,16/07/2010 SHANTAL,CONTRATADO,0
0000000158,2010,0162,REHABILITACION Y REFUERZO DE BIBLIOTECA PUBLICA SANTA RITA S/N LEON,Unitario,0000000001,0000000001,0,NULL,Obra,0000000001,16/07/2010 SHANTAL,CONTRATADO,0
0000000159,2010,0149,PROYECTO EJECUTIVO DE LAS CALLES: SAUCE TRAMO: ABEDUL A FRESNO: CALLE ROBLE TRAMO: FRESNO A CAOBA; C,Unitario,0000000001,0000000001,0,NULL,Obra,0000000001,20/07/2010 SHANTAL,CONTRATADO,0
0000000160,2010,0160,PAVIMENTACION DE LA CALLE ISLAS BALEARES TRAMO: PASEO DE LOS INSURGENTES A TOPAR COL. LINDA VISTA,Unitario,0000000001,0000000001,0,NULL,Obra,0000000001,20/07/2010 SHANTAL,CONTRATADO,0
0000000161,2010,0161,PAVIMENTACION DE LA CALLE ALEGRIA TRAMO: DE BLVD. TIMOTEO LOZANO A FRENTES 217 Y 218 COL. SAN JOSE D,Unitario,0000000001,0000000001,0,NULL,Obra,0000000001,20/07/2010 SHANTAL,CONTRATADO,0
0000000162,2010,0165,PROYECTO EJECUTIVO DE CICLOVIA DEL BLVD. CAMPESTRE-BALAUZAN-CONGRESO DE CHILPANCINGO TRAMO: DE BLVD.,Unitario,0000000001,0000000001,0,NULL,Obra,0000000001,20/07/2010 SHANTAL,CONTRATADO,0
0000000163,2010,0175,TRABAJOS COMPLEMENTARIOS EN LA CONSTRUCCION DE LA PRIMERA ETAPA EJE NORTE SUR MALECON DEL RIO DE LOS,Unitario,0000000001,0000000001,0,NULL,Obra,0000000001,21/07/2010 SHANTAL,CONTRATADO,0
0000000164,2010,0177,PAVIMENTACION DE LA CALLE FUERTE DE ALFARO TRAMO: DE AV. LUCERO A FUERTE DE SAN DIEGO COL. UNIDAD HA,Unitario,0000000001,0000000001,0,NULL,Obra,0000000001,22/07/2010 SHANTAL,CONTRATADO,0
0000000165,2010,0181,PAVIMENTACION DE LA CALLE CAMINO ALFARO TRAMO: BLVD. VICENTE VALTIERRA A TOPAR CON PAVIMENTO EXISTEN,Unitario,0000000001,0000000001,0,NULL,Obra,0000000001,22/07/2010 SHANTAL,CONTRATADO,0
0000000166,2010,0174,PROYECTO GEOMETRICO ESTUDIOS TOPOGRAFICOS Y FICHAS DE AFECTACIONES DEL BLVD. MORELOS TRAMO: DE BLVD.,Unitario,0000000001,0000000001,0,NULL,Obra,0000000001,22/07/2010 SHANTAL,CONTRATADO,0
0000000167,2010,0168,PAVIMENTACION DE LA CALLE MADRE MONICA TRAMO: DE CALLE MADRE TIERRA A CERRO DEL ZOYATE COL. DIEZ DE,Unitario,0000000001,0000000001,0,NULL,Obra,0000000001,27/07/2010 SHANTAL,CONTRATADO,0
0000000168,2010,0167,PAVIMENTACION DE LA CALLE ALMENDRO TRAMO: DE CALLE ALAMO A CALLE AVELLANO COL. ARBOLEDAS DE INFONAVI,Unitario,0000000001,0000000001,0,NULL,Obra,0000000001,27/07/2010 SHANTAL,CONTRATADO,0
0000000169,2010,0166,"PROYECTO EJECUTIVO DE MINIDEPORTIVA EN LA COL. VILLA MAGNA TRAMO: ELEFANTE, TIBER, SIXTINA Y FLAMINA",Unitario,0000000001,0000000001,0,NULL,Obra,0000000001,27/07/2010 SHANTAL,CONTRATADO,0
0000000170,2010,0172,PAVIMENTACION DE LA CALLE ALFALFA TRAMO: DE CALLE CANDELARIA A TOPAR CON PAVIMENTO EXISTENTE COL. KI,Unitario,0000000001,0000000001,0,NULL,Obra,0000000001,27/07/2010 SHANTAL,CONTRATADO,0
0000000171,2010,0171,PAVIMENTACION DE LA CALLE DEL BARRIO TRAMO: DE LA MORADA A VILLAS DE LEON ORIENTE COL. VILLAS DE LEO,Unitario,0000000001,0000000001,0,NULL,Obra,0000000001,27/07/2010 SHANTAL  ,CONTRATADO,0
0000000172,2010,0169,PAVIMENTACION DE LA CALLE 3RA. PRIVADA SANCHEZ TRAMO: DE SANCHEZ A TOPAR COL. EL COECILLO,Unitario,0000000001,0000000001,0,NULL,Obra,0000000001,27/07/2010 SHANTAL,CONTRATADO,0
0000000173,2010,0170,PAVIMENTACION DE LA CALLE LUIS SUAREZ ZAMBRNO TRAMO: DE FRANCISCO MATHEY A CEFERINO ORTIZ COL. LAS H,Unitario,0000000001,0000000001,0,NULL,Obra,0000000001,29/07/2010 SHANTAL,CONTRATADO,0
0000000174,2010,0205,LIMPIEZA Y COLOCACION DE COSTALERIA PARA PROTECCION DE TALUD EN EL ARROYO LA TINAJA TRAMO: DE BLVD.,Unitario,0000000001,0000000001,0,NULL,Obra,0000000001,05/08/2010 SHANTAL,CONTRATADO,0
0000000175,2010,0196,TRABAJOS DE LIMPIEZA DEL RIO TURBIO Y ESTABILIZACION DE TALUDES CON MATERIAL INERTE PARA PREVENCION,Unitario,0000000001,0000000001,0,NULL,Obra,0000000001,05/08/2010 SHANTAL,CONTRATADO,0
0000000176,2010,0194,SUMINISTRO Y APLICACION DE PINTURA EPOXICA (" LEON ES COMO LO SEÑALAMOS 2010") LEON,Unitario,0000000001,0000000001,0,NULL,Obra,0000000001,13/08/2010 SHANTAL,CONTRATADO,0
0000000177,2010,0068,PROYECTO EJECUTIVO DE LAS CALLES: CIRCUITO RINCONADA DE SAN PEDRO TRAMO: MARMOLEJO- MARMOLEJO COL. S,Unitario,0000000001,0000000001,0,NULL,Obra,0000000001,17/08/2010 SHANTAL,CONTRATADO,0
0000000178,2010,0217,PROYECTO EJECUTIVO DE GIMNASIO EN EL CENTRO DE FORMACION POLICIAL ( CEFOPOL ) CALLE ARROYO 1010 LEON,Unitario,0000000001,0000000001,0,NULL,Obra,0000000001,17/08/2010 SHANTAL,CONTRATADO,0
0000000179,2010,0221,REHABILITACION DE COLOR DEL CONCRETO ESTAMPADO EN LA CALLE MADERO CENTRO LEON,Unitario,0000000001,0000000001,0,NULL,Obra,0000000001,17/08/2010 SHANTAL,CONTRATADO,0
0000000180,2010,0214,ESTUDIO DE MECANICA DE SUELOS PARA LA RESTRUCTURACION Y REMODELACION DEL JARDIN DE NIÑOS "MARIANO SI,Unitario,0000000001,0000000001,0,NULL,Obra,0000000001,17/08/2010 SHANTAL,CONTRATADO,0
0000000181,2010,0211,ALIMENTACION ELECTRICA A TORRES PARA LA PROYECCION DEL MURAL DE LUZ A UBICARSE EN PLAZA DEL EXPIATOR,Unitario,0000000001,0000000001,0,NULL,Obra,0000000001,17/08/2010 SHANTAL,CONTRATADO,0
0000000182,2010,0209,PROYECTO EJECUTIVO DE REHABILITACION DEL MERCADO EX ESTACIONAMIENTO COMONFORT ZONA CENTRO,Unitario,0000000001,0000000001,0,NULL,Obra,0000000001,17/08/2010 SHANTAL,CONTRATADO,0
0000000183,2010,0219,SISTEMA DE RIEGO AUTOMATIZADO DE SEIS CANCHAS Y SIEMBRA DE PASTO EN LA DEPORTIVA ENRIQUE FERNANDEZ M,Unitario,0000000001,0000000001,0,NULL,Obra,0000000001,17/08/2010 SHANTAL,CONTRATADO,0
0000000184,2010,0189,OBRA COMPLEMENTARIA EN EL MERCADO CARRO VERDE MEJORAMIENTO A LA INFRAESTRUCTURA DE GAS Y AGUA LEON,Unitario,0000000001,0000000001,0,NULL,Obra,0000000001,17/08/2010 SHANTAL,CONTRATADO,0
0000000185,2010,0176,PAVIMENTACION DE LA CALLE 1RA. RIO BALSAS TRAMO: DE RIO BALSAS-RIO HONDO COL. SAN NICOLAS,Unitario,0000000001,0000000001,0,NULL,Obra,0000000001,19/08/2010 SHANTAL,CONTRATADO,0
0000000186,2010,0204,SEMAFORIZACION DEL CRUCERO DEL BLVD. MIGUEL DE CERVANTES SAAVEDRA Y ARROYO  DE MARICHES DEL PROGRAMA,Unitario,0000000001,0000000001,0,NULL,Obra,0000000001,23/08/2010 SHANTAL,CONTRATADO,0
0000000187,2010,0215,TRABAJOS DE JARDINERIA A REALIZAR EN LOS BLVDS. SAN JUAN BOSCO Y TORRES LANDA LEON,Unitario,0000000001,0000000001,0,NULL,Obra,0000000001,25/08/2010 SHANTAL,CONTRATADO,0
0000000188,2010,0220,MEJORAMIENTO DE PLAZAS EN ZONA URBANA PAQUETE 2 LEON,Unitario,0000000001,0000000001,0,NULL,Obra,0000000001,25/08/2010 SHANTAL,CONTRATADO,0
0000000189,2010,0207,LABORATORIO VERIFICADOR 2010 PAQUETE 2 LEON,Unitario,0000000001,0000000001,0,NULL,Obra,0000000001,25/08/2010 SHANTAL,CONTRATADO,0
0000000190,2010,0231,PROYECTO EJECUTIVO DE PLAZA CATEDRAL EN CALLE ALVARO OBREGON ESQ. CALLE HIDALGO CENTRO,Unitario,0000000001,0000000001,0,NULL,Obra,0000000001,25/08/2010 SHANTAL,CONTRATADO,0
0000000191,2010,0216,"MANTENIMIETO PREVENTIVO Y CORRECTIVO DE FUENTES EN VARIAS PARTES DE LA CIUDAD PAQUETE 2, LEON",Unitario,0000000001,0000000001,0,NULL,Obra,0000000001,25/08/2010 SHANTAL,CONTRATADO,0
0000000192,2010,0227,SUMINISTRO E INSTALACION DE 40 TOPES EN DIVERSAS CALLES DE LA CIUDAD LEON,Unitario,0000000001,0000000001,0,NULL,Obra,0000000001,25/08/2010 SHANTAL,CONTRATADO,0
0000000193,2010,0206,PROYECTO EJECUTIVO DEL PASO SUPERIOR VEHICULAR EN LA INTERSECCION DEL BLVD. JOSE MARIA MORELOS Y BLV,Unitario,0000000001,0000000001,0,NULL,Obra,0000000001,25/08/2010 SHANTAL,CONTRATADO,0
0000000194,2010,0208,LABORATORIO VERIFICADOR 2010 PAQUETE 1 LEON,Unitario,0000000001,0000000001,0,NULL,Obra,0000000001,25/08/2010 SHANTAL,CONTRATADO,0
0000000195,2010,0198,MALLA CICLONICA EN ESCUELA PRIMARIA FEDERAL FRAY PEDRO DE GANTE Y LEONA VICARIO BLVD. JUAN ALONSO DE,Unitario,0000000001,0000000001,0,NULL,Obra,0000000001,26/08/2010 SHANTAL,CONTRATADO,0
0000000196,2010,0200,CONSTRUCCION DE CRUCE A NIVEL PARA LA INTERSECCION DEL BLVD. JOSE MARIA MORELOS CON EL BLVD. PASEO D,Unitario,0000000001,0000000001,0,NULL,Obra,0000000001,27/08/2010 SHANTAL,CONTRATADO,0
0000000197,2010,0173,PAVIMENTACION DE LA CALLE LAGO NEGRO TRAMO: DE AV. CANAL A SANTA MARIA COL. INFONAVIT GRANADA,Unitario,0000000001,0000000001,0,NULL,Obra,0000000001,27/08/2010 SHANTAL,CONTRATADO,0
0000000198,2010,0178,PAVIMENTACION DE LA CALLE IGNACIO GARCIA TELLEZ TRAMO: DE CALLE MARIA ALICIA A TOPAR (IGNACIO GARCIA,Unitario,0000000001,0000000001,0,NULL,Obra,0000000001,27/08/2010 SHANTAL,CONTRATADO,0
0000000199,2010,0179,PROYECTO EJECUTIVO DE LA CALLE PLAN DE GUADALUPE TRAMO: DE CERVANTES SAAVEDRA A OBRERO MUNDIAL COL.L,Unitario,0000000001,0000000001,0,NULL,Obra,0000000001,27/08/2010 SHANTAL,CONTRATADO,0
0000000200,2010,0238,PROYECTO EJECUTIVO DE PAVIMENTACION DE LAS CALLES: ESTHER V. D VILLEGAS TRAMO: MARIANO ESCOBEDO A VI,Unitario,0000000001,0000000001,0,NULL,Obra,0000000001,27/08/2010 SHANTAL,CONTRATADO,0
0000000201,2010,0239,OBRA COMPLEMENTARIA DE LA GLORIETA SAN JUAN BOSCO INTERSECCION BLVD. SAN JUAN BOSCO Y JUAN ALONSO DE,Unitario,0000000001,0000000001,0,NULL,Obra,0000000001,27/08/2010 SHANTAL,CONTRATADO,0
0000000202,2010,0232,PAVIMENTACION DE LA CALLE PRIVADA LA PISCINA TRAMO: ARROYO EL SALTO BLVD. LAS PALMAS COL. LOMA BONIT,Unitario,0000000001,0000000001,0,NULL,Obra,0000000001,27/08/2010 SHANTAL,CONTRATADO,0
0000000203,2010,0237,PROYECTO EJECUTIVO DE PAVIMENTACION DE LAS CALLES: FEDRA TRAMO: DE BLVD TELLEZ CRUCES A SALOMON COL.,Unitario,0000000001,0000000001,0,NULL,Obra,0000000001,30/08/2010 SHANTAL,CONTRATADO,0
0000000204,2010,0229,TERCER ETAPA DEL CENTRO COMUNITARIO ERMITA,Unitario,0000000001,0000000001,0,NULL,Obra,0000000001,30/08/2010 SHANTAL,CONTRATADO,0
0000000205,2010,0185,ELABORACION DEL  PLAN MAESTRO EJE METROPOLITANO 1RA ETAPA VIA RAPIDA BICENTENARIO Y,Unitario,0000000001,0000000001,0,NULL,Obra,0000000001,31/08/2010 SHANTAL,CONTRATADO,0
0000000206,2010,0180,PROYECTO EJECUTIVO DE CICLOVIA DEL BLVD. PAESO DE JEREZ TRAMO: DE BLVD. TIMOTEO LOZANO A BLVD. ADOLF,Unitario,0000000001,0000000001,0,NULL,Obra,0000000001,31/08/2010 SHANTAL,CONTRATADO,0
0000000207,2010,0182,PROYECTO EJECUTIVO INAH RESTAURACION CALA LOUIS LONG ( CENTRO CULTURAL) EN CALLE PEDRO MORENO 208 EN,Unitario,0000000001,0000000001,0,NULL,Obra,0000000001,31/08/2010 SHANTAL,CONTRATADO,0
0000000208,2010,0183,PROYECTO EJECUTIVO DE CICLOVIA DEL BLVD. HERMENEGILDO BUSTOS TRAMO: DE BLVD. MORELOS A BLVD. TRANSPO,Unitario,0000000001,0000000001,0,NULL,Obra,0000000001,31/08/2010 SHANTAL,CONTRATADO,0
0000000209,2010,0184,PROYECTO EJECUTIVO DE CICLOVIA DEL BLVD. GUANAJUATO PTE. TRAMO: DE BLVD. INSURGENTES A BLVD. LOPEZ M,Unitario,0000000001,0000000001,0,NULL,Obra,0000000001,31/08/2010 SHANTAL,CONTRATADO,0
0000000210,2010,0186,PROYECTO EJECUTIVO DE LA CALLE 26 DE AGOSTO TRAMO: DE MISAEL NUÑEZ A BLVD. TIMOTEO COL. MORELOS,Unitario,0000000001,0000000001,0,NULL,Obra,0000000001,31/08/2010 SHANTAL,CONTRATADO,0
0000000211,2010,0187,PAVIMENTACION DE LA CALLE ANDA TRAMO: DE CALLE MATAMOROS A CALLE YUCATAN COL. OBRERA,Unitario,0000000001,0000000001,0,NULL,Obra,0000000001,31/08/2010 SHANTAL,CONTRATADO,0
0000000212,2010,0188,PROYECTO EJECUTIVO DE NUEVAS OFICINAS DEL SISTEMA PARA EL DESARROLLO INTEGRAL DE LA FAMILIA UBICACIO,Unitario,0000000001,0000000001,0,NULL,Obra,0000000001,31/08/2010 SHANTAL,CONTRATADO,0
0000000213,2010,0193,CONSTRUCCION DE MURO LATERAL EN CANCHA DE USOS MULTIPLES Y COLOCACION DE MALLA CICLONICA SOBRE MURO,Unitario,0000000001,0000000001,0,NULL,Obra,0000000001,31/08/2010 SHANTAL,CONTRATADO,0
0000000214,2010,0195,SUMINISTRO Y APLICACION DE PINTURA TERMOPLASTICA (" LEON ES COMO LO SEÑALAMOS") LEON,Unitario,0000000001,0000000001,0,NULL,Obra,0000000001,31/08/2010 SHANTAL,CONTRATADO,0
0000000215,2010,0197,REUBICACION DEL MONUMENTO A GAONA A LA GLORIETA UBICADA AV. AMERICAS Y CALZADA LEON,Unitario,0000000001,0000000001,0,NULL,Obra,0000000001,31/08/2010 SHANTAL,CONTRATADO,0
0000000216,2010,0199,"CONSTRUCCION DE BANQUETAS, MESAS Y BANCAS DE CONCRETO EN LA TELESECUNDARIA1077 CALLE AQUILES SERDAN",Unitario,0000000001,0000000001,0,NULL,Obra,0000000001,31/08/2010 SHANTAL,CONTRATADO,0
0000000217,2010,0235,PROYECTO EJECUTIVO DE PAVIMENTACION DE LAS CALLES: DIVISION DEL NORTE TRAMO: H. AYUNTAMIENTO-CORREGI,Unitario,0000000001,0000000001,0,NULL,Obra,0000000001,31/08/2010 SHANTAL,CONTRATADO,0
0000000218,2010,0236,PROYECTO EJECUTIVO DE PAVIMENTACION DE LAS CALLES: LAS TORRES TRAMO: H. AYUNTAMIENTO-CORREGIDORA LEV,Unitario,0000000001,0000000001,0,NULL,Obra,0000000001,31/08/2010 SHANTAL  ,CONTRATADO,0
0000000219,2010,0224,PAVIMENTACION DE LA CALLE PRIVADA RIO MAYO TRAMO: DE RIO MAYO A TOPAR COL. LAS MARGARITAS (1ER ETAPA,Unitario,0000000001,0000000001,0,NULL,Obra,0000000001,31/08/2010 SHANTAL,CONTRATADO,0
0000000220,2010,0210,REHABILITACION DE ALUMBRADO PUBLICO DE CICLOVIA TORRES LANDA DE AUTOPISTA AGUASCALIENTES 0+000 A CAL,Unitario,0000000001,0000000001,0,NULL,Obra,0000000001,01/09/2010 SHANTAL,CONTRATADO,0
0000000221,2010,0226,PAVIMENTACION DE LA CALLE 2DA. PRIVADA RIO BALSAS TRAMO: DE RIO BALSAS-RIO HONDO COL. SAN NICOLAS (1,Unitario,0000000001,0000000001,0,NULL,Obra,0000000001,01/09/2010 SHANTAL,CONTRATADO,0
0000000222,2010,0260,PAVIMENTACION DE LA CALLE JEREZ DE GRANADA TRAMO: JEREZ DE LA LUZ-BUFAS DE ZACATECAS COL. VALLE DE J,Unitario,0000000001,0000000001,0,NULL,Obra,0000000001,01/09/2010 SHANTAL,CONTRATADO,0
0000000223,2010,0225,PAVIMENTACION DE LA CALLE JESUS YAÑEZ TRAMO: DE ANTONIO TORRES GOMEZ A JOAQUIN OBREGON GONZALEZ COL.,Unitario,0000000001,0000000001,0,NULL,Obra,0000000001,01/09/2010 SHANTAL,CONTRATADO,0
0000000224,2010,0258,PAVIMENTACION DE LA CALLE MAR ADRIATICO TRAMO: GOLFO PERSICO A GOLFO DE TEHUANTEPEC COL. SANTA MARIA,Unitario,0000000001,0000000001,0,NULL,Obra,0000000001,01/09/2010 SHANTAL,CONTRATADO,0
0000000225,2010,0259,PAVIMENTACION DE LA CALLE RANCHO QUEMADO TRAMO: CASCADA REGLA-CERRO DE LA BUFA COL. LOMAS DE JEREZ (,Unitario,0000000001,0000000001,0,NULL,Obra,0000000001,01/09/2010 SHANTAL,CONTRATADO,0
0000000226,2010,0240,PAVIMENTACION DE LA CALLE JEREZ DE BLANES TRAMO: JEREZ DE BLANES TRAMO: JEREZ DE GRANADA-BLVD. DELTA,Unitario,0000000001,0000000001,0,NULL,Obra,0000000001,01/09/2010 SHANTAL,CONTRATADO,0
0000000227,2010,0257,PAVIMENTACION DE LA CALLE CARIÑEÑA TRAMO: DE BAYA- SARMIENTO COL. SAN JOSE EL ALTO (1ER ETAPA),Unitario,0000000001,0000000001,0,NULL,Obra,0000000001,01/09/2010 SHANTAL,CONTRATADO,0
0000000228,2010,0243,PAVIMENTACION DE LA CALLE PRIV. RIO SANTIAGO TRAMO: RIO SANTIAGO A TOPAR COL. LAS MARGARITAS (1ER ET,Unitario,0000000001,0000000001,0,NULL,Obra,0000000001,01/09/2010 SHANTAL,CONTRATADO,0
0000000229,2010,0247,PAVIMENTACION DE LA CALLE MONACO TRAMO: BLVD. TORRES LANDA-GOLFO DE TEHUANTEPEC COL. SANTA MARIA DEL,Unitario,0000000001,0000000001,0,NULL,Obra,0000000001,01/09/2010 SHANTAL,CONTRATADO,0
0000000230,2010,0261,PAVIMENTACION DE LA CALLE BUENOS AIRES TRAMO: RIO BALSAS-RIO HONDO COL. SAN NICOLAS,Unitario,0000000001,0000000001,0,NULL,Obra,0000000001,01/09/2010 SHANTAL,CONTRATADO,0
0000000231,2010,0191,PROYECTO EJECUTIVO A DESNIVEL EN LA INTERSECCION  DEL BLVD. JUAN ALONSO DE TORRES Y EL BLVD. JOSE MA,Unitario,0000000001,0000000001,0,NULL,Obra,0000000001,02/09/2010 SHANTAL,CONTRATADO,0
0000000232,2010,0190,MECANICA DE SUELOS PARA PROYECTO EJECUTIVO A DESNIVEL EN LA INTERSECCION DEL BLVD. JUAN ALONSO DE TO,Unitario,0000000001,0000000001,0,NULL,Obra,0000000001,02/09/2010,CONTRATADO,0
0000000233,2010,0201,SUMISTRO Y APLICACION DE PINTURA EN GUARNICION Y SUMINISTRO E INSTALACION DE VIALETA ("LEON ES COMO,Unitario,0000000001,0000000001,0,NULL,Obra,0000000001,02/09/2010 SHANTAL,CONTRATADO,0
0000000234,2010,0212,CONSTRUCCION DE MURO DE CONTENCION Y REHABILITACION DEL ARROYO VEHICULAR EN EL BLVD. JUAN ALONSO DE,Unitario,0000000001,0000000001,0,NULL,Obra,0000000001,02/09/2010 SHANTAL,CONTRATADO,0
0000000235,2010,0233,PAVIMENTACION DE LA CALLE RIO FLORIDO TRAMO: DE INDEPENDENCIA-CENTENARIO COL. SAN MIGUEL (1ER ETAPA),Unitario,0000000001,0000000001,0,NULL,Obra,0000000001,02/09/2010 SHANTAL  ,CONTRATADO,0
0000000236,2010,0253,PAVIMENTACION DE LA CALLE ALAMO TRAMO: CALLE CAOBA-CALLE ROSSINI COL. ARBOLEDAS (1ER ETAPA),Unitario,0000000001,0000000001,0,NULL,Obra,0000000001,02/09/2010 SHANTAL,CONTRATADO,0
0000000237,2010,0230,COORDINACION DE TRABAJOS A REALIZAR SOBRE FINCAS CATALOGADAS EN EL CENTRO HISTORICO UBICACION PRIMER,Unitario,0000000001,0000000001,0,NULL,Obra,0000000001,02/09/2010 SHANTAL,CONTRATADO,0
0000000238,2010,0213,PROYECTO EJECUTIVO DE LA CALLE PIRULES TRAMO: NICOLAS CALVO-BLVD. VASCO DE QUIROGA COL. DEPORTIVA II,Unitario,0000000001,0000000001,0,NULL,Obra,0000000001,03/09/2010 SHANTAL,CONTRATADO,0
0000000239,2010,0202,RESTAURACION DEL ORATORIO SAN FELIPE NERI,Unitario,0000000001,0000000001,0,NULL,Obra,0000000001,03/09/2010 SHANTAL,CONTRATADO,0
0000000240,2010,0266,PAVIMENTACION DE LA CALLE PRESA SANALONA TRAMO: HERMANOS ALDAMA-TOPAR ORIENTE COL. SAN NICOLAS,Unitario,0000000001,0000000001,0,NULL,Obra,0000000001,03/09/2010 SHANTAL,CONTRATADO,0
0000000241,2010,0241,PAVIMENTACION DE LA CALLE MIRTO TRAMO: CLAVEL-AZUCENA COL. OBRERA (1ER ETAPA),Unitario,0000000001,0000000001,0,NULL,Obra,0000000001,03/09/2010 SHANTAL,CONTRATADO,0
0000000242,2010,0244,PAVIMENTACION DE LA CALLE ZACATECAS TRAMO: PARAGUAY-PERU COL. OBRERA (1ER ETAPA),Unitario,0000000001,0000000001,0,NULL,Obra,0000000001,03/09/2010 SHANTAL,CONTRATADO,0
0000000243,2010,0248,PAVIMENTACION DE LA CALLE SANTO DOMINGO (1/2 CUERPO ORIENTE) TRAMO: SONORA-PAVIMENTO EXISTENTE NORTE,Unitario,0000000001,0000000001,0,NULL,Obra,0000000001,03/09/2010 SHANTAL,CONTRATADO,0
0000000244,2010,0267,PAVIMENTACION DE LA CALLE SOLLANO TRAMO: PIPILA A PAVIMENTO EXISTENTE COL. OBRERA (1ER ETAPA),Unitario,0000000001,0000000001,0,NULL,Obra,0000000001,03/09/2010 SHANTAL,CONTRATADO,0
0000000245,2010,0256,PAVIMENTACION DE LA CALLE KANSAS TRAMO: FILADELFIA-NUEVA YORK COL. LAS AMERICAS (1ER ETAPA),Unitario,0000000001,0000000001,0,NULL,Obra,0000000001,03/09/2010 SHANTAL,CONTRATADO,0
0000000246,2010,0249,PAVIMENTACION DE LA CALLE FILADELFIA TRAMO: KANSAS-LOS ANGELES COL. LAS AMERICAS (1ER ETAPA),Unitario,0000000001,0000000001,0,NULL,Obra,0000000001,03/09/2010 SHANTAL,CONTRATADO,0
0000000247,2010,0252,PAVIMENTACION DE LA CALLE FOSFORO TRAMO: POTASIO-TITANIO COL. VALLE DE SEÑORA (1ER ETAPA),Unitario,0000000001,0000000001,0,NULL,Obra,0000000001,03/09/2010 SHANTAL,CONTRATADO,0
0000000248,2010,0262,PAVIMENTACION DE LA CALLE PRIVADA RIO YAQUI TRAMO: RIO YAQUI A TOPAR COL. SAN MIGUEL (1ER ETAPA),Unitario,0000000001,0000000001,0,NULL,Obra,0000000001,06/09/2010 SHANTAL,CONTRATADO,0
0000000249,2010,0262,PAVIMENTACION DE LA CALLE PRIVADA RIO YAQUI TRAMO: RIO YAQUI A TOPAR COL. SAN MIGUEL (1ER ETAPA),Unitario,0000000001,0000000001,0,NULL,Obra,0000000001,06/07/2010 SHANTAL,CONTRATADO,0
0000000250,2010,0222,PROYECTO EJECUTIVO DE PAVIMENTACION DE LAS CALLES: ARTICULO 123 TRAMO: H. AYUNTAMIENTO-CORREGIDORA;,Unitario,0000000001,0000000001,0,NULL,Obra,0000000001,06/09/2010 SHANTAL,CONTRATADO,0
0000000251,2010,0234,PROYECTO EJECUTIVO DE PAVIMENTACION DE LAS CALLES: MADRE ROSA TRAMO: MADRE MARINA-ATOTONILCO COL. 10,Unitario,0000000001,0000000001,0,NULL,Obra,0000000001,06/09/2010 SHANTAL,CONTRATADO,0
0000000252,2010,0223,PAVIMENTACION DE LA CALLE MARTIN MUÑOZ TRAMO: DE BLVD. MARIANO ESCOBEDO-BLVD. LEON II COL. LEON II (,Unitario,0000000001,0000000001,0,NULL,Obra,0000000001,06/09/2010 SHANTAL,CONTRATADO,0
0000000253,2010,0246,PAVIMENTACION DE LA CALLE JEREZ DE SEVILLA TRAMO: JEREZ DE CASTILLA-JEREZ DE BARCELONA COL. JESUS MA,Unitario,0000000001,0000000001,0,NULL,Obra,0000000001,07/09/2010 SHANTAL,CONTRATADO,0
0000000254,2010,0218,PROYECTO EJECUTIVO DE IMAGEN URBANA DE LA COMUNIDAD DE SAN PEDRO DE LOS HERNANDEZ LEON,Unitario,0000000001,0000000001,0,NULL,Obra,0000000001,07/09/2010 SHANTAL,CONTRATADO,0
0000000255,2010,0245,PAVIMENTACION DE LA CALLE GRANATE (1/2 CUERPO NORTE) TRAMO: CORAL-PAVIMENTO EXISTENTE FRACC. GUADALU,Unitario,0000000001,0000000001,0,NULL,Obra,0000000001,07/09/2010 SHANTAL,CONTRATADO,0
0000000256,2010,0264,PAVIMENTACION DE LA CALLE PRIVADA ALASKA TRAMO: DE TLAXCALA A TOPAR COL. VILLA RESIDENCIAL ARBIDE (1,Unitario,0000000001,0000000001,0,NULL,Obra,0000000001,07/09/2010 SHANTAL,CONTRATADO,0
0000000257,2010,0251,PAVIMENTACION DE LA CALLE TORRE EIFFEL TRAMO: H. AYUNTAMIENTO-TORRE DEL CASTILLO COL. LAS TORRES (1E,Unitario,0000000001,0000000001,0,NULL,Obra,0000000001,08/09/2010 SHANTAL,CONTRATADO,0
