Id_Obra,Año,Clave_Obra,Nombre,Tipo_Precio,Id_Sub_Programa,Id_Localidad,Beneficiarios,Id_Convenio,Tipo_Obra_Proyecto,Id_Sub_Tipo_Obra,Observaciones,Enviar_Para,Id_Oficio_Asignacion_Obra
0000000258,2010,0275,REHABILITACION DE LOS ELEMENTOS EN LA ZONA PEATONAL DEL CENTRO DE LA CIUDAD,Unitario,0000000001,0000000001,0,NULL,Obra,0000000001,08/09/2010 SHANTAL,CONTRATADO,0
0000000259,2010,0250,PAVIMENTACION DE LA CALLE DEL TORIL TRAMO:AV. CENTRAL-DEL TORERO COL. PLAZA DE TOROS III SECC,Unitario,0000000001,0000000001,0,NULL,Obra,0000000001,08/09/2010 SHANTAL,CONTRATADO,0
0000000260,2010,0203,ACCESO A GLORIETA DEL BICENTENARIO LEON,Unitario,0000000001,0000000001,0,NULL,Obra,0000000001,08/09/2010 SHANTAL,CONTRATADO,0
0000000261,2010,0254,PAVIMENTACION DE LA CALLE KIUSSIO TRAMO: BLVD. LAS PALMAS-AND. TORIBIO ESQUIVEL COL. CD. SATELITE,Unitario,0000000001,0000000001,0,NULL,Obra,0000000001,09/09/2010 SHANTAL,CONTRATADO,0
0000000262,2010,0268,PAVIMENTACION DE LA CALLE DEL CANTIL TRAMO: PRADERA-TOPAR COL. PARQUE MANZANARES (1ER ETAPA),Unitario,0000000001,0000000001,0,NULL,Obra,0000000001,10/09/2010 SHANTAL,CONTRATADO,0
0000000263,2010,0269,PAVIMENTACION DE LA CALLE SAUCE TRAMO: DE CAOBA A ABEDUL COL. ARBOLEDAS DE INFONAVIT (1ER ETAPA),Unitario,0000000001,0000000001,0,NULL,Obra,0000000001,10/09/2010 SHANTAL,CONTRATADO,0
0000000264,2010,0273,LABORATORIO PARA LA ELABORACION DE PROYECTOS Y VERIFICACION DE OBRA 2010 VARIOS PUNTOS DE LA CIUDAD,Unitario,0000000001,0000000001,0,NULL,Obra,0000000001,10/09/2010 SHANTAL,CONTRATADO,0
0000000265,2010,0270,PAVIMENTACION DE LA CALLE ANDADOR MANUELA HERRERA TRAMO: GEORGE WASHINGTON-ALIANZA PARA EL PROGRESO,Unitario,0000000001,0000000001,0,NULL,Obra,0000000001,10/09/2010 SHANTAL,CONTRATADO,0
0000000266,2010,0272,BARDA PERIMETRAL EN LA ESCUELA SECUNDARIA GENERAL NO. 15 COL. LOMAS DE JEREZ,Unitario,0000000001,0000000001,0,NULL,Obra,0000000001,10/09/2010 SHANTAL,CONTRATADO,0
0000000267,2010,0276,ALUMBRADO PUBLICO ELECTRIFICACION DE KIOSCO Y LINEAS DE C.F.E. EN LA PLAZA SAN PEDRO DE LOS HERNANDE,Unitario,0000000001,0000000001,0,NULL,Obra,0000000001,13/09/2010 SHANTAL,CONTRATADO,0
0000000268,2010,0277,TRABAJOS COMPLEMENTARIOS EN LA DEMOLICION DEL EDIFICIO MONTES DE OCA ZONA CENTRO LEON,Unitario,0000000001,0000000001,0,NULL,Obra,0000000001,13/09/2010 SHANTAL,CONTRATADO,0
0000000269,2010,0271,PAVIMENTACION DE LA CALLE JEREZ DE CARTAGENA TRAMO:BUFAS DE ZACATECAS-JEREZ DE LA LUZ COL. VALLE DE,Unitario,0000000001,0000000001,0,NULL,Obra,0000000001,13/09/2010 SHANTAL,CONTRATADO,0
0000000270,2010,0278,PAVIMENTACION DE LA CALLE PRIVADA TALAVERA TRAMO: FRAY DANIEL MIRELES A TOPAR COL. SAN PEDRO DE LOS,Unitario,0000000001,0000000001,0,NULL,Obra,0000000001,17/09/2010 SHANTAL,CONTRATADO,0
0000000271,2010,0000,PROYECTO EJECUTIVO DE LA INTERSECCION EN BLVD. MORELOS E INSURGENTES SAN JUAN BOSCO LEON,Unitario,0000000001,0000000001,0,NULL,Obra,0000000001,20/09/2010 SHANTAL,CONTRATADO,0
0000000272,2010,0274,PROYECTO EJECUTIVO DE LA INTERSECCION EN BLVD. MORELOS E INSURGENTES SAN JUAN BOSCO LEON,Unitario,0000000001,0000000001,0,NULL,Obra,0000000001,20/09/2010 SHANTAL,CONTRATADO,0
0000000273,2010,0282,PAVIMENTACION DE LA CALLE 1 RA JEREZ DE MORSA TRAMO:DE BLVD.DELTA A TOPAR COL. VALLE DE JEREZ III 1E,Unitario,0000000001,0000000001,0,NULL,Obra,0000000001,23/09/2010 SHANTAL,CONTRATADO,0
0000000274,2010,0281,SEMAFORIZACION EN LA CALLE FRANCISCO I MADERO TRAMO: DE PROGRESO A HERMANOS ALDAMA CENTRO,Unitario,0000000001,0000000001,0,NULL,Obra,0000000001,23/09/2010 SHANTAL,CONTRATADO,0
0000000275,2010,0164,RESTAURACION DE VITRALES EN LA CATEDRAL BASILICA DE LEON,Unitario,0000000001,0000000001,0,NULL,Obra,0000000001,24/09/2010 SHANTAL,CONTRATADO,0
0000000276,2010,10013,ESCALATORIA EJE METROPOLITANO LEON-SILAO (TRAMO: BLVD. JOSE MARIA MORELOS-BLVD. DELTA) PAVIMENTACION,Unitario,0000000001,0000000001,0,NULL,Obra,0000000001,28/09/2010 ALMA,CONTRATADO,0
0000000277,2010,0163,"ELABORACION DE FICHAS DE SOLICITUD DE PROYECTOS, FICHAS TECNICAS PARA LA ELABORACION DE PROYECTOS EJ",Unitario,0000000001,0000000001,0,NULL,Obra,0000000001,28/09/2010 SHANTAL,CONTRATADO,0
0000000278,2010,0192,PROYECTO EJECUTIVO DE AULA A DISTANCIA Y STAND DE TIRO VIRTUAL A UBICARSE EN LA ACADEMIA DE FORMACIO,Unitario,0000000001,0000000001,0,NULL,Obra,0000000001,28/09/2010 SHANTAL,CONTRATADO,0
0000000279,2010,0263,TRABAJOS COMPLEMENTARIOS EN LA PAVIMENTACION DE LA CALLE RENACIMIENTO TRAMO: CAMINO A SAN JOSE DEL P,Unitario,0000000001,0000000001,0,NULL,Obra,0000000001,28/09/2010 SHANTAL,CONTRATADO,0
0000000280,2010,0242,TRABAJOS COMPLEMENTARIOS EN LA PAVIMENTACION DE LA CALLE CALAKMUL TRAMO:TZIN TZUN TZAN COL. LOS CAST,Unitario,0000000001,0000000001,0,NULL,Obra,0000000001,28/09/2010 SHANTAL,CONTRATADO,0
0000000281,2010,0293,PROYECTO EJECUTIVO DE PAVIMENTACION DEL CAMINO PRINCIPAL DE LA CARRETERA A LA COMUNIDAD DE SAN RAFAE,Unitario,0000000001,0000000001,0,NULL,Obra,0000000001,28/09/2010 SHANTAL,CONTRATADO,0
0000000282,2010,0279,PAVIMENTACION DE LA CALLE MOLUSCO TRAMO: BLVD. DELTA - JEREZ DE ANTAÑO COL. ESPERANZA DE JEREZ (1ER,Unitario,0000000001,0000000001,0,NULL,Obra,0000000001,29/09/2010 SHANTAL,CONTRATADO,0
0000000283,2010,0287,ADECUACION DE PROYECTO EJECUTIVO DEL BLVD. TIMOTEO LOZANO TRAMO: DE JEREZ DE ANTAÑO A BLVD. FCO. VIL,Unitario,0000000001,0000000001,0,NULL,Obra,0000000001,29/09/2010 SHANTAL,CONTRATADO,0
0000000284,2010,0285,PROYECTO EJECUTIVO DE LA CICLOVIA DEL BLVD. VICENTE VALTIERRA TRAMO: MALECON DEL RIO DE LOS GOMEZ A,Unitario,0000000001,0000000001,0,NULL,Obra,0000000001,29/09/2010 SHANTAL,CONTRATADO,0
0000000285,2010,0265,PAVIMENTACION DE LA CALLE AGUASCALIENTES TRAMO: DE PARAGUAY - PERU COL. OBRERA (1ER ETAPA),Unitario,0000000001,0000000001,0,NULL,Obra,0000000001,29/09/2010 SHANTAL,CONTRATADO,0
0000000286,2010,0283,PROYECTO EJECUTIVO DE PAVIMENTACIONDE DE LAS CALLES HEROES DE LA INDEPENDENCIA TRAMO: ANCHA-NOSTALGI,Unitario,0000000001,0000000001,0,NULL,Obra,0000000001,29/09/2010 SHANTAL,CONTRATADO,0
0000000287,2010,0296,PROYECTO EJECUTIVO DE LA CALLE PLAN DE GUADALUPE TRAMO: DE CALLE TIMOTEO LOZANO A TOPAR EN LA COLONI,Unitario,0000000001,0000000001,0,NULL,Obra,0000000001,29/09/2010 SHANTAL  ,CONTRATADO,0
0000000288,2010,0297,PROYECTO EJECUTIVO DE LA CALLE CORREGIDORA TRAMO: DE CALLE TIMOTEO LOZANO A LAS TORRES EN LA COLONIA,Unitario,0000000001,0000000001,0,NULL,Obra,0000000001,29/09/2010 SHANTAL,CONTRATADO,0
0000000289,2010,0300,BLVD. DELTA EN EL TRAMO DE LA VIALIDAD DEL EJE METROPOLITANO DEL BLVD. JUAN ALONSO DE TORRES A BLVD.,Unitario,0000000001,0000000001,0,NULL,Obra,0000000001,01/10/10 SHANTAL,CONTRATADO,0
0000000290,2010,0284,PROYECTO EJECUTIVO DE PAVIMENTACION DE LAS CALLES: NOSTALGIA TRAMO: HEROES DE LA INDEPENDENCIA-LA LU,Unitario,0000000001,0000000001,0,NULL,Obra,0000000001,04/10/2010 SHANTAL,CONTRATADO,0
0000000291,2010,0304,PROYECTO EJECUTIVO DE LA CALLE ANDUJAR TRAMO: BARCELONA A CALLE TERRAZA EN LA COLONIA PILETAS II,Unitario,0000000001,0000000001,0,NULL,Obra,0000000001,04/10/2010 SHANTAL,CONTRATADO,0
0000000292,2010,0305,PROYECTO EJECUTIVO DE LA CALLE TOLEDO TRAMO: BARCELONA A CALLE CATALUÑA EN LA COLONIA PILETAS II,Unitario,0000000001,0000000001,0,NULL,Obra,0000000001,04/10/2010 SHANTAL,CONTRATADO,0
0000000293,2010,0303,PROYECTO EJECUTIVO DE LA CALLE MARTIRES DE RIO BLANCO TRAMO: DE CALLE MINA DEL CAPOTE A ARTICULO 27,Unitario,0000000001,0000000001,0,NULL,Obra,0000000001,04/10/10 SHANTAL,CONTRATADO,0
0000000294,2010,0288,CONSTRUCCION DE ESTRUCTURA METALICA Y LAMINA PARA CUBIERTA EN LA PARTE POSTERIOR DEL TALLER DE SERVI,Unitario,0000000001,0000000001,0,NULL,Obra,0000000001,04/10/2010 SHANTAL,CONTRATADO,0
0000000295,2010,0298,PROYECTO EJECUTIVO DE LA CALLE ASAMBLEA DE QUERETARO TRAMO: DE CALLE ATOTONILCOA ARTICULO 27 EN LA C,Unitario,0000000001,0000000001,0,NULL,Obra,0000000001,04/10/2010 SHANTAL  ,CONTRATADO,0
0000000296,2010,0295,PROYECTO EJECUTIVO DE LA CALLE CLUB LIBERAL TRAMO:DE MINA DEL CAPOTE A ARTICUL 27 EN LA COLONIA LIBE,Unitario,0000000001,0000000001,0,NULL,Obra,0000000001,04/10/2010 SHANTAL,CONTRATADO,0
0000000297,2010,0292,PROYECTO EJECUTIVO DE LA CICLOVIA DEL BLVD. LA LUZ TRAMO: DE MALECON DEL RIO DE LOS GOMEZ A BLVD.VIC,Unitario,0000000001,0000000001,0,NULL,Obra,0000000001,04/10/2010 SHANTAL,CONTRATADO,0
0000000298,2010,0302,PROYECTO EJECUTIVO DE PAVIMENTACION DE LA CALLE SODIO TRAMO: NIQUEL A NITROGENO EN SAN JOSE DEL CONS,Unitario,0000000001,0000000001,0,NULL,Obra,0000000001,04/10/2010 SHANTAL,CONTRATADO,0
0000000299,2010,0301,PROYECTO EJECUTIVO DE LA CALLE JARDINES DEL ROCIO TRAMO: SALTILLO (GRL FCO. VILLA) A CALLE RODRIGO G,Unitario,0000000001,0000000001,0,NULL,Obra,0000000001,04/10/10 SHANTAL  ,CONTRATADO,0
0000000300,2010,0299,PROYECTO EJECUTIVO DE LA CALLE CALZADA DE LOS SANTOS (DE LOS PROFETAS) TRAMO: SALTILLO (GRAL FCO. VI,Unitario,0000000001,0000000001,0,NULL,Obra,0000000001,04/10/2010 SHANTAL,CONTRATADO,0
0000000301,2010,0294,PROYECTO EJECUTIVO DE PUENTE VEHICULAR SOBRE EL RIO HACIENDA ARRIBA EN LA COMUNIDAD DE HACIENDA ARRI,Unitario,0000000001,0000000001,0,NULL,Obra,0000000001,04/10/2010 SHANTAL,CONTRATADO,0
0000000302,2010,0313,PROYECTO DE SOLUCION DE INTERSECCIONES DE LA RED DE CICLOVIA EXISTENTE EN LA CIUDAD LEON,Unitario,0000000001,0000000001,0,NULL,Obra,0000000001,04/10/2010 SHANTAL,CONTRATADO,0
0000000303,2010,0286,PROYECTO EJECUTIVO DE LA CICLOVIA DEL BLVD. TELLEZ CRUCES TRAMO: DE BLVD. JOSE MARIA MORELOS A BLVD.,Unitario,0000000001,0000000001,0,NULL,Obra,0000000001,06/10/2010 SHANTAL,CONTRATADO,0
0000000304,2010,0310,PROYECTO EJECUTIVO DE RECONSTRUCCIN DEL MERCADO COMONFORT ZAPATERO UBICADO EN CALLE IGNACIO COMONFOR,Unitario,0000000001,0000000001,0,NULL,Obra,0000000001,06/10/2010 SHANTAL,CONTRATADO,0
0000000305,2010,0306,PROYECTO EJECUTIVO DE PAVIMENTACION DE LA CALLE JOSE MANUEL SOMERA TRAMO: BLVD. MARIANO ESCOBEDO A B,Unitario,0000000001,0000000001,0,NULL,Obra,0000000001,06/10/2010 SHANTAL,CONTRATADO,0
0000000306,2010,0316,TERCERA ETAPA DEL CENTRO COMUNITARIO DE LA COLONIA VALLE DE SAN JOSE,Unitario,0000000001,0000000001,0,NULL,Obra,0000000001,07/10/2010 SHANTAL,CONTRATADO,0
0000000307,2010,0289,PROYECTO EJECUTIVO DE LA CICLOVIA DE LAS CALLES:PELETEROS-ALAMO-ROBLE-OLIVO-JUAN DE LA BARRERA-AQUIL,Unitario,0000000001,0000000001,0,NULL,Obra,0000000001,07/10/2010 SHANTAL,CONTRATADO,0
0000000308,2010,0314,CONSTRUCCION DE BARDA PERIMETRAL EN LA ESCUELA TELESECUNDARIA 491- COL. LIBERTAD,Unitario,0000000001,0000000001,0,NULL,Obra,0000000001,15/10/2010 SHANTAL,CONTRATADO,0
0000000309,2010,0322,2A. ETAPA DE CONSTRUCCION DE BARDA PERIMETRAL DE ESTRUCTURA METALICA EN EL PARQUE CENTRO PLANETA TIE,Unitario,0000000001,0000000001,0,NULL,Obra,0000000001,15/10/2010 SHANTAL,CONTRATADO,0
0000000310,2010,0319,PROYECTO EJECUTIVO DE MODIFICACION DE LA MICRO ESTACION BOCANEGRA Y ADECUACION DEL BLVD. PASEO DE JE,Unitario,0000000001,0000000001,0,NULL,Obra,0000000001,15/10/10 SHANTAL,CONTRATADO,0
0000000311,2010,0312,PROYECTO DE IMAGEN URBANA DEL BLVD. BICENTENARIO TRAMO: DE GLORIETA JUAN PABLO II A INSURGENTES LEON,Unitario,0000000001,0000000001,0,NULL,Obra,0000000001,15/10/2010 SHANTAL,CONTRATADO,0
0000000312,2010,0321,"PROYECTO EJECUTIVO DE LA AMPLIACION PLAZA DEL MUSICO ENTRE LAS CALLES AV. PARAISOS, FRANCIA, HOLANDA",Unitario,0000000001,0000000001,0,NULL,Obra,0000000001,15/10/2010 SHANTAL,CONTRATADO,0
0000000313,2010,0315,REHABILITACION DE TANQUE ELEVADO EN LA COMUNIDAD DE SANTA ANA DEL CONDE LEON,Unitario,0000000001,0000000001,0,NULL,Obra,0000000001,15/10/2010 SHANTAL,CONTRATADO,0
0000000314,2010,0320,PROYECTO EJECUTIVO DE CUERPOS LATERALES (2) Y PUENTE PEATONAL (1) EN BLVD. JOES MARIA MORELOS TRAMO:,Unitario,0000000001,0000000001,0,NULL,Obra,0000000001,15/10/2010 SHANTAL,CONTRATADO,0
0000000315,2010,0323,PROYECTO EJECUTIVO DE AMPLIACION BLVD. TIMOTEO LOZANO DE CALLE MAYORDOMO A BLVD. CERVANTES SAAVEDRA,Unitario,0000000001,0000000001,0,NULL,Obra,0000000001,15/10/2010 SHANTAL,CONTRATADO,0
0000000316,2010,0327,3RA ETAPA DEL ESPACIO DEPORTIVO EN LA COLONIA AZTECA,Unitario,0000000001,0000000001,0,NULL,Obra,0000000001,19/11/2010 ALMA,CONTRATADO,0
0000000317,2010,0329,PAVIMENTACION DE LA CALLE ALERCE TRAMO: DE CUENCA FLORIDA A CALLE URAPE COL. VALLE HERMOSO (1ERA ETA,Unitario,0000000001,0000000001,0,NULL,Obra,0000000001,15/10/2010 SHANTAL,CONTRATADO,0
0000000318,2010,0280,PROYECTO MUSEOGRAFICO DE LAS IDENTIDADES LEONESAS,Unitario,0000000001,0000000001,0,NULL,Obra,0000000001,15/10/2010 SHANTAL,CONTRATADO,0
0000000319,2010,0330,3RA ETAPA DEL PARQUE EN LA COL. AGUA AZUL III SECC. Y 3RA ETAPA DE ANDADORES EN PARQUE LINEAL MARICH,Unitario,0000000001,0000000001,0,NULL,Obra,0000000001,19/11/2010 ALMA,CONTRATADO,0
0000000320,2010,0340,PAVIMENTACION DE LA CALLE ALICIA TRAMO: REFUGIO - TOPAR COL. LA ORIENTAL (1ER ETAPA),Unitario,0000000001,0000000001,0,NULL,Obra,0000000001,CAPTURADO 22/10/2010,CONTRATADO,0
0000000321,2010,0325,PAVIMENTACION DE LA CALLE URUAPAN TRAMO: COALCOMAN A PAV. EXISTENTE; Y PAVIMENTACION DE LA PRIV. ZAM,Unitario,0000000001,0000000001,0,NULL,Obra,0000000001,CAPTURADO 22/10/2010 ALMA,CONTRATADO,0
0000000322,2010,0338,PAVIMENTACION DE LA CALLE SAN JOSE DE OCA TRAMO: TIMOTEO LOZANO - SAN JOSE DE AMAZONAS COL. REFUGIO,Unitario,0000000001,0000000001,0,NULL,Obra,0000000001,CAPTURADO 22/10/2010 ALMA,CONTRATADO,0
0000000323,2010,0328,2DA. ETAPA DEL PARQUE CAMPESTRE DE JEREZ,Unitario,0000000001,0000000001,0,NULL,Obra,0000000001,CAPTURADO 22/10/2010 ALMA  ,CONTRATADO,0
0000000324,2010,0324,PAVIMENTACION DE LA CALLE 2DA. PRIVADA ESPAÑITA TRAMO: DE ESPAÑITA A FONDO PRIVADA COL. BARRIO DE GU,Unitario,0000000001,0000000001,0,NULL,Obra,0000000001,CAPTURADO 22/10/2010 ALMA  ,CONTRATADO,0
0000000325,2010,0343,PROYECTO EJECUTIVO DE CUERPOS LATERALES (2) Y PUENTES VEHICULARES SOBRE ARROYO EL EJIDO Y PEATONAL (,Unitario,0000000001,0000000001,0,NULL,Obra,0000000001,CAPTURADO 22/10/2010 ALMA,CONTRATADO,0
0000000326,2010,0344,PAVIMENTACION DE LA CALLE RIO SAN FERNANDO TRAMO: DE CALLE AGUA MARINA A AV. CENTRAL COL. GUADALUPE,Unitario,0000000001,0000000001,0,NULL,Obra,0000000001,CAPTURADO 22/10/2010,CONTRATADO,0
0000000327,2010,0352,PAVIMENTACION DE LA CALLE DEL PARQUE TRAMO: DE LA ALDEA A LA MORA COL. VILLAS DE LEON (1ER ETAPA),Unitario,0000000001,0000000001,0,NULL,Obra,0000000001,CAPTURADO 22/10/2010 ALMA,CONTRATADO,0
0000000328,2010,0326,PAVIMENTACION DE LA CALLE JEREZ DE LULE TRAMO: DE BLVD. DELTA  DE JEREZ A CALLE JEREZ DE ANTAÑO COL.,Unitario,0000000001,0000000001,0,NULL,Obra,0000000001,CAPTURADO 22/10/2010 ALMA  ,CONTRATADO,0
0000000329,2010,0336,3A. ETAPA DE PAVIMENTACION DE LA AV. DEL AGRICULTOR TRAMO: DE CALLE CERRO DEL CUBILETE A CERRO AZUL,Unitario,0000000001,0000000001,0,NULL,Obra,0000000001,CAPTURADO 22/10/2010 ALMA  ,CONTRATADO,0
0000000330,2010,0334,PAVIMENTACION DE LA CALLE MADRE SIERRA TRAMO: DE CALLE MADRE LUCIA A MADRE TERESA COL. DIEZ DE MAYO,Unitario,0000000001,0000000001,0,NULL,Obra,0000000001,CAPTURADO 22/10/2010 ALMA,CONTRATADO,0
0000000331,2010,0331,PAVIMENTACION DE LA CALLE CASCADA DE REGLA TRAMO: DE CALLE JEREZ DE LA LUZ A BALCON POPOCATEPETL COL,Unitario,0000000001,0000000001,0,NULL,Obra,0000000001,CAPTURADO 22/10/2010 ALMA  ,CONTRATADO,0
0000000332,2010,0317,PROYECTO EJECUTIVO DE LA CALLE CONGRESO CONSTITUYENTE TRAMO: DE CALLE ATOTONILCO A ARTICULO 27 EN LA,Unitario,0000000001,0000000001,0,NULL,Obra,0000000001,CAPTURADO 22/10/2010 ALMA,CONTRATADO,0
0000000333,2010,0333,COMANDANCIA DE SEGURIDAD PUBLICA MUNICIPAL (REHABILITACION ESTRUCTURAL) EN LA CENTRAL PONIENTE DE SE,Unitario,0000000001,0000000001,0,NULL,Obra,0000000001,CAPTURADO 22/10/2010 ALMA  ,CONTRATADO,0
0000000334,2010,0318,ADECUACION DEL PROYECTO BLVD. TIMOTEO LOZANO TRAMO: BLVD. DELTA A BLVD. ATOTONILCO; Y PROYECTO EJECU,Unitario,0000000001,0000000001,0,NULL,Obra,0000000001,CAPTURADO 26/10/2010 ALMA  ,CONTRATADO,0
0000000335,2010,0309,PROYECTO EJECUTIVO DE LA PAVIMENTACION DEL ACCESO A LA COL. NUEVO LEON,Unitario,0000000001,0000000001,0,NULL,Obra,0000000001,CAPTURADO 26/10/2010 ALMA  ,CONTRATADO,0
0000000336,2010,0308,PROYECTO EJECUTIVO DE LA CALLE TORITOS TRAMO: DE SABILA A CUENCA FLORIDA COL. VALLE HERMOSO,Unitario,0000000001,0000000001,0,NULL,Obra,0000000001,CAPTURADO 26/10/2010 ALMA  ,CONTRATADO,0
0000000337,2010,0307,PROYECTO EJECUTIVO DE LA CALLE CANAL DEL NORTE TRAMO: AMERICA DEL NORTE A AGUILILLA COL. LA NORTEÑA,Unitario,0000000001,0000000001,0,NULL,Obra,0000000001,CAPTURADO 26/10/2010 ALMA  ,CONTRATADO,0
0000000338,2010,0291,REPARACION PROVISIONAL DE VENTANAS EN CENTAL DE EMERGENCIAS 066 - LEON,Unitario,0000000001,0000000001,0,NULL,Obra,0000000001,CAPTURADO 28/10/2010 ALMA  ,CONTRATADO,0
0000000339,2010,0255,PAVIMENTACION DE LA CALLE AGEO TRAMO: BLVD. HILARIO MEDINA - TOPAR COL. NUEVA SANTA ROSA DE LIMA (1E,Unitario,0000000001,0000000001,0,NULL,Obra,0000000001,CAPTURADO 01/11/2010 ALMA  ,CONTRATADO,0
0000000340,2010,0341,PAVIMENTACION DE LA CALLE ANDRES QUINTANA ROO Y CALLE URUAPAN TRAMO: DE CALLE PLUTARCO ELIAS CALLES,Unitario,0000000001,0000000001,0,NULL,Obra,0000000001,CAPTURADO 04/11/2010 ALMA  ,CONTRATADO,0
0000000341,2010,0342,PAVIMENTACION DE LA CALLE CERRADA ESPAÑITA TRAMO: CALLE ESPAÑITA A TOPAR COL. FRACCION DEL COECILLO,Unitario,0000000001,0000000001,0,NULL,Obra,0000000001,CAPTURADO 04/11/2010 ALMA  ,CONTRATADO,0
0000000342,2010,0345,PROYECTO EJECUTIVO DE LAS CALLES: YANQUIS TRAMO: DE AV. NICOLAS CALVO A ORIOLES; YAQUIS TRAMO: DE OR,Unitario,0000000001,0000000001,0,NULL,Obra,0000000001,CAPTURADO 04/11/2010 ALMA    ,CONTRATADO,0
0000000343,2010,0346,TRAMITE PARA PERMISOS DE OBRA EN EL PARQUE LINEAL DEL CANAL SARDANETA TRAMO: IBARRILLA - PARQUE METR,Unitario,0000000001,0000000001,0,NULL,Obra,0000000001,CAPTURADO 05/11/2010 ALMA  ,CONTRATADO,0
0000000344,2010,0349,ADECUACION DE OFICINAS DE PRESUPUESTOS PARTICIPATIVOS PALACIO MUNICIPAL ZONA CENTRO,Unitario,0000000001,0000000001,0,NULL,Obra,0000000001,CAPTURADO 05/11/2010 ALMA    ,CONTRATADO,0
0000000345,2010,0351,PAVIMENTACION DE LA CALLE RAFAEL RANGEL TRAMO: CALLE JOAQUIN OBREGON GONZALEZ A CALLE ANTONIO TORRES,Unitario,0000000001,0000000001,0,NULL,Obra,0000000001,CAPTURADO 05/11/2010 ALMA,CONTRATADO,0
0000000346,2010,0358,PAVIMENTACION DE LA CALLE JICAMA TRAMO: DE CALLE AGUACATE A TOPAR CON AREA DE DONACION COL. LAS MAND,Unitario,0000000001,0000000001,0,NULL,Obra,0000000001,CAPTURADO 05/11/2010 ALMA    ,CONTRATADO,0
0000000347,2010,0371,INTERVENCION DE FACHADAS EN LA CALLE MADERO (SECTOR 3) TRAMO: DE CALLE LIBERTAD A GANTE CENTRO HISTO,Unitario,0000000001,0000000001,0,NULL,Obra,0000000001,CAPTURADO 08/11/2010 ALMA,CONTRATADO,0
0000000348,2010,0388,REHABILITACION DE PLATAFORMA DE ATERRIZAJE EN HELIPUERTO DE LA SECRETARIA DE SEGURIDAD PUBLICA LEON,Unitario,0000000001,0000000001,0,NULL,Obra,0000000001,08/11/2010 ALMA,CONTRATADO,0
0000000349,2010,0364,PAVIMENTACION DE LA CALLE MADRE MAURA TRAMO: CERRO DEL SOYATE - MADRE TIERRA COL. DIEZ DE MAYO,Unitario,0000000001,0000000001,0,NULL,Obra,0000000001,CAPTURADO 08/11/2010 ALMA  ,CONTRATADO,0
0000000350,2010,0387,PAVIMENTACION E INSTALACIONES ELECTRICAS DE LA BAHIA EN CALLE FRANCIA TRAMO: HOLANDA - LAGO DE CHAPA,Unitario,0000000001,0000000001,0,NULL,Obra,0000000001,CAPTURADO 08/11/2010 ALMA  ,CONTRATADO,0
0000000351,2010,0379,CONSTRUCCION DE PUENTE PEATONAL SOBRE EL RIO DE LOS GOMEZ Y CALLE VERTIENTE DEL RIO COL. LA ESCONDID,Unitario,0000000001,0000000001,0,NULL,Obra,0000000001,CAPTURADO 08/11/2010 ALMA,CONTRATADO,0
0000000352,2010,0369,PAVIMENTACION DE LA CALLE FRESNO TRAMO: DE CALLE ARCE A PALMERIN COL. ARBOLEDAS DE INFONAVIT,Unitario,0000000001,0000000001,0,NULL,Obra,0000000001,CAPTURADO 08/11/2010 ALMA  ,CONTRATADO,0
0000000353,2010,0362,ESTUDIO DE INGENIERIA DE TRANSITO Y EVALUACION SOCIOECONOMICA PARA LA DETERMINACION DE LA FACTIBILID,Unitario,0000000001,0000000001,0,NULL,Obra,0000000001,APTURADO 08/11/2010 ALMA,CONTRATADO,0
0000000354,2010,0361,ESTUDIO DE INGENIERIA DE TRANSITO Y EVALUACION SOCIOECONOMICA PARA LA DETERMINACION DE LA FACTIBILID,Unitario,0000000001,0000000001,0,NULL,Obra,0000000001,CAPTURADO 09/11/2010 ALMA    ,CONTRATADO,0
0000000355,2010,0384,CONSTRUCCION DE BANQUETAS EN CALLE VATICANO PARA CEBETIS 225 TRAMO: LEON XIII A TOPAR CON PAVIMENTO,Unitario,0000000001,0000000001,0,NULL,Obra,0000000001,CAPTURADO 12/11/2010 ALMA  ,CONTRATADO,0
0000000356,2010,0410,"REFORZAMIENTO DE LOS TALUDES EN EL ARROYO LA TINAJA, LEON.",Unitario,0000000001,0000000001,0,NULL,Obra,0000000001,CAPTURADO 12/11/2010 ALMA  ,CONTRATADO,0
0000000357,2010,0378,INTERVENCION DE FACHADAS EN LA PLAZA PRINCIPAL Y CALLE HIDALGO TRAMO: DE PORTAL PADILLA A CALLE ALVA,Unitario,0000000001,0000000001,0,NULL,Obra,0000000001,CAPTURADO 12/11/2010 ALMA    ,CONTRATADO,0
0000000358,2010,0386,CONSTRUCCION DE MURO PERIMETRAL EN LA ESCUELA PRIM. RURAL FEDERAL NUEVA CREACION LOMAS DE LOS SAUCES,Unitario,0000000001,0000000001,0,NULL,Obra,0000000001,CAPTURADO 12/11/2010 ALMA  ,CONTRATADO,0
0000000359,2010,0385,CONSTRUCCION DE MURO PERIMETRAL EN KINDER SANTA MARIA DE CEMENTOS LEON,Unitario,0000000001,0000000001,0,NULL,Obra,0000000001,CAPTURADO 12/11/2010 ALMA,CONTRATADO,0
0000000360,2010,0363,PROYECTO EJECUTIVO RUTA DEL PEATON SAN JUAN - SAN FRANCISCO - POLIFORUM TRAMO: 1) PLAZA SAN FRANCISC,Unitario,0000000001,0000000001,0,NULL,Obra,0000000001,CAPTURADO 12/11/2010 ALMA,CONTRATADO,0
0000000361,2010,0365,PAVIMENTACION DE LA CALLE GERANIOS TRAMO: DE BLVD. SAN JUAN JOSE TORRES LANDA - BLVD. GONZALEZ BOCAN,Unitario,0000000001,0000000001,0,NULL,Obra,0000000001,CAPTURADO 12/11/2010 ALMA,CONTRATADO,0
0000000362,2010,0367,PAVIMENTACION DE LA CALLE COSTA AZUL TRAMO: PAQUISTAN A PAVIMENTO EXISTENTE COL. EL MAUREL,Unitario,0000000001,0000000001,0,NULL,Obra,0000000001,CAPTURADO 12/11/2010 ALMA  ,CONTRATADO,0
0000000363,2010,0368,PAVIMENTACION DE LA CALLE ERRO DE LOS MILAGROS TRAMO: DE CALLE CERRO DEL CUBO A CALLE CERRO DE LOS M,Unitario,0000000001,0000000001,0,NULL,Obra,0000000001,CAPTURADO 12/11/2010 ALMA        ,CONTRATADO,0
0000000364,2010,0366,PAVIMENTACION DE LA CALLE JEREZ DEL DORADO TRAMO: JEREZ DE LA FRONTERA A CALLE CARTAGENA COL. VALLE,Unitario,0000000001,0000000001,0,NULL,Obra,0000000001,CAPTURADO 12/11/2010 ALMA    ,CONTRATADO,0
0000000365,2010,0377,PAVIMENTACION DE LA CALLE SANTO TOMAS DE AQUINO TRAMO: DE LA CALLE ANTONIO TORRES GOMEZ A BLVD. TELL,Unitario,0000000001,0000000001,0,NULL,Obra,0000000001,CAPTURADO 12/11/2010 ALMA    ,CONTRATADO,0
0000000366,2010,0393,CONSTRUCCION DE ALBERGUE CANINO EN CENTRO DE CONTROL Y RESCATE ANIMAL LEON,Unitario,0000000001,0000000001,0,NULL,Obra,0000000001,CAPTURADO 12/11/2010 ALMA      ,CONTRATADO,0
0000000367,2010,0380,PAVIMENTACION DE LA CALLE 2DA PRIVADA BUENOS AIRES ORIENTE TRAMO: DE BUENOS AIRES A TOPAR COL. SAN N,Unitario,0000000001,0000000001,0,NULL,Obra,0000000001,CAPTURADO 12/11/2010 ALMA  ,CONTRATADO,0
0000000368,2010,0381,PAVIMENTACION DE LA CALLE AMORES TRAMO: DE CALLE ARENA A BLVD. VENUSTIANO CARRANZA COL. SAN MIGUEL,Unitario,0000000001,0000000001,0,NULL,Obra,0000000001,CAPTURADO 12/11/2010 ALMA  ,CONTRATADO,0
0000000369,2010,0395,INTERVENCION DE FACHADAS EN LA CALLE MADERO (SECTOR 6 Y 7) TRAMO: DE MALECON DEL RIO A LA CALLE 13 D,Unitario,0000000001,0000000001,0,NULL,Obra,0000000001,CAPTURADO 12/11/2010 ALMA  ,CONTRATADO,0
0000000370,2010,0401,PAVIMENTACION DE LA CALLE OLMO TRAMO: CALLE FRESNO A CALLE ROBLE COL. ARBOLEDAS DE INFONAVIT,Unitario,0000000001,0000000001,0,NULL,Obra,0000000001,CAPTURADO 12/11/2010,CONTRATADO,0
0000000371,2010,0356,PAVIMENTACION DE LA CALLE VALLE ARIZPE TRAMO: VALLE DE CASTELLALBO A VALLE DE SAN JUAN COL. CAMPESTR,Unitario,0000000001,0000000001,0,NULL,Obra,0000000001,CAPTURADO 12/11/2010,CONTRATADO,0
0000000372,2010,0332,RESTAURACION DE FACHADAS EN LA CALLE MADERO (SECTOR 4) TRAMO: 15 DE SEPTIEMBRE - LIBERTAD CENTRO HIS,Unitario,0000000001,0000000001,0,NULL,Obra,0000000001,CAPTURADO 16/11/2010 ALMA,CONTRATADO,0
0000000373,2010,0337,PAVIMENTACION DE LA CALLE JEREZ DE GERA TRAMO: JEREZ DE BESAYA A JEREZ DE MENORCA COL. VALLE DE JERE,Unitario,0000000001,0000000001,0,NULL,Obra,0000000001,CAPTURADO 16/11/2010 ALMA  ,CONTRATADO,0
0000000374,2010,0348,SUMINISTRO E INSTALACION DE 4 TOPES EN LA COLONIA JARDINES DE SAN PEDRO LEON,Unitario,0000000001,0000000001,0,NULL,Obra,0000000001,CAPTURADO 17/11/2010 ALMA  ,CONTRATADO,0
0000000375,2010,0347,ESTUDIO DE MECANICA DE SUELOS PARA LAS INTERSECCIONES A DESNIVEL DEL BLVD. JOSE MARIA MORELOS CON BL,Unitario,0000000001,0000000001,0,NULL,Obra,0000000001,CAPTURADO 17/11/2010 ALMA,CONTRATADO,0
0000000376,2010,0350,AULAS U2C EN SECUNDARIA GENERAL 17 SOR JUANA INES DE LA CRUZ BLVD. EPSILON # 1105 LEON,Unitario,0000000001,0000000001,0,NULL,Obra,0000000001,CAPTURADO 17/11/2010 ALMA  ,CONTRATADO,0
0000000377,2010,0372,PAVIMENTACION DE LA CALLE HUIMILPAN TRAMO: DE LA CALLE GAMBOA A CALLE COFRADIA COL. EL PALOTE,Unitario,0000000001,0000000001,0,NULL,Obra,0000000001,CAPTURADO 18/11/2010 ALMA,CONTRATADO,0
0000000378,2010,0339,PAVIMENTACION DE LA CALLE ANTONIO TORRES GOMEZ TRAMO: DE RAFAEL CORRALES AYALA - SANTO TOMAS DE AQUI,Unitario,0000000001,0000000001,0,NULL,Obra,0000000001,CAPTURADO 18/11/2010 ALMA  ,CONTRATADO,0
0000000379,2010,0373,PROYECTO EJECUTIVO PARQUE TEMATICO CHABELO (CONCEPTUAL PLANTA CONJUNTO DESARROLLO NIVEL EJECUTIVO DE,Unitario,0000000001,0000000001,0,NULL,Obra,0000000001,CAPTURADO 18/11/2010 ALMA,CONTRATADO,0
0000000380,2010,0375,ESTUDIO DE INGENIERIA DE TRANSITO Y SUPERVISION PARA EL ESTUDIO DE PARTICIPACION PUBLICO PRIVADA DEL,Unitario,0000000001,0000000001,0,NULL,Obra,0000000001,CAPTURADO 18/11/2010 ALMA,CONTRATADO,0
0000000381,2010,0383,INTERVENCION DE FACHADAS EN EL PASAJE JUAN DE OROZCO OTE. TRAMO: DE PORTAL PADILLA A CALLE ALVARO OB,Unitario,0000000001,0000000001,0,NULL,Obra,0000000001,CAPTURADO 18/11/2010 ALMA    ,CONTRATADO,0
0000000382,2010,0389,"TRABAJOS COMPLEMENTARIOS EN PUENTE CRUZ DE CANTERA 6TA, ETAPA DE MALECON DEL RIO LOS GOMEZ CONTRUCCI",Unitario,0000000001,0000000001,0,NULL,Obra,0000000001,CAPTURADO 18/11/2010 ALMA  ,CONTRATADO,0
