Id_Obra,Año,Clave_Obra,Nombre,Tipo_Precio,Id_Sub_Programa,Id_Localidad,Beneficiarios,Id_Convenio,Tipo_Obra_Proyecto,Id_Sub_Tipo_Obra,Observaciones,Enviar_Para,Id_Oficio_Asignacion_Obra
0000000001,2010,0033,DESMANTELAMIENTO DE CRISTALERIA Y HERRERIA EDIFICIO MONTES DE OCA CALLE PEDRO MORENO ZONA CENTRO,Unitario,0000000001,0000000001,0,NULL,Obra,0000000001,CAPTURADO 26/03/2010  ALX,CONTRATADO,0
0000000002,2010,0035,REHABILITACION DE LOS PAVIMENTOS EN LA ZONA SUR PONIENTE DE LA CIUDAD LEON,Unitario,0000000001,0000000001,0,NULL,Obra,0000000001,CAPTURADO 05/04/2010  ALX,CONTRATADO,0
0000000003,2010,0036,REHABILITACION DE LOS PAVIMENTOS EN LA ZONA NOR PONIENTE DE LA CIUDAD LEON,Unitario,0000000001,0000000001,0,NULL,Obra,0000000001,capturado 07/04/2010  ALX,CONTRATADO,0
0000000004,2010,0026,PROYECTO EJECUTIVO DE PAVIMENTACION DE LAS CALLES : ANDRES QUINTANA ROO TRAMO; PLUTARCO ELIAS CALLES,Unitario,0000000001,0000000001,0,NULL,Obra,0000000001,CAPTURADO 07/04/2010  ALX,CONTRATADO,0
0000000005,2010,0038,REHABILITACION DE LOS PAVIMENTOS EN LA ZONA SUR ORIENTE DE LA CIUDAD,Unitario,0000000001,0000000001,0,NULL,Obra,0000000001,CAPTURA 12/04/2010 SHANTAL,CONTRATADO,0
0000000006,2010,0008,PROYECTO EJECUTIVO DE LAS CALLES: DEL CAPOTE TRAMO: DEL TORERO-AV- CENTRAL COL. PLAZA DE TOROS II,Unitario,0000000001,0000000001,0,NULL,Obra,0000000001,08/04/2010 SHANTAL,CONTRATADO,0
0000000007,2010,0009,PROYECTO EJECUTIVO DE LAS CALLES: JEREZ DE LULE TRAMO: BLVD. DELTA DE JEREZ - JEREZ DE ANTAÑO COL. V,Unitario,0000000001,0000000001,0,NULL,Obra,0000000001,09/04/2010 SHANTAL,CONTRATADO,0
0000000008,2010,0032,PAVIMENTACION DE LA CALLE CIRCUITO ANTONIO VELAZQUEZ TRAMO: DEL TORERO - PAVIMENTO COL. PLAZA DE TOR,Unitario,0000000001,0000000001,0,NULL,Obra,0000000001,12/04/2010 SHANTAL,CONTRATADO,0
0000000009,2010,0030,PUENTE VERTIZ  BICENTENARIO Y PUENTE LA LUZ BICENTENARIO ( PRIMERA ETAPA PAVIMENTACION DE LA INTERSE,Unitario,0000000001,0000000001,0,NULL,Obra,0000000001,12/04/2010 SHANTAL,CONTRATADO,0
0000000010,2010,0023,PROYECTO EJECUTIVO DE LAS CALLES: CALLE 26 DE AGOSTO TRAMO: LUCIO CABAÑAS - MISAEL NUÑEZ COL. MORELO,Unitario,0000000001,0000000001,0,NULL,Obra,0000000001,14/04/2010 SHANTAL,CONTRATADO,0
0000000011,2010,0012,PROYECTO EJECUTIVO DE LAS CALLES: ALMENDRO TRAMO: ALAMO - AVELLANO COL. ARBOLEDAS DE INFONAVIT; AVEL,Unitario,0000000001,0000000001,0,NULL,Obra,0000000001,13/04/2010 SHANTAL,CONTRATADO,0
0000000012,2010,0010,PROYECTO EJECUTIVO DE LAS CALLES: 2DO. ANDADOR HUIMILPAN TRAMO: HUIMILPAN - MAYAGUEZ COL. EL PALOTE,Unitario,0000000001,0000000001,0,NULL,Obra,0000000001,13/04/2010 SHANTAL,CONTRATADO,0
0000000013,2010,0022,PROYECTO EJECUTIVO DE LAS CALLES: H. SYUNTSMIENTO TRAMO: ARTICULO 123 - BLVD. TIMOTEO LOZANO COL. LI,Unitario,0000000001,0000000001,0,NULL,Obra,0000000001,13/04/2010 SHANTAL,CONTRATADO,0
0000000014,2010,0004,PROYECTO EJECUTIVO DE LAS CALLES: ARTICULO 27 TRAMO: TIMOTEO LOZANO - ASAMBLEA DE QUERETARO COL. LIB,Unitario,0000000001,0000000001,0,NULL,Obra,0000000001,13/04/2010 SHANTAL,CONTRATADO,0
0000000015,2010,0021,PROYECTO EJECUTIVO DE LAS CALLES: NITROGENO TRAMO: MAGNESIO - HELIO COL. VALLE DE SEÑORA; CALLE COST,Unitario,0000000001,0000000001,0,NULL,Obra,0000000001,14/04/2010 SHANTAL,CONTRATADO,0
0000000016,2010,0039,PAVIMENTACION DE LA CALLE ALONSO ESPINO TRAMO: CALLE BERNARDO CHAVEZ A RIO USUMACINTA COL. LOS FRESN,Unitario,0000000001,0000000001,0,NULL,Obra,0000000001,15/04/2010 SHANTAL,CONTRATADO,0
0000000017,2010,0017,"PROGRAMA SIT SISTEMA INTEGRADO DE TRANSPORTE, SUMINISTRO E INSTALACION DE CONTROLADORES PARA SEMAFOR",Unitario,0000000001,0000000001,0,NULL,Obra,0000000001,14/04/2010 SHANTAL,CONTRATADO,0
0000000018,2010,0018,"MANTENIMIENTO A LOS ELEMENTOS DEL PARQUE HIDALGO, DISTRIBUIDOR VIAL JUAN PABLO II, PARQUE BENITO JUA",Unitario,0000000001,0000000001,0,NULL,Obra,0000000001,14/04/2010,CONTRATADO,0
0000000019,2010,0016,"PROGRAMA SIT SISTEMA INTEGRADO DE TRANSPORTE, SEMAFORIZACION DEL CORREDOR BLVD. TORRES LANDA TRAMO:",Unitario,0000000001,0000000001,0,NULL,Obra,0000000001,14/04/2010 SHANTAL,CONTRATADO,0
0000000020,2010,0028,PROYECTO  EJECUTIVO DE PAVIMENTACION DE LAS CALLES: JEREZ DE SEVILLA TRAMO: JEREZ DE CASTILLA - JERE,Unitario,0000000001,0000000001,0,NULL,Obra,0000000001,14/04/2010 SHANTAL,CONTRATADO,0
0000000021,2010,0015,SUBCOMANDANCIA DE POLICIA ( CONSTRUCCION DE BARDA EN LA DELEGACION DE POLICIA SUR EN LA CARRETERA LE,Unitario,0000000001,0000000001,0,NULL,Obra,0000000001,14/04/2010 SHANTAL,CONTRATADO,0
0000000022,2010,0037,REHABILITACION DE LOS PAVIMENTOS EN LA ZONA NOR ORIENTE DE LA CIUDAD LEON,Unitario,0000000001,0000000001,0,NULL,Obra,0000000001,14/04/2010 SHANTAL,CONTRATADO,0
0000000023,2010,0034,REHABILITACION DE LOS PAVIMENTOS EN LA ZONA CENTRO DE LA CIUDAD LEON,Unitario,0000000001,0000000001,0,NULL,Obra,0000000001,14/04/2010 SHANTAL,CONTRATADO,0
0000000024,2010,0031,CONSTRUCCION DE CICLOVIA EN LA CALLE OCEANO INDICO - AV. DEL CANAL TRAMO: DEL BLVD. INSURGENTES A BL,Unitario,0000000001,0000000001,0,NULL,Obra,0000000001,14/04/2010 SHANTAL,CONTRATADO,0
0000000025,2010,0002,PROYECTO EJECUTIVO  DE LA CALLE 14 DE MAYO TRAMO: BLVD. JUAN JOSE TORRES LANDA A TIMOTEO LOZANO COL.,Unitario,0000000001,0000000001,0,NULL,Obra,0000000001,14/04/2010 SHANTAL,CONTRATADO,0
0000000026,2010,0019,PROYECTO EJECUTIVO DE LAS CALLES: MADRE MONICA TRAMO: MADRE TIERRA - CERRO DEL ZOYATE COL. DIEZ DE M,Unitario,0000000001,0000000001,0,NULL,Obra,0000000001,14/04/2010 SHANTAL,CONTRATADO,0
0000000027,2010,0005,PROYECTO EJECUTIVO DE LAS CALLES: ATANACIO HERNANDEZ TRAMO: MARIANO ESCOBEDO - MANUEL VALTIERRA COL.,Unitario,0000000001,0000000001,0,NULL,Obra,0000000001,14/04/2010 SHANTAL,CONTRATADO,0
0000000028,2010,0020,PROYECTO EJECUTIVO DE LAS CALLES: LAGO ALBERTO TRAMO: LAGO ZUMPANGO - TOPAR CON PAVIMENTO SUR COL. I,Unitario,0000000001,0000000001,0,NULL,Obra,0000000001,14/04/2010 SHANTAL,CONTRATADO,0
0000000029,2010,0013,EJE METROPOLITANO LEON- SILAO ( TRAMO: BLVD. JOSE MARIA MORELOS - BLVD. DELTA ) PAVIMENTACION CUERPO,Unitario,0000000001,0000000001,0,NULL,Obra,0000000001,15/04/2010 SHANTAL      ,CONTRATADO,0
0000000030,2010,0014,EJE METROPOLITANO LEON - SILAO ( TRAMO: BLVD. JOSE MARIA MORELOS - BLVD. DELTA ) ALUMBRADO Y ELECTRI,Unitario,0000000001,0000000001,0,NULL,Obra,0000000001,15/04/2010 SHANTAL,CONTRATADO,0
0000000031,2010,0011,PROYECTO EJECUTIVO DE LA INTERSECCION A DESNIVEL DEL BLVD. JOSE MARIA MORELOS Y BLVD. ANTONIO MADRAZ,Unitario,0000000001,0000000001,0,NULL,Obra,0000000001,15/04/2010 SHANTAL,CONTRATADO,0
0000000032,2010,0025,"PROYECTO GEOMETRICO, ESTUDIOS TOPOGRAFICOS Y FICHAS DE AFECTACIONES DEL BLVD. MORELOS TRAMO: DE BLVD",Unitario,0000000001,0000000001,0,NULL,Obra,0000000001,15/04/2010 SHANTAL,CONTRATADO,0
0000000033,2010,0001,PROYECTO EJECUTIVO DE LAS CALLES: MATILDE MONTOYA TRAMO: SOFIA ALVAREZ A ESPERANZA IRIS COL. LOS OLI,Unitario,0000000001,0000000001,0,NULL,Obra,0000000001,15/04/2010 SHANTAL,CONTRATADO,0
0000000034,2010,0029,BLVD. DELTA EN EL TRAMO: DE LA VIALIDAD DEL EJE METROPOLITANO DEL BLVD. JUAN ALONSO DE TORRES A BLVD,Unitario,0000000001,0000000001,0,NULL,Obra,0000000001,15/04/2010 SHANTAL,CONTRATADO,0
0000000035,2010,0041,"BLVD. DELTA EN EL TRAMO: DE LA VIALIDAD DEL EJE METROPOLITANO, DEL BLVD. JUAN ALONSO DE TORRES A BLV",Unitario,0000000001,0000000001,0,NULL,Obra,0000000001,15/04/2010 SHANTAL,CONTRATADO,0
0000000036,2010,0070,MANTENIMIENTO INTEGRAL DE PARQUES Y JARDINES PARA LA ZONA URBANA XV LEON,Unitario,0000000001,0000000001,0,NULL,Obra,0000000001,15/04/2010 SHANTAL,CONTRATADO,0
0000000037,2010,0073,TRABAJOS COMPLEMENTARIOS DEL PROYECTO EJECUTIVO DE LA CALLE CHAYOTE TRAMO: CANDELARIA - PALO CUARTO,Unitario,0000000001,0000000001,0,NULL,Obra,0000000001,15/04/2010 SHANTAL,CONTRATADO,0
0000000038,2010,0063,MANTENIMIENTO INTEGRAL DE PARQUES Y JARDINES PARA LA ZONA AREAS VERDES DE MINIDEPORTIVAS COMUDE LEON,Unitario,0000000001,0000000001,0,NULL,Obra,0000000001,15/04/2010 SHANTAL,CONTRATADO,0
0000000039,2010,0040,SUBESTACION DE 45 KVA PARA LA BASE DE SEGURIDAD DEL ESTADO UBICADA EN LA CARRETERA LEON - SAN FRANCI,Unitario,0000000001,0000000001,0,NULL,Obra,0000000001,15/04/2010 SHANTAL,CONTRATADO,0
0000000040,2010,0042,"MANTENIMIENTO INTEGRAL DE PARQUES Y JARDINES PARA LA ZONA URBANA I LEON, GTO",Unitario,0000000001,0000000001,0,NULL,Obra,0000000001,15/04/2010,CONTRATADO,0
0000000041,2010,0054,MANTENIMIENTO INTEGRAL DE PARQUES Y JARDINES PARA LA ZONA URBANA XIV LEON GTO,Unitario,0000000001,0000000001,0,NULL,Obra,0000000001,19/04/2010 SHANTAL,CONTRATADO,0
0000000042,2010,0052,MANTENIMIENTO INTEGRAL DE PARQUES Y JARDINES PARA LA ZONA URBANA XII LEON GTO,Unitario,0000000001,0000000001,0,NULL,Obra,0000000001,19/04/2010,CONTRATADO,0
0000000043,2010,0053,MANTENIMIENTO INTEGRAL DE PARQUES Y JARDINES PARA LA ZONA URBANA XIII LEON GTO,Unitario,0000000001,0000000001,0,NULL,Obra,0000000001,19/04/2010 SHANTAL,CONTRATADO,0
0000000044,2010,0051,"MANTENIMIENTO INTEGRAL DE PARQUES Y JARDINES PARA LA ZONA URBANA XI LEON, GTO",Unitario,0000000001,0000000001,0,NULL,Obra,0000000001,19/04/2010 SHANTAL,CONTRATADO,0
0000000045,2010,0050,MANTENIMIENTO INTEGRAL DE PARQUES Y JARDINES PARA LA ZONA URBANA X LEON GTO,Unitario,0000000001,0000000001,0,NULL,Obra,0000000001,19/04/2010 SHANTAL,CONTRATADO,0
0000000046,2010,0043,MANTENIMIENTO INTEGRAL DE PARQUES Y JARDINES PARA LA ZONA URBANA II LEON GTO,Unitario,0000000001,0000000001,0,NULL,Obra,0000000001,20/04/2010 SHANTAL,CONTRATADO,0
0000000047,2010,0047,"MANTENIMIENTO INTEGRAL DE PARQUES Y JARDINES PARA LA ZONA URBANA VI LEON, GTO",Unitario,0000000001,0000000001,0,NULL,Obra,0000000001,20/04/2010 SHANTAL,CONTRATADO,0
0000000048,2010,0046,MANTENIMIENTO INTEGRAL DE PARQUES Y JARDINES PARA LA ZONA URBANA V LEON GTO,Unitario,0000000001,0000000001,0,NULL,Obra,0000000001,20/04/2010 SHANTAL,CONTRATADO,0
0000000049,2010,0045,MANTENIMIENTO INTEGRAL DE PARQUES Y JARDINES PARA LA ZONA URBANA IV LEON GTO,Unitario,0000000001,0000000001,0,NULL,Obra,0000000001,20/04/2010 SHANTAL,CONTRATADO,0
0000000050,2010,0044,MANTENIMIENTO INTEGRAL DE PARQUES Y JARDINES PARA LA ZONA URBANA III LEON GTO,Unitario,0000000001,0000000001,0,NULL,Obra,0000000001,20/04/2010,CONTRATADO,0
0000000051,2010,0007,PROYECTO EJECUTIVO DE LAS CALLES: DURAZNO TRAMO: MANUEL GONZALEZ-TOPAR COL. LAS MANDARINAS; CALLE JI,Unitario,0000000001,0000000001,0,NULL,Obra,0000000001,20/04/2010 SHANTAL,CONTRATADO,0
0000000052,2010,0027,PROYECTO EJECUTIVO DE PAVIMENTACION DE LAS CALLES: FRESNO TRAMO: ARCE-PALMERIN COL. ARBOLEDAS DE INF,Unitario,0000000001,0000000001,0,NULL,Obra,0000000001,20/04/2010 SHANTAL,CONTRATADO,0
0000000053,2010,0024,PROYECTO EJECUTIVO DE LAS CALLES: ANTONIO BARROSO TRAMO: BLVD. MARIANO ESCOBEDO-LEON II; CALLE ESTEB,Unitario,0000000001,0000000001,0,NULL,Obra,0000000001,20/04/2010 SHANTAL,CONTRATADO,0
0000000054,2010,0055,MANTENIMIENTO INTEGRAL DE PARQUES Y JARDINES PARA LA ZONA URBANA XVII LEON GTO,Unitario,0000000001,0000000001,0,NULL,Obra,0000000001,20/04/2010 SHANTAL,CONTRATADO,0
0000000055,2010,0056,"MANTENIMIENTO INTEGRAL DE PARQUES Y JARDINES PARA LA ZONA URBANA XVI LEON, GTO",Unitario,0000000001,0000000001,0,NULL,Obra,0000000001,20/04/2010 SHANTAL,CONTRATADO,0
0000000056,2010,0058,MANTENIMIENTO INTEGRAL DE PARQUES Y JARDINES PODA DE ARBOLES ZONA SUR LEON,Unitario,0000000001,0000000001,0,NULL,Obra,0000000001,20/04/2010 SHANTAL,CONTRATADO,0
0000000057,2010,0048,"MANTENIMIENTO INTEGRAL DE PARQUES Y JARDINES PARA LA ZONA URBANA VII LEON, GTO",Unitario,0000000001,0000000001,0,NULL,Obra,0000000001,21/04/2010 SHANTAL,CONTRATADO,0
0000000058,2010,0066,MANTENIMIENTO INTEGRAL DE PARQUES Y JARDINES PARA LA ZONA URBANA VIII LEON,Unitario,0000000001,0000000001,0,NULL,Obra,0000000001,21/04/2010  SHANTAL,CONTRATADO,0
0000000059,2010,0071,PROYECTO EJECUTIVO MONUMENTO AL BICENTENARIO INTERSECCION DE BLVD. MORELOS Y BLVD. PASEO DE LOS INSU,Unitario,0000000001,0000000001,0,NULL,Obra,0000000001,21/04/2010 SHANTAL,CONTRATADO,0
0000000060,2010,0072,"PROYECTO EJECUTIVO DE LA PLAZA DEL MUSICO, PARQUE MORELOS (CALLE DE LOS PARAISOS, LAGO DE CHALCO, AL",Unitario,0000000001,0000000001,0,NULL,Obra,0000000001,21/04/2010 SHANTAL,CONTRATADO,0
0000000061,2010,0075,MURO DE CONTENCION EN LA ESTACION DE TRANSFERENCIA SAN JUAN BOSCO LEON,Unitario,0000000001,0000000001,0,NULL,Obra,0000000001,21/04/2010 SHANTAL,CONTRATADO,0
0000000062,2010,0069,MANTENIMIENTO INTEGRAL DE PARQUES Y JARDINES PARA LA ZONA URBANA IX LEON,Unitario,0000000001,0000000001,0,NULL,Obra,0000000001,21/04/2010 SHANTAL,CONTRATADO,0
0000000063,2010,0076,MURO DE CONTENCION DE GAVIONES PARA LA VIALIDAD EN EL BLVD. SAN JUAN BOSCO TRAMO: EN EL QUE COMPREND,Unitario,0000000001,0000000001,0,NULL,Obra,0000000001,22/04/2010 SHANTAL,CONTRATADO,0
0000000064,2010,0074,PROYECTO EJECUTIVO DE LA RUTA DEL PEATON CENTRO HISTORICO-BARRIO ARRIBA-CALVARIO.LEON,Unitario,0000000001,0000000001,0,NULL,Obra,0000000001,21/04/2010 SHANTAL,CONTRATADO,0
0000000065,2010,0062,MANTENIMIENTO INTEGRAL DE PARQUES Y JARDINES PARA LA ZONA URBANA DISTRIBUIDOR VIAL Y BLVD. AEROPUERT,Unitario,0000000001,0000000001,0,NULL,Obra,0000000001,22/04/2010 SHANTAL,CONTRATADO,0
0000000066,2010,0003,PROYECTO EJECUTIVO DE LAS CALLES: BARODA TRAMO: CANAL DE SARDANETA-TIBET COL. CAÑON DE LA INDIA; BIR,Unitario,0000000001,0000000001,0,NULL,Obra,0000000001,24/04/2010 SHANTAL,CONTRATADO,0
0000000067,2010,0006,PROYECTO EJECUTIVO DE LAS CALLES: ANTONIO TORRES GOMEZ TRAMO: RAFAEL CORRALES AYALA-STO. TOMAS DE AQ,Unitario,0000000001,0000000001,0,NULL,Obra,0000000001,27/04/2010 SHANTAL,CONTRATADO,0
0000000068,2010,0064,PROYECTO EJECUTIVO DE PAVIMENTACION DE LAS CALLES: BUFAS DE TEQUISQUIAPAN TRAMO: VOLCAN DE JORULLO-C,Unitario,0000000001,0000000001,0,NULL,Obra,0000000001,27/04/2010 SHANTAL,CONTRATADO,0
0000000069,2010,0057,MANTENIMIENTO INTEGRAL DE PARQUES Y JARDINES PODA DE ARBOLES ZONA NORTE LEON,Unitario,0000000001,0000000001,0,NULL,Obra,0000000001,27/04/2010 SHANTAL,CONTRATADO,0
0000000070,2010,0059,MANTENIMIENTO INTEGRAL DE PARQUES Y JARDINES PODA DE ARBOLES ZONA CENTRO LEON,Unitario,0000000001,0000000001,0,NULL,Obra,0000000001,27/04/2010 SHANTAL,CONTRATADO,0
0000000071,2010,0060,MANTENIMIENTO INTEGRAL DE PARQUES Y JARDINES PARA LA ZONA URBANA MALECON DEL RIO LEON,Unitario,0000000001,0000000001,0,NULL,Obra,0000000001,27/04/2010 SHANTAL,CONTRATADO,0
0000000072,2010,0061,MANTENIMIENTO INTEGRAL DE PARQUES Y JARDINES PARA LA ZONA DE OFICINAS MUNICIPALES LEON,Unitario,0000000001,0000000001,0,NULL,Obra,0000000001,27/04/2010 SHANTAL,CONTRATADO,0
0000000073,2010,10001,PROTECCION PARA PERITAJE DE SINIESTRO MERCADO COMONFORT LEON,Unitario,0000000001,0000000001,0,NULL,Obra,0000000001,28/04/2010 SHANTAL,CONTRATADO,0
0000000074,2010,0067,"BLVD. DELTA EN EL TRAMO: DE LA VIALIDAD DEL EJE METROPOLITANO, DEL BLVD. JUAN ALONSO DE TORRES A BLV",Unitario,0000000001,0000000001,0,NULL,Obra,0000000001,29/04/2010,CONTRATADO,0
0000000075,2010,0083,PROYECTO EJECUTIVO DE PASO A DESNIVEL EN LA INTERSECCION DEL BLVD. JOSE MARIA MORELOS Y BLVD. IBARRI,Unitario,0000000001,0000000001,0,NULL,Obra,0000000001,29/04/2010 SHANTAL,CONTRATADO,0
0000000076,2010,0087,PROYECTO EJECUTIVO DEL PASO SUPERIOR VEHICULAR EN LA INTERSECCION DEL BLVD. JOSE MARIA MORELOS Y BLV,Unitario,0000000001,0000000001,0,NULL,Obra,0000000001,30/04/2010 SHANTAL,CONTRATADO,0
0000000077,2010,0095,PROYECTO EJECUTIVO DE 4 PUENTES PEATONALES SOBRE BLVD. MORELOS EN EL TRAMO DE AV. OLIMPICA A CALLE P,Unitario,0000000001,0000000001,0,NULL,Obra,0000000001,30/04/2010 SHANTAL,CONTRATADO,0
0000000078,2010,0097,PROYECTO EJECUTIVO DE LA INTERSECCION A DESNIVEL DEL BLVD. JOSE MARIA MORELOS Y BLVD. HILARIO MEDINA,Unitario,0000000001,0000000001,0,NULL,Obra,0000000001,30/04/2010 SHANTAL,CONTRATADO,0
0000000079,2010,0099,PROYECTO EJECUTIVO DE PASO A DESNIVEL DEL BLVD. JOSE MARIA MORELOS Y BLVD. TELLEZ CRUCES VARIAS COLO,Unitario,0000000001,0000000001,0,NULL,Obra,0000000001,30/04/2010 SHANTAL,CONTRATADO,0
0000000080,2010,0086,PROYECTO EJECUTIVO DE PUENTE PEATONAL (BLVD. PASEO DE LOS INSURGENTES FRENTE AL IMSS) LEON,Unitario,0000000001,0000000001,0,NULL,Obra,0000000001,30/04/2010 SHANTAL,CONTRATADO,0
0000000081,2010,0098,TRABAJOS COMPLEMENTARIOS EN LA CONSTRUCCION DE VIALIDADES INTERIORES DE LA ESTACION DE TRANSFERENCIA,Unitario,0000000001,0000000001,0,NULL,Obra,0000000001,30/04/2010 SHANTAL,CONTRATADO,0
0000000082,2010,0093,"PROYECTO GEOMETRICO, ESTUDIOS TOPOGRAFICOS Y FICHAS DE AFECTACION DEL BLVD. MIGUEL DE CERVANTES SAAV",Unitario,0000000001,0000000001,0,NULL,Obra,0000000001,30/04/2010 SHANTAL,CONTRATADO,0
0000000083,2010,0096,PROYECTO EJECUTIVO DE PUENTE CENTRAL (2) EN BLVD. JOSE MARIA MORELOS INTERSECCION BLVD. HERMENEGILDO,Unitario,0000000001,0000000001,0,NULL,Obra,0000000001,30/04/2010 SHANTAL,CONTRATADO,0
0000000084,2010,0082,TRABAJOS COMPLEMENTARIOS DEL PROYECTO EJECUTIVO DE LAS CALLES: COALCOMAN TRAMO: URUAPAN-MARAVATIO Y,Unitario,0000000001,0000000001,0,NULL,Obra,0000000001,04/05/2010 SHANTAL,CONTRATADO,0
0000000085,2010,0090,CUBIERTA PARA RAMPA DEL ANDEN "C" DE LA ESTACIÓN DE TRANSFERENCIA DE SAN JUAN BOSCO LEON,Unitario,0000000001,0000000001,0,NULL,Obra,0000000001,04/05/2010 SHANTAL,CONTRATADO,0
0000000086,2010,0049,"PERITAJE ESTRUCTURAL DEL MERCADO COMONFORT EN LA CIUDAD DE LEON, GTO",Unitario,0000000001,0000000001,0,NULL,Obra,0000000001,04/05/2010 SHANTAL,CONTRATADO,0
0000000087,2010,0084,ADECUACION DE PROYECTO EJECUTIVO DE LA REACTIVACION DEL CORREDOR LOPEZ MATEOS TRAMO: HIDALGO- HERMAN,Unitario,0000000001,0000000001,0,NULL,Obra,0000000001,04/05/2010 SHANTAL,CONTRATADO,0
0000000088,2010,0078,PROTECCION Y BANQUETAS EN EL CENTRO DE CONTROL DE RADIOCOMUNICACION 066 FRACC. EL FARO LEON,Unitario,0000000001,0000000001,0,NULL,Obra,0000000001,04/05/2010 SHANTAL,CONTRATADO,0
0000000089,2010,0085,PROYECTO DE AMPLIACION DE AMPLIACION DE REHABILITACION DE LA IMAGEN URBANA DE LA RUTA DEL PEATON CAL,Unitario,0000000001,0000000001,0,NULL,Obra,0000000001,04/05/2010 SHANTAL,CONTRATADO,0
0000000090,2010,0091,PROYECTO EJECUTIVO DE PAVIMENTACION DE LA CALLE: MERCURIO TRAMO: BLVD. HERMENEGILDO BUSTOS-BLVD. HID,Unitario,0000000001,0000000001,0,NULL,Obra,0000000001,26/05/2010 SHANTAL,CONTRATADO,0
0000000091,2010,0092,PROYECTO EJECUTIVO DE LAS CALLES: MAR MEDITERRANEO TRAMO: DE CERVANTES A LAGO CUITZEO; LAGO SANTA MA,Unitario,0000000001,0000000001,0,NULL,Obra,0000000001,28/05/2010 SHANTAL        ,CONTRATADO,0
0000000092,2010,0081,ELABORACION BASE DE DATOS SISCOM 2010-LEON,Unitario,0000000001,0000000001,0,NULL,Obra,0000000001,28/05/2010 SHANTAL,CONTRATADO,0
0000000093,2010,0079,AMPLIACION DE ELECTRIFICACION REUBICACION DE LA LINEA DE MEDIA Y BAJA TENSION Y LINEA DE ALUMBRADO P,Unitario,0000000001,0000000001,0,NULL,Obra,0000000001,28/05/2010 SHANTAL,CONTRATADO,0
0000000094,2010,0100,PROYECTO EJECUTIVO DE PAVIMENTACION DE CAMINO NUEVO VALLE DE MORENO-DERRAMADERO-VAQUERIAS-ENTRONQUE,Unitario,0000000001,0000000001,0,NULL,Obra,0000000001,29/05/2010 SHANTAL,CONTRATADO,0
0000000095,2010,0101,MANTENIMIENTO DE PLAZAS EN ZONA RURAL LEON,Unitario,0000000001,0000000001,0,NULL,Obra,0000000001,31/05/2010 SHANTAL,CONTRATADO,0
0000000096,2010,0119,PROYECTO EJECUTIVO DE LAS CALLES: CERRODE SAN MIGUEL TRAMO: PEÑON DE GIBRALTAR A CERRITO DE JEREZ; C,Unitario,0000000001,0000000001,0,NULL,Obra,0000000001,02/06/2010 SHANTAL,CONTRATADO,0
0000000097,2010,0117,PROYECTO EJECUTIVO DE LAS CALLES: KIWI TRAMO: ALCE A BISONTE; CASTOR TRAMO: ALCE A ABEJA; COBRA TRAM,Unitario,0000000001,0000000001,0,NULL,Obra,0000000001,03/06/2010 SHANTAL,CONTRATADO,0
0000000098,2010,0113,PROYECTO EJECUTIVO DE LAS CALLES: CARLOS HERRERA MARMOLEJO TRAMO: JESUS YAÑEZ A MARIANO HUELGA; CALL,Unitario,0000000001,0000000001,0,NULL,Obra,0000000001,03/06/2010 SHANTAL,CONTRATADO,0
0000000099,2010,0103,PROYECTO EJECUTIVO DE PARQUE LINEAL DEL CANAL DE SARDANETA TRAMO: IBARRILLA- PRESA DEL PALOTE LEON,Unitario,0000000001,0000000001,0,NULL,Obra,0000000001,03/06/2010 SHANTAL,CONTRATADO,0
0000000100,2010,0110,IMPERMEABILITACION DEL EDIFICIO DE DESARROLLO URBANO (GARANTIA 10 AÑOS) LEON,Unitario,0000000001,0000000001,0,NULL,Obra,0000000001,03/06/2010 SHANTAL  ,CONTRATADO,0
0000000101,2010,0107,PROYECTO EJECUTIVO DE LAS CALLES: ETA TRAMO: JEREZ DE CARTAGENA A CERRITO DE JEREZ; CERRO GORDO TRAM,Unitario,0000000001,0000000001,0,NULL,Obra,0000000001,03/06/2010 SHANTAL,CONTRATADO,0
0000000102,2010,0106,PROYECTO EJECUTIVO DE LAS CALLES: ARDILLA TRAMO: GAMO A HIENA;CALLE ARDILLA TRAMO: IGUANA A TOPAR; C,Unitario,0000000001,0000000001,0,NULL,Obra,0000000001,03/06/2010 SHANTAL,CONTRATADO,0
0000000103,2010,0105,PROYECTO EJECUTIVO DE LA CALLES: AV. PASEO DE LAS LIEBRES TRAMO:AHUHUETE-BLVD. MIGUEL DE CERVANTES S,Unitario,0000000001,0000000001,0,NULL,Obra,0000000001,07/06/2010 SHANTAL,CONTRATADO,0
0000000104,2010,0102,CONSTRUCCIÓN DE GAVETAS DE ADULTO EN EL PANTEON MUNICIPAL NORTE Y GAVETAS DE ADULTO EN LAS COMUNIDAD,Unitario,0000000001,0000000001,0,NULL,Obra,0000000001,07/06/2010 SHANTAL,CONTRATADO,0
0000000105,2010,0080,REUBICACION DEL MONUMENTO A GAONA LEON,Unitario,0000000001,0000000001,0,NULL,Obra,0000000001,08/06/2010 SHANTAL,CONTRATADO,0
0000000106,2010,0115,PROYECTO EJECUTIVO DE LAS CALLES: MADRE GLORIA TRAMO: DE MADRE SELVA A MADRE MARINA COL. 10 DE MAYO,Unitario,0000000001,0000000001,0,NULL,Obra,0000000001,08/06/2010 SHANTAL,CONTRATADO,0
0000000107,2010,0077,CONSTRUCCION DE MURO PERIMETRAL EN LA ESCUELA PRIMARIA MARIA TERESA GARCIA DE TORRES LANDA EN CALLE,Unitario,0000000001,0000000001,0,NULL,Obra,0000000001,09/06/2010 SHANTAL,CONTRATADO,0
0000000108,2010,0130,PAVIMENTACION CALLE ARAUCARIA TRAMO: AV. GUTY CARDENAS A CALLE JACARANDA COL. ARBOLEDAS,Unitario,0000000001,0000000001,0,NULL,Obra,0000000001,11/06/2010 SHANTAL,CONTRATADO,0
0000000109,2010,0088,"ESTUDIO DEL ANALISIS COSTO-BENEFICIO DE LOS PROGRAMAS Y ESTUDIOS DE INVERSION, DE LA VIA RAPIDA JOSE",Unitario,0000000001,0000000001,0,NULL,Obra,0000000001,11/06/2010 SHANTAL,CONTRATADO,0
0000000110,2010,0121,BLVD. DELTA EN EL TRAMO DE LA VIALIDAD DEL EJE METROPOLITANO DEL BLVD. JUAN ALONSO DE TORRES A BLVD.,Unitario,0000000001,0000000001,0,NULL,Obra,0000000001,11/06/2010 SHANTAL,CONTRATADO,0
0000000111,2010,0116,PROYECTO EJECUTIVO DE LAS CALLES: JESUS CASTORENA TRAMO: DE JOAQUIN OBREGON GONZALEZ A ANTONIO TORRE,Unitario,0000000001,0000000001,0,NULL,Obra,0000000001,11/06/2010 SHANTAL,CONTRATADO,0
0000000112,2010,0114,PAVIMENTACION DE LA CALLE ENRIQUE MENDOZA TRAMO: SANTO TOMAS DE AQUINO A BLVD. CORRALES AYALA COL. S,Unitario,0000000001,0000000001,0,NULL,Obra,0000000001,11/06/2010 SHANTAL,CONTRATADO,0
0000000113,2010,0112,PAVIMENTACION CALLE TABACHIN TRAMO: MAGNOLIA A AV. CEDRO COL. LAS ARBOLEDAS,Unitario,0000000001,0000000001,0,NULL,Obra,0000000001,14/06/2010 SHANTAL,CONTRATADO,0
0000000114,2010,0111,PAVIMENTACION DE LA CALLE MAGNOLIA TRAMO: DE AV. GUTY CARDENAS A CALLE JACARANDA COL. ARBOLEDAS,Unitario,0000000001,0000000001,0,NULL,Obra,0000000001,14/06/2010 SHANTAL,CONTRATADO,0
0000000115,2010,0104,PROYECTO EJECUTIVO DE LA CALLES: CERRO DE CULIACAN TRAMO: PEÑON DE GIBRALTAR A JEREZ DE CARTAGENA; C,Unitario,0000000001,0000000001,0,NULL,Obra,0000000001,16/06/2010 SHANTAL,CONTRATADO,0
0000000116,2010,0108,REHABILITACION DE BANQUETAS CALLE PLAZA SAN JUAN FTE. AL NO. 135- COL. EL COECILLO,Unitario,0000000001,0000000001,0,NULL,Obra,0000000001,21/06/2010 SHANTAL,CONTRATADO,0
0000000117,2010,0089,"""ESTUDIO PARA LA PARTICIPACION PUBLICO-PRIVADA DE LOS PROGRAMAS  Y ESTUDIOS DE INVERSION, DE LA VIA",Unitario,0000000001,0000000001,0,NULL,Obra,0000000001,21/06/2010 SHANTAL,CONTRATADO,0
0000000118,2010,0122,DEMOLICION DEL EDIFICIO MONTES DE OCA-LEON,Unitario,0000000001,0000000001,0,NULL,Obra,0000000001,23/06/2010 SHANTAL,CONTRATADO,0
0000000119,2010,0120,PAVIMENTACION DE LA CALLE MERCURIO TRAMO: BLVD. HERMENEGILDO BUSTOS A BLVD. HIDALGO COL. HACIENDA DE,Unitario,0000000001,0000000001,0,NULL,Obra,0000000001,23/06/2010 SHANTAL,CONTRATADO,0
0000000120,2010,0118,PROYECTO EJECUTIVO DE LAS CALLES: ALCE TRAMO:ANTILOPE A BISONTE; LEOPARDO TRAMO: ALDE ARMADILLO; LEO,Unitario,0000000001,0000000001,0,NULL,Obra,0000000001,28/06/2010 SHANTAL,CONTRATADO,0
0000000121,2010,0109,MURO DE CONTENCION CON (GAVIONES Y MAMPOSTERIA) EN EL RIO DE LOS GOMEZ-COL. SANTA MARIA DE CEMENTOS,Unitario,0000000001,0000000001,0,NULL,Obra,0000000001,28/06/2010 SHANTAL,CONTRATADO,0
0000000122,2010,0065,PROYECTO EJECUTIVO EJE METROPOLITANO (BLVD. JUAN ALONSO DE TORRES ) IMAGEN URBANA EN BANQUETAS Y CAM,Unitario,0000000001,0000000001,0,NULL,Obra,0000000001,30/06/2010 SHANTAL,CONTRATADO,0
0000000123,2010,0123,PAVIMENTACION DE LA CALLE AVELLANO TRAMO: CALLE ROSSINI A TOPAR COL. ARBOLEDAS,Unitario,0000000001,0000000001,0,NULL,Obra,0000000001,07/07/2010 SHANTAL,CONTRATADO,0
0000000124,2010,0124,MANTENIMIENTO PREVENTIVO Y CORRECTIVO DE FUENTES EN VARIAS PARTES DE LA CIUDAD LEON,Unitario,0000000001,0000000001,0,NULL,Obra,0000000001,07/07/2010 SHANTAL,CONTRATADO,0
0000000125,2010,0125,PROYECTO EJECUTIVO DE LAS CALLES: JUAN MORALES TRAMO: FRANCISCO Z. MENA A JOSE PEREZ MARAÑON; MANUEL,Unitario,0000000001,0000000001,0,NULL,Obra,0000000001,08/07/2010 SHANTAL,CONTRATADO,0
0000000126,2010,0126,PROYECTO EJECUTIVO DE LAS CALLES: JUAN LICEAGA TRAMO:MANUEL BARANDA A ROMUALDO MARMOLEJO; CHAVEZ MOR,Unitario,0000000001,0000000001,0,NULL,Obra,0000000001,08/07/2010 SHANTAL,CONTRATADO,0
0000000127,2010,0127,PROYECTO EJECUTIVO DE LAS CALLES: CALAFIA TRAMO:BAYA A SARMIENTO COL. SAN JOSE DEL ALTO; DE LA HACIE,Unitario,0000000001,0000000001,0,NULL,Obra,0000000001,08/07/2010 SHANTAL,CONTRATADO,0
0000000128,2010,0128,REHABILITACION DE LOS PAVIMENTOS DEL CAMINO A LA HUIZACHERA TRAMO: DE GRANJA DE RECUPERACION SAN PED,Unitario,0000000001,0000000001,0,NULL,Obra,0000000001,08/07/2010 SHANTAL,CONTRATADO,0
0000000129,2010,0129,MANTENIMIENTO DE PLAZAS EN ZONA URBANA PAQUETE 1-LEON,Unitario,0000000001,0000000001,0,NULL,Obra,0000000001,08/07/2010 SHANTAL,CONTRATADO,0
